,TweetID,AuthorID,AuthorName,Tweets,arxiv_link,Abstract,Title
53,1161956394666528770,554306311,Oliver Shorttle,['How do planets receive their inventory of sulfur?  Our new paper led by @kamatahvel  takes a look at this <LINK> @EarthSciCam @cambridge_astro'],https://arxiv.org/abs/1908.05169,"Sulfur is one of the most abundant elements in the Universe, with important roles in astro-, geo-, and biochemistry. Its main reservoirs in planet-forming disks have previously eluded detection: gaseous molecules only account for $<1\,$\% of total elemental sulfur, with the rest likely in either ices or refractory minerals. Mechanisms such as giant planets can filter out dust from gas accreting onto disk-hosting stars. For stars above 1.4 solar masses, this leaves a chemical signature on the stellar photosphere that can be used to determine the fraction of each element that is locked in dust. Here, we present an application of this method to sulfur, zinc, and sodium. We analyse the accretion-contaminated photospheres of a sample of young stars and find $(89\pm8)\,$\% of elemental sulfur is in refractory form in their disks. The main carrier is much more refractory than water ice, consistent with sulfide minerals such as FeS. ",Abundant refractory sulfur in protoplanetary disks
54,1161891365585899522,72030668,Gilles Louppe,"['New paper by my student @WehenkelAntoine: Unconstrained Monotonic Neural Networks! <LINK> In this work, we show how to make use of free-form neural networks to model arbitrary monotonic functions and derive a new autoregressive flow. <LINK>', 'The UMNN architecture parameterizes a monotonic function F by its strictly positive derivative f modeled as a NN, which only constraint is the positiveness of its output.  The evaluation of F is then carried out by integrating f using Clenshaw-Curtis quadrature.', 'This is helpful because monotonicity enables invertibility and we do so without forcing hard constraints on the neural architecture (e.g., positive weights).  We just need the output to be positive!', 'Our main application is use UMNNs in combination with Masked Autogressive Networks to define a new invertible transformation, which we then compose into an autoregressive model. Results are competitive with NAF and BNAF. https://t.co/Sjaq5yNrbC']",https://arxiv.org/abs/1908.05164,"Monotonic neural networks have recently been proposed as a way to define invertible transformations. These transformations can be combined into powerful autoregressive flows that have been shown to be universal approximators of continuous probability distributions. Architectures that ensure monotonicity typically enforce constraints on weights and activation functions, which enables invertibility but leads to a cap on the expressiveness of the resulting transformations. In this work, we propose the Unconstrained Monotonic Neural Network (UMNN) architecture based on the insight that a function is monotonic as long as its derivative is strictly positive. In particular, this latter condition can be enforced with a free-form neural network whose only constraint is the positiveness of its output. We evaluate our new invertible building block within a new autoregressive flow (UMNN-MAF) and demonstrate its effectiveness on density estimation experiments. We also illustrate the ability of UMNNs to improve variational inference. ",Unconstrained Monotonic Neural Networks
55,1161838617196728321,945820508066590720,Buddhika Nettasinghe,"['Our new paper on Arxiv presents a ""friendship paradox"" based maximum likelihood estimation method for estimating network degree distributions . \n<LINK> <LINK>']",https://arxiv.org/abs/1908.00310,"This paper considers the problem of estimating a power-law degree distribution of an undirected network using sampled data. Although power-law degree distributions are ubiquitous in nature, the widely used parametric methods for estimating them (e.g. linear regression on double-logarithmic axes, maximum likelihood estimation with uniformly sampled nodes) suffer from the large variance introduced by the lack of data-points from the tail portion of the power-law degree distribution. As a solution, we present a novel maximum likelihood estimation approach that exploits the friendship paradox to sample more efficiently from the tail of the degree distribution. We analytically show that the proposed method results in a smaller bias, variance and a Cramer-Rao lower bound compared to the vanilla maximum-likelihood estimate obtained with uniformly sampled nodes (which is the most commonly used method in literature). Detailed numerical and empirical results are presented to illustrate the performance of the proposed method under different conditions and how it compares with alternative methods. We also show that the proposed method and its desirable properties (i.e. smaller bias, variance and Cramer-Rao lower bound compared to vanilla method based on uniform samples) extend to parametric degree distributions other than the power-law such as exponential degree distributions as well. All the numerical and empirical results are reproducible and the code is publicly available on Github. ","Maximum Likelihood Estimation of Power-law Degree Distributions via
  Friendship Paradox based Sampling"
56,1161830953536425984,41848191,Lesandro Ponciano,"['In the new paper ""Characterising Volunteers\' Task Execution Patterns Across Projects on Multi-Project Citizen Science Platforms"", @thiagomanel and I use GQM and SIM to examine how citizen scientists engage across science projects. #citsci #hcomp\n\nPreprint: <LINK> <LINK>']",https://arxiv.org/abs/1908.01344,"Citizen science projects engage people in activities that are part of a scientific research effort. On multi-project citizen science platforms, scientists can create projects consisting of tasks. Volunteers, in turn, participate in executing the project's tasks. Such type of platforms seeks to connect volunteers and scientists' projects, adding value to both. However, little is known about volunteer's cross-project engagement patterns and the benefits of such patterns for scientists and volunteers. This work proposes a Goal, Question, and Metric (GQM) approach to analyse volunteers' cross-project task execution patterns and employs the Semiotic Inspection Method (SIM) to analyse the communicability of the platform's cross-project features. In doing so, it investigates what are the features of platforms to foster volunteers' cross-project engagement, to what extent multi-project platforms facilitate the attraction of volunteers to perform tasks in new projects, and to what extent multi-project participation increases engagement on the platforms. Results from analyses on real platforms show that volunteers tend to explore multiple projects, but they perform tasks regularly in just a few of them; few projects attract much attention from volunteers; volunteers recruited from other projects on the platform tend to get more engaged than those recruited outside the platform. System inspection shows that platforms still lack personalised and explainable recommendations of projects and tasks. The findings are translated into useful claims about how to design and manage multi-project platforms. ","Characterising Volunteers' Task Execution Patterns Across Projects on
  Multi-Project Citizen Science Platforms"
57,1161644206626091015,2347666219,John F Donoghue,['Our new paper on the arrow of causality - including theories with arrows pointing both directions:\n\n<LINK>'],https://arxiv.org/abs/1908.04170,"Causality in quantum field theory is defined by the vanishing of field commutators for space-like separations. However, this does not imply a direction for causal effects. Hidden in our conventions for quantization is a connection to the definition of an arrow of causality, i.e. what is the past and what is the future. If we mix quantization conventions within the same theory, we get a violation of microcausality. In such a theory with mixed conventions the dominant definition of the arrow of causality is determined by the stable states. In some quantum gravity theories, such as quadratic gravity and possibly asymptotic safety, such a mixed causality condition occurs. We discuss some of the implications. ",The arrow of causality and quantum gravity
58,1161609761076498432,621147651,zpenoyre,['New paper out today - <LINK> - can we see and constrain planets by their relativistic beaming of light <LINK>'],https://arxiv.org/abs/1908.04602,"In this paper I show that the concept of relativistic beaming -- the process by which light emitted by a fast moving sources is lensed towards the direction of motion -- can be easily extended to model the signal from both the star and any secondary companions. Most companions will be cooler and less massive than their host star. Their lower mass leads to faster orbital velocities, and thus a potentially larger beaming effect. The lower temperature will mean that most of their light is emitted at longer wavelengths, where the relative photometric dominance of the primary is reduced. Thus for some systems, the secondary companion can be the main contributor to observed relativistic beaming signals at long wavelengths. Furthermore, if the system is observed over a range of wavelengths we can independently constrain the temperature of the companion, and the mass and radius ratio of the binary. To conclude I discuss the current and future observational prospects of this signal, using the properties of known exoplanets to show that such a signal may be observable by upcoming surveys. ","The Beam Balance -- Measuring Binary Systems via Relativistic Beaming
  Signals from Stars and their Companions"
59,1161545688662052865,24443979,Dan Stowell,"['New paper from us: ""Estimating &amp; Mitigating the Impact of Acoustic Environments on Machine-to-Machine Signalling"" <LINK> by @AmoghMatt - he will present it at @eusipco2019! #eusipco2019', '@AmoghMatt @eusipco2019 Oh also - this is the product of a great collaboration with @chirp!']",https://arxiv.org/abs/1908.04672,"The advance of technology for transmitting Data-over-Sound in various IoT and telecommunication applications has led to the concept of machine-to-machine over-the-air acoustic signalling. Reverberation can have a detrimental effect on such machine-to-machine signals while decoding. Various methods have been studied to combat the effects of reverberation in speech and audio signals, but it is not clear how well they generalise to other sound types. We look at extending these models to facilitate machine-to-machine acoustic signalling. This research investigates dereverberation techniques to shortlist a single-channel reverberation suppression method through a pilot test. In order to apply the chosen dereverberation method a novel method of estimating acoustic parameters governing reverberation is proposed. The performance of the final algorithm is evaluated on quality metrics as well as the performance of a real machine-to-machine decoder. We demonstrate a dramatic reduction in error rate for both audible and ultrasonic signals. ","Estimating & Mitigating the Impact of Acoustic Environments on
  Machine-to-Machine Signalling"
60,1161460501991182336,9674682,Kohei Hayashi,"['Happy to share our new paper w/ Yamaguchi, Sugawara &amp; Maeda. We show a lot of light-weight CNN modules are graphically representable as tensor networks. Architecture search in the graphs finds dense Pareto solutions for the accuracy/efficiency tradeoff. \n<LINK> <LINK>']",https://arxiv.org/abs/1908.04471,"Tensor decomposition methods are widely used for model compression and fast inference in convolutional neural networks (CNNs). Although many decompositions are conceivable, only CP decomposition and a few others have been applied in practice, and no extensive comparisons have been made between available methods. Previous studies have not determined how many decompositions are available, nor which of them is optimal. In this study, we first characterize a decomposition class specific to CNNs by adopting a flexible graphical notation. The class includes such well-known CNN modules as depthwise separable convolution layers and bottleneck layers, but also previously unknown modules with nonlinear activations. We also experimentally compare the tradeoff between prediction accuracy and time/space complexity for modules found by enumerating all possible decompositions, or by using a neural architecture search. We find some nonlinear decompositions outperform existing ones. ","Einconv: Exploring Unexplored Tensor Network Decompositions for
  Convolutional Neural Networks"
61,1161373511883132930,61355172,Maria Womack 🇺🇦,['Our new paper on the famous outbursting 29P/SW1 significantly advances our understanding of Centaurs &amp; JFCs! It also shows that SW1 will start moving out of its current orbit in ~20 years. <LINK> @sir_galahead @kat_volk @steckloff @LWoodney &amp; W.Harris #WeAreSW1 <LINK>'],http://arxiv.org/abs/1908.04185,"Jupiter-family comets (JFCs) are the evolutionary products of trans-Neptunian objects (TNOs) that evolve through the giant planet region as Centaurs and into the inner solar system. Through numerical orbital evolution calculations following a large number of TNO test particles that enter the Centaur population, we have identified a short-lived dynamical Gateway, a temporary low-eccentricity region exterior to Jupiter through which the majority of JFCs pass. We apply an observationally based size distribution function to the known Centaur population and obtain an estimated Gateway region population. We then apply an empirical fading law to the rate of incoming JFCs implied by the the Gateway region residence times. Our derived estimates are consistent with observed population numbers for the JFC and Gateway populations. Currently, the most notable occupant of the Gateway region is 29P/Schwassmann-Wachmann 1 (SW1), a highly active, regularly outbursting Centaur. SW1's present-day, very-low-eccentricity orbit was established after a 1975 Jupiter conjunction and will persist until a 2038 Jupiter conjunction doubles its eccentricity and pushes its semi-major axis out to its current aphelion. Subsequent evolution will likely drive SW1's orbit out of the Gateway region, perhaps becoming one of the largest JFCs in recorded history. The JFC Gateway region coincides with a heliocentric distance range where the activity of observed cometary bodies increases significantly. SW1's activity may be typical of the early evolutionary processing experienced by most JFCs. Thus, the Gateway region, and its most notable occupant SW1, are critical to both the dynamical and physical transition between Centaurs and JFCs. ","29P/Schwassmann-Wachmann 1, A Centaur in the Gateway to the
  Jupiter-Family Comets"
62,1161287200417484800,1954858226,Lloyd Knox,"[""New paper out with @cosmic_mar:   <LINK>, The Hubble Hunter's Guide. We qualitatively explore potential cosmological solutions to the Hubble constant problem and the challenges they face. We also speculate about the origin of some curiosities in the Planck data.""]",https://arxiv.org/abs/1908.03663,"Measurements of the Hubble constant, and more generally measurements of the expansion rate and distances over the interval $0 < z < 1$, appear to be inconsistent with the predictions of the standard cosmological model ($\Lambda$CDM) given observations of cosmic microwave background temperature and polarization anisotropies. Here we consider a variety of types of departures from $\Lambda$CDM that could, in principle, restore concordance among these datasets, and we explain why we find almost all of them unlikely to be successful. We single out the set of solutions that increase the expansion rate in the decade of scale factor expansion just prior to recombination as the least unlikely. These solutions are themselves tightly constrained by their impact on photon diffusion and on the gravitational driving of acoustic oscillations of the modes that begin oscillating during this epoch -- modes that project on to angular scales that are very well measured. We point out that a general feature of such solutions is a residual to fits to $\Lambda$CDM, like the one observed in Planck power spectra. This residual drives the modestly significant inferences of angular-scale dependence to the matter density and anomalously high lensing power, puzzling aspects of a data set that is otherwise extremely well fit by $\Lambda$CDM. ",The Hubble Hunter's Guide
63,1161208612733235200,23000769,Christopher Conselice,"[""If you are interested in machine learning (ML) on large datasets check out my student Sunny Chen's new paper on the arXiv today <LINK>.  We investigate ways of using ML for classifying galaxies, including Convolutional Neural Network (CNN), K-nearest neighbour,"", 'Logistic Regression, Support Vector Machine, and Neural Networks.  We investigate, using these, the best methods and ways for optimizing classifying galaxies with ML. We show that 99.94% accuracy is possible using Deep Learning.  We did this using Dark Energy Survey (DES) data.', 'In this process we have also discovered where @galaxyzoo misclassifies galaxies due to the lower resolution of SDSS imaging.  As a bonus we also rediscovered the S0 galaxy type without intending to. Lots more in the paper itself!']",https://arxiv.org/abs/1908.03610,"There are several supervised machine learning methods used for the application of automated morphological classification of galaxies; however, there has not yet been a clear comparison of these different methods using imaging data, or a investigation for maximising their effectiveness. We carry out a comparison between several common machine learning methods for galaxy classification (Convolutional Neural Network (CNN), K-nearest neighbour, Logistic Regression, Support Vector Machine, Random Forest, and Neural Networks) by using Dark Energy Survey (DES) data combined with visual classifications from the Galaxy Zoo 1 project (GZ1). Our goal is to determine the optimal machine learning methods when using imaging data for galaxy classification. We show that CNN is the most successful method of these ten methods in our study. Using a sample of $\sim$2,800 galaxies with visual classification from GZ1, we reach an accuracy of $\sim$0.99 for the morphological classification of Ellipticals and Spirals. The further investigation of the galaxies that have a different ML and visual classification but with high predicted probabilities in our CNN usually reveals an the incorrect classification provided by GZ1. We further find the galaxies having a low probability of being either spirals or ellipticals are visually Lenticulars (S0), demonstrating that supervised learning is able to rediscover that this class of galaxy is distinct from both Es and Spirals. We confirm that $\sim$2.5\% galaxies are misclassified by GZ1 in our study. After correcting these galaxies' labels, we improve our CNN performance to an average accuracy of over 0.99 (accuracy of 0.994 is our best result). ","Optimising Automatic Morphological Classification of Galaxies with
  Machine Learning and Deep Learning using Dark Energy Survey Imaging"
64,1161087472807399430,2766925212,Andrew Childs,"['New paper with Chakrabarti, @hungshihhan, @tongyang93, Wang, &amp; @xiaodiwu gives quantum speedup for estimating the volume of a convex body <LINK>']",http://arxiv.org/abs/1908.03903,"Estimating the volume of a convex body is a central problem in convex geometry and can be viewed as a continuous version of counting. We present a quantum algorithm that estimates the volume of an $n$-dimensional convex body within multiplicative error $\epsilon$ using $\tilde{O}(n^{3}+n^{2.5}/\epsilon)$ queries to a membership oracle and $\tilde{O}(n^{5}+n^{4.5}/\epsilon)$ additional arithmetic operations. For comparison, the best known classical algorithm uses $\tilde{O}(n^{4}+n^{3}/\epsilon^{2})$ queries and $\tilde{O}(n^{6}+n^{5}/\epsilon^{2})$ additional arithmetic operations. To the best of our knowledge, this is the first quantum speedup for volume estimation. Our algorithm is based on a refined framework for speeding up simulated annealing algorithms that might be of independent interest. This framework applies in the setting of ""Chebyshev cooling"", where the solution is expressed as a telescoping product of ratios, each having bounded variance. We develop several novel techniques when implementing our framework, including a theory of continuous-space quantum walks with rigorous bounds on discretization error. To complement our quantum algorithms, we also prove that volume estimation requires $\Omega(\sqrt n+1/\epsilon)$ quantum membership queries, which rules out the possibility of exponential quantum speedup in $n$ and shows optimality of our algorithm in $1/\epsilon$ up to poly-logarithmic factors. ",Quantum algorithm for estimating volumes of convex bodies
65,1160957663259348994,1216521482,Luiz G. A. Alves,"['Our new paper ""Reconstructing commuters network using machine learning and urban indicators"" will be published in @SciReports tomorrow. The preprint is available on ArXiv:\n<LINK> - with Gabriel Spadon, Andre de Carvalho, and Jose Rodrigues-Jr <LINK>']",https://arxiv.org/abs/1908.03512,"Human mobility has a significant impact on several layers of society, from infrastructural planning and economics to the spread of diseases and crime. Representing the system as a complex network, in which nodes are assigned to regions (e.g., a city) and links indicate the flow of people between two of them, physics-inspired models have been proposed to quantify the number of people migrating from one city to the other. Despite the advances made by these models, our ability to predict the number of commuters and reconstruct mobility networks remains limited. Here, we propose an alternative approach using machine learning and 22 urban indicators to predict the flow of people and reconstruct the intercity commuters network. Our results reveal that predictions based on machine learning algorithms and urban indicators can reconstruct the commuters network with 90.4% of accuracy and describe 77.6% of the variance observed in the flow of people between cities. We also identify essential features to recover the network structure and the urban indicators mostly related to commuting patterns. As previously reported, distance plays a significant role in commuting, but other indicators, such as Gross Domestic Product (GDP) and unemployment rate, are also driven-forces for people to commute. We believe that our results shed new lights on the modeling of migration and reinforce the role of urban indicators on commuting patterns. Also, because link-prediction and network reconstruction are still open challenges in network science, our results have implications in other areas, like economics, social sciences, and biology, where node attributes can give us information about the existence of links connecting entities in the network. ","Reconstructing commuters network using machine learning and urban
  indicators"
66,1160920423875244033,307826617,Kev Abazajian ⤷⏳🌎,"['Ongoing &amp; future cosmic microwave background experiments have the sensitivity to indicate or rule out Dirac neutrino mass models, beating the LHC. @SPTelescope @SimonsObs &amp; CMB-S4. New paper with #UCIrvine Humboldt fellow Julian Heek <LINK> <LINK>', 'In other words: we may discover a breakthrough in fundamental particles with experiments measuring the relic light from the Big Bang.', 'Julian *Heeck*', '@di_goldene_pave @SPTelescope @SimonsObs It depends on th me number of degrees of freedom between decoupling &amp; the CMB. We discuss in the paper.']",https://arxiv.org/abs/1908.03286,"Planned CMB Stage IV experiments have the potential to measure the effective number of relativistic degrees of freedom in the early Universe, $N_\text{eff}$, with percent-level accuracy. This probes new thermalized light particles and also constrains possible new-physics interactions of Dirac neutrinos. Many Dirac-neutrino models that aim to address the Dirac stability, the smallness of neutrino masses or the matter--anti-matter asymmetry of our Universe endow the right-handed chirality partners $\nu_R$ with additional interactions that can thermalize them. Unless the reheating temperature of our Universe was low, this leads to testable deviations in $N_\text{eff}$. We discuss well-motivated models for $\nu_R$ interactions such as gauged $U(1)_{B-L}$ and the neutrinophilic two-Higgs-doublet model, and compare the sensitivity of SPT-3G, Simons Observatory, and CMB-S4 to other experiments, in particular the LHC. ",Observing Dirac neutrinos in the cosmic microwave background
