,TweetID,AuthorID,AuthorName,Tweets,arxiv_link,Abstract,Title
35,908348615914954752,20957355,Steven Tremblay,"['Like #pulsars explosions, or any highly energetic astronomical events? Read @AstroBradley new paper on Giant Pulses! <LINK>']",https://arxiv.org/abs/1709.03651,"We report on simultaneous wideband observations of Crab giant pulses with the Parkes radio telescope and the Murchison Widefield Array (MWA). The observations were conducted simultaneously at 732 and 3100 MHz with Parkes, and at 120.96, 165.76 and 210.56 MHz with the MWA. Flux density calibration of the MWA data was accomplished using a novel technique based on tied-array beam simulations. We detected between 90-648 giant pulses in the 120.96-210.56 MHz MWA subbands above a $ 5.5\sigma $ threshold while in the Parkes subbands we detected 6344 and 231 giant pulses above a threshold of $ 6\sigma $ at 732 and 3100 MHz, respectively. We show, for the first time over a wide frequency range, that the average spectrum of Crab giant pulses exhibits a significant flattening at low frequencies. The spectral index, $ \alpha $, for giant pulses evolves from a steep, narrow distribution with a mean $ \alpha=-2.6 $ and width $\sigma_\alpha=0.5 $ between 732 and 3100 MHz, to a wide, flat distribution of spectral indices with a mean $ \alpha=-0.7 $ and width $ \sigma_\alpha=1.4 $ between 120.96 and 165.76 MHz. We also comment on the plausibility of giant pulse models for Fast Radio Bursts based on this spectral information. ",Spectral Flattening at Low Frequencies in Crab Giant Pulses
36,908005369632276480,21611239,Sean Carroll,['New paper: thinking of de Sitter space (empty space with a positive cosmological constant) as a quantum circuit.\n<LINK>'],https://arxiv.org/abs/1709.03513,"We investigate the proposed connection between de Sitter spacetime and the MERA (Multiscale Entanglement Renormalization Ansatz) tensor network, and ask what can be learned via such a construction. We show that the quantum state obeys a cosmic no-hair theorem: the reduced density operator describing a causal patch of the MERA asymptotes to a fixed point of a quantum channel, just as spacetimes with a positive cosmological constant asymptote to de Sitter. The MERA is potentially compatible with a weak form of complementarity (local physics only describes single patches at a time, but the overall Hilbert space is infinite-dimensional) or, with certain specific modifications to the tensor structure, a strong form (the entire theory describes only a single patch plus its horizon, in a finite-dimensional Hilbert space). We also suggest that de Sitter evolution has an interpretation in terms of circuit complexity, as has been conjectured for anti-de Sitter space. ","De Sitter Space as a Tensor Network: Cosmic No-Hair, Complementarity,
  and Complexity"
37,907629768392232962,708465957690351616,Stuart Hadfield,"['New paper w/ #QuAIL @NASAAmes: ""From #Quantum Approximate Optimization Alg. to Q. Alternating Operator Ansatz"" <LINK> #qaoa', '@NASAAmes also at https://t.co/xOnvM9psGa\n#quantumComputing']",https://arxiv.org/abs/1709.03489,"The next few years will be exciting as prototype universal quantum processors emerge, enabling implementation of a wider variety of algorithms. Of particular interest are quantum heuristics, which require experimentation on quantum hardware for their evaluation, and which have the potential to significantly expand the breadth of quantum computing applications. A leading candidate is Farhi et al.'s Quantum Approximate Optimization Algorithm, which alternates between applying a cost-function-based Hamiltonian and a mixing Hamiltonian. Here, we extend this framework to allow alternation between more general families of operators. The essence of this extension, the Quantum Alternating Operator Ansatz, is the consideration of general parametrized families of unitaries rather than only those corresponding to the time-evolution under a fixed local Hamiltonian for a time specified by the parameter. This ansatz supports the representation of a larger, and potentially more useful, set of states than the original formulation, with potential long-term impact on a broad array of application areas. For cases that call for mixing only within a desired subspace, refocusing on unitaries rather than Hamiltonians enables more efficiently implementable mixers than was possible in the original framework. Such mixers are particularly useful for optimization problems with hard constraints that must always be satisfied, defining a feasible subspace, and soft constraints whose violation we wish to minimize. More efficient implementation enables earlier experimental exploration of an alternating operator approach to a wide variety of approximate optimization, exact optimization, and sampling problems. Here, we introduce the Quantum Alternating Operator Ansatz, lay out design criteria for mixing operators, detail mappings for eight problems, and provide brief descriptions of mappings for diverse problems. ","From the Quantum Approximate Optimization Algorithm to a Quantum
  Alternating Operator Ansatz"
38,907624023886110720,3276698761,Albert S. Berahas,"['New paper with Raghu, @StrongDuality &amp; Ermin: Balancing Communication and Computation in Distributed Optimization. <LINK>']",https://arxiv.org/abs/1709.02999,"Methods for distributed optimization have received significant attention in recent years owing to their wide applicability in various domains. A distributed optimization method typically consists of two key components: communication and computation. More specifically, at every iteration (or every several iterations) of a distributed algorithm, each node in the network requires some form of information exchange with its neighboring nodes (communication) and the computation step related to a (sub)-gradient (computation). The standard way of judging an algorithm via only the number of iterations overlooks the complexity associated with each iteration. Moreover, various applications deploying distributed methods may prefer a different composition of communication and computation. Motivated by this discrepancy, in this work we propose an adaptive cost framework which adjusts the cost measure depending on the features of various applications. We present a flexible algorithmic framework, where communication and computation steps are explicitly decomposed to enable algorithm customization for various applications. We apply this framework to the well-known distributed gradient descent (DGD) method, and show that the resulting customized algorithms, which we call DGD$^t$, NEAR-DGD$^t$ and NEAR-DGD$^+$, compare favorably to their base algorithms, both theoretically and empirically. The proposed NEAR-DGD$^+$ algorithm is an exact first-order method where the communication and computation steps are nested, and when the number of communication steps is adaptively increased, the method converges to the optimal solution. We test the performance and illustrate the flexibility of the methods, as well as practical variants, on quadratic functions and classification problems that arise in machine learning, in terms of iterations, gradient evaluations, communications and the proposed cost framework. ",Balancing Communication and Computation in Distributed Optimization
39,907324957654470656,14283504,Josh Bongard,"['Our new paper (w/ @MarkWagy, @bagrow &amp; @paulhinesuvm) on sourcing survey questions from the crowd:  <LINK> <LINK>']",https://arxiv.org/abs/1709.02739,"Crowdsourcing has been successfully applied in many domains including astronomy, cryptography and biology. In order to test its potential for useful application in a Smart Grid context, this paper investigates the extent to which a crowd can contribute predictive hypotheses to a model of residential electric energy consumption. In this experiment, the crowd generated hypotheses about factors that make one home different from another in terms of monthly energy usage. To implement this concept, we deployed a web-based system within which 627 residential electricity customers posed 632 questions that they thought predictive of energy usage. While this occurred, the same group provided 110,573 answers to these questions as they accumulated. Thus users both suggested the hypotheses that drive a predictive model and provided the data upon which the model is built. We used the resulting question and answer data to build a predictive model of monthly electric energy consumption, using random forest regression. Because of the sparse nature of the answer data, careful statistical work was needed to ensure that these models are valid. The results indicate that the crowd can generate useful hypotheses, despite the sparse nature of the dataset. ",Crowdsourcing Predictors of Residential Electric Energy Usage
40,907288752267042816,82008070,Dave Wecker,"['Our new paper ""Magic State Distillation at Intermediate Size"" is now available:<LINK> @Station_Q #QuArC']",https://arxiv.org/abs/1709.02789,"Recently we proposed a family of magic state distillation protocols that obtains asymptotic performance that is conjectured to be optimal. This family depends upon several codes, called ""inner codes"" and ""outer codes."" We presented some small examples of these codes as well as an analysis of codes in the asymptotic limit. Here, we analyze such protocols in an intermediate size regime, using hundreds to thousands of qubits. We use BCH inner codes, combined with various outer codes. We extend our protocols by adding error correction in some cases. We present a variety of protocols in various input error regimes; in many cases these protocols require significantly fewer input magic states to obtain a given output error than previous protocols. ",Magic State Distillation at Intermediate Size
41,905953790142013440,140770306,Masafumi Oizumi,"['Our new paper ""Geometry of Information Integration"" is available at <LINK>.']",https://arxiv.org/abs/1709.02050,"Information geometry is used to quantify the amount of information integration within multiple terminals of a causal dynamical system. Integrated information quantifies how much information is lost when a system is split into parts and information transmission between the parts is removed. Multiple measures have been proposed as a measure of integrated information. Here, we analyze four of the previously proposed measures and elucidate their relations from a viewpoint of information geometry. Two of them use dually flat manifolds and the other two use curved manifolds to define a split model. We show that there are hierarchical structures among the measures. We provide explicit expressions of these measures. ",Geometry of Information Integration
42,905478158174093312,3423739275,Felix Leditzky,"['New paper: approx. additivity of Holevo inf. -&gt; upper bounds on classical cap., with E. Kaur, N. Datta, @markwilde <LINK>', '@markwilde Ancillary files used to obtain numerical and some analytical results are available at https://t.co/wAcUbT1R2F']",https://arxiv.org/abs/1709.01111,"We study quantum channels that are close to another channel with weakly additive Holevo information and derive upper bounds on their classical capacity. Examples of channels with weakly additive Holevo information are entanglement-breaking channels, unital qubit channels, and Hadamard channels. Related to the method of approximate degradability, we define approximation parameters for each class above that measure how close an arbitrary channel is to satisfying the respective property. This gives us upper bounds on the classical capacity in terms of functions of the approximation parameters, as well as an outer bound on the dynamic capacity region of a quantum channel. Since these parameters are defined in terms of the diamond distance, the upper bounds can be computed efficiently using semidefinite programming (SDP). We exhibit the usefulness of our method with two example channels: a convex mixture of amplitude damping and depolarizing noise, and a composition of amplitude damping and dephasing noise. For both channels, our bounds perform well in certain regimes of the noise parameters in comparison to a recently derived SDP upper bound on the classical capacity. Along the way, we define the notion of a generalized channel divergence (which includes the diamond distance as an example), and we prove that for jointly covariant channels these quantities are maximized by purifications of a state invariant under the covariance group. This latter result may be of independent interest. ","Approaches for approximate additivity of the Holevo information of
  quantum channels"
43,905381605920919552,3084456430,Burkhard Morgenstern,['Our new paper on @arXiv:  <LINK>\nAlignment-free phylogeny reconstruction using k-mismatch common substrings'],https://arxiv.org/abs/1709.01371,"Various approaches to alignment-free sequence comparison are based on the length of exact or inexact word matches between two input sequences. Haubold {\em et al.} (2009) showed how the average number of substitutions between two DNA sequences can be estimated based on the average length of exact common substrings. In this paper, we study the length distribution of $k$-mismatch common substrings between two sequences. We show that the number of substitutions per position that have occurred since two sequences have evolved from their last common ancestor, can be estimated from the position of a local maximum in the length distribution of their $k$-mismatch common substrings. ","Estimating phylogenetic distances between genomic sequences based on the
  length distribution of k-mismatch common substrings"
44,905248975527174144,844960356,Ashmeet Singh,['New paper where @seanmcarroll and I bravely decimate quantum states in Hilbert space sans structure! <LINK>'],http://arxiv.org/abs/1709.01066,"We present a technique to coarse-grain quantum states in a finite-dimensional Hilbert space. Our method is distinguished from other approaches by not relying on structures such as a preferred factorization of Hilbert space or a preferred set of operators (local or otherwise) in an associated algebra. Rather, we use the data corresponding to a given set of states, either specified independently or constructed from a single state evolving in time. Our technique is based on principle component analysis (PCA), and the resulting coarse-grained quantum states live in a lower dimensional Hilbert space whose basis is defined using the underlying (isometric embedding) transformation of the set of fine-grained states we wish to coarse-grain. Physically, the transformation can be interpreted to be an ""entanglement coarse-graining"" scheme that retains most of the global, useful entanglement structure of each state, while needing fewer degrees of freedom for its reconstruction. This scheme could be useful for efficiently describing collections of states whose number is much smaller than the dimension of Hilbert space, or a single state evolving over time. ",Quantum Decimation in Hilbert Space: Coarse-Graining without Structure
45,904933011514429440,2203468841,Dr Jade Powell,['I have a new supernova paper on arXiv today 😁 <LINK>'],https://arxiv.org/abs/1709.00955,"A detection of a core-collapse supernova signal with an Advanced LIGO and Virgo gravitational-wave detector network will allow us to measure astrophysical parameters of the source. In real advanced gravitational-wave detector data there are transient noise artifacts that may mimic a true gravitational-wave signal. In this paper, we outline a procedure implemented in the Supernova Model Evidence Extractor (SMEE) that determines if a core-collapse supernova signal candidate is a noise artefact, a rapidly-rotating core-collapse supernova signal, or a neutrino explosion mechanism core-collapse supernova signal. Further to this, we use the latest available three-dimensional gravitational-wave core-collapse supernova simulations, and we outline a new procedure for the rejection of background noise transients when only one detector is operational. We find the minimum SNR needed to detect all waveforms is reduced when using three-dimensional waveforms as signal models. ","Inferring the core-collapse supernova explosion mechanism with
  three-dimensional gravitational-wave simulations"
46,904533535347933184,526115229,Kevin Heng,"['New WASP-12b retrieval paper by my student Maria Oreshenko:\n<LINK>', '@TroveMaster @ExoMol We definitely do! For the next set of models. Our outlook is long-term.']",https://arxiv.org/abs/1709.00338,"We analyze the emission spectrum of the hot Jupiter WASP-12b using our HELIOS-R retrieval code and HELIOS-K opacity calculator. When interpreting Hubble and Spitzer data, the retrieval outcomes are found to be prior-dominated. When the prior distributions of the molecular abundances are assumed to be log-uniform, the volume mixing ratio of HCN is found to be implausibly high. A VULCAN chemical kinetics model of WASP-12b suggests that chemical equilibrium is a reasonable assumption even when atmospheric mixing is implausibly rigorous. Guided by (exo)planet formation theory, we set Gaussian priors on the elemental abundances of carbon, oxygen and nitrogen with the Gaussian peaks being centered on the measured C/H, O/H and N/H values of the star. By enforcing chemical equilibrium, we find substellar O/H and stellar to slightly superstellar C/H for the dayside atmosphere of WASP-12b. The superstellar carbon-to-oxygen ratio is just above unity, regardless of whether clouds are included in the retrieval analysis, consistent with Madhusudhan et al. (2011). Furthermore, whether a temperature inversion exists in the atmosphere depends on one's assumption for the Gaussian width of the priors. Our retrieved posterior distributions are consistent with the formation of WASP-12b in a solar-composition protoplanetary disk, beyond the water iceline, via gravitational instability or pebble accretion (without core erosion) and migration inwards to its present orbital location via a disk-free mechanism, and are inconsistent with both in-situ formation and core accretion with disk migration, as predicted by Madhusudhan et al. (2017). We predict that the interpretation of James Webb Space Telescope WASP-12b data will not be prior-dominated. ","Retrieval Analysis of the Emission Spectrum of WASP-12b: Sensitivity of
  Outcomes to Prior Assumptions and Implications for Formation History"
47,904504261794344961,1576235694,Michael Brown,"['My new paper, ""Calibration of ultraviolet, mid-infrared and radio star formation rate indicators,"" is now on arxiv! <LINK>', 'Key results are 150 MHz &amp; mid-IR SFR indicator calibrations, including some significant revisions to mid-IR calibrations at 8 &amp; 12 microns. https://t.co/PJBzUHq6Gv']",https://arxiv.org/abs/1709.00183,"We present calibrations for star formation rate indicators in the ultraviolet, mid-infrared and radio continuum bands, including one of the first direct calibrations of 150 MHz as a star formation rate indicator. Our calibrations utilize 66 nearby star forming galaxies with Balmer decrement corrected H-alpha luminosities, which span 5 orders of magnitude in star formation rate and have absolute magnitudes of -24<M_r<-12. Most of our photometry and spectrophotometry is measured from the same region of each galaxy, and our spectrophotometry has been validated with SDSS photometry, so our random and systematic errors are small relative to the intrinsic scatter seen in star formation rate indicator calibrations. We find WISE W4 (22.8 micron), Spitzer 24 micron and 1.4 GHz have tight correlations with Balmer decrement corrected H-alpha luminosity, with scatter of only 0.2 dex. Our calibrations are comparable to those from the prior literature for L* galaxies, but for dwarf galaxies our calibrations can give star formation rates that are far greater than those derived from much of the prior literature. ","Calibration of ultraviolet, mid-infrared and radio star formation rate
  indicators"
48,910828077239894017,801449812486782976,Riashat Islam,"['Excited about our new paper ""Deep Reinforcement Learning that Matters"" with \n@rllabmcgill @MaluubaInc \n<LINK>']",https://arxiv.org/abs/1709.06560,"In recent years, significant progress has been made in solving challenging problems across various domains using deep reinforcement learning (RL). Reproducing existing work and accurately judging the improvements offered by novel methods is vital to sustaining this progress. Unfortunately, reproducing results for state-of-the-art deep RL methods is seldom straightforward. In particular, non-determinism in standard benchmark environments, combined with variance intrinsic to the methods, can make reported results tough to interpret. Without significance metrics and tighter standardization of experimental reporting, it is difficult to determine whether improvements over the prior state-of-the-art are meaningful. In this paper, we investigate challenges posed by reproducibility, proper experimental techniques, and reporting procedures. We illustrate the variability in reported metrics and results when comparing against common baselines and suggest guidelines to make future results in deep RL more reproducible. We aim to spur discussion about how to ensure continued progress in the field by minimizing wasted effort stemming from results that are non-reproducible and easily misinterpreted. ",Deep Reinforcement Learning that Matters
49,909826513956147200,1868950795,Ruth Misener,['New paper on approximation algorithms for designing heat recovery networks with Dimitris Letsios &amp; Georgia Kouyialis <LINK>'],https://arxiv.org/abs/1709.04688,"Heat exchanger network synthesis exploits excess heat by integrating process hot and cold streams and improves energy efficiency by reducing utility usage. Determining provably good solutions to the minimum number of matches is a bottleneck of designing a heat recovery network using the sequential method. This subproblem is an NP-hard mixed-integer linear program exhibiting combinatorial explosion in the possible hot and cold stream configurations. We explore this challenging optimization problem from a graph theoretic perspective and correlate it with other special optimization problems such as cost flow network and packing problems. In the case of a single temperature interval, we develop a new optimization formulation without problematic big-M parameters. We develop heuristic methods with performance guarantees using three approaches: (i) relaxation rounding, (ii) water filling, and (iii) greedy packing. Numerical results from a collection of 51 instances substantiate the strength of the methods. ","Heuristics with Performance Guarantees for the Minimum Number of Matches
  Problem in Heat Recovery Network Design"
50,905076598419988483,3225405682,Jack Bowden,['New paper on IV theory with important implications for two-sample summary data Mendelian randomization   <LINK>'],https://arxiv.org/abs/1709.00081,"Instrumental variable analysis is a widely used method to estimate causal effects in the presence of unmeasured confounding. When the instruments, exposure and outcome are not measured in the same sample, Angrist and Krueger (1992) suggested to use two-sample instrumental variable (TSIV) estimators that use sample moments from an instrument-exposure sample and an instrument-outcome sample. However, this method is biased if the two samples are from heterogeneous populations so that the distributions of the instruments are different. In linear structural equation models, we derive a new class of TSIV estimators that are robust to heterogeneous samples under the key assumption that the structural relations in the two samples are the same. The widely used two-sample two-stage least squares estimator belongs to this class. It is generally not asymptotically efficient, although we find that it performs similarly to the optimal TSIV estimator in most practical situations. We then attempt to relax the linearity assumption. We find that, unlike one-sample analyses, the TSIV estimator is not robust to misspecified exposure model. Additionally, to nonparametrically identify the magnitude of the causal effect, the noise in the exposure must have the same distributions in the two samples. However, this assumption is in general untestable because the exposure is not observed in one sample. Nonetheless, we may still identify the sign of the causal effect in the absence of homogeneity of the noise. ",Two-sample instrumental variable analyses using heterogeneous samples
