,TweetID,AuthorID,AuthorName,Tweets,arxiv_link,Abstract,Title
33,823844537017700352,307880202,Blai Vidiella 🎗,['Synthetic Associative Learning! Our new paper @CSLab_UPF \n<LINK> <LINK>'],https://arxiv.org/abs/1701.06086,"Associative learning is one of the key mechanisms displayed by living organisms in order to adapt to their changing environments. It was early recognized to be a general trait of complex multicellular organisms but also found in ""simpler"" ones. It has also been explored within synthetic biology using molecular circuits that are directly inspired in neural network models of conditioning. These designs involve complex wiring diagrams to be implemented within one single cell and the presence of diverse molecular wires become a challenge that might be very difficult to overcome. Here we present three alternative circuit designs based on two-cell microbial consortia able to properly display associative learning responses to two classes of stimuli and displaying long and short-term memory (i. e. the association can be lost with time). These designs might be a helpful approach for engineering the human gut microbiome or even synthetic organoids, defining a new class of decision-making biological circuits capable of memory and adaptation to changing conditions. The potential implications and extensions are outlined. ",Synthetic associative learning in engineered multicellular consortia
34,823837800441249792,317422543,Ricard Solé,"[""Engineering learning and Pavlov's conditioning on synthetic cellular consortia: our new paper  <LINK> <LINK>"", '@MathCancer @ara_anderson Many thanks!']",https://arxiv.org/abs/1701.06086,"Associative learning is one of the key mechanisms displayed by living organisms in order to adapt to their changing environments. It was early recognized to be a general trait of complex multicellular organisms but also found in ""simpler"" ones. It has also been explored within synthetic biology using molecular circuits that are directly inspired in neural network models of conditioning. These designs involve complex wiring diagrams to be implemented within one single cell and the presence of diverse molecular wires become a challenge that might be very difficult to overcome. Here we present three alternative circuit designs based on two-cell microbial consortia able to properly display associative learning responses to two classes of stimuli and displaying long and short-term memory (i. e. the association can be lost with time). These designs might be a helpful approach for engineering the human gut microbiome or even synthetic organoids, defining a new class of decision-making biological circuits capable of memory and adaptation to changing conditions. The potential implications and extensions are outlined. ",Synthetic associative learning in engineered multicellular consortia
35,824009819711504384,56805505,Ingo Scholtes,['In our latest work we study controllability of temporal networks from a higher-order network perspective: <LINK>'],https://arxiv.org/abs/1701.06331,"In many complex systems, elements interact via time-varying network topologies. Recent research shows that temporal correlations in the chronological ordering of interactions crucially influence network properties and dynamical processes. How these correlations affect our ability to control systems with time-varying interactions remains unclear. In this work, we use higher-order network models to extend the framework of structural controllability to temporal networks, where the chronological ordering of interactions gives rise to time-respecting paths with non-Markovian characteristics. We study six empirical data sets and show that non-Markovian characteristics of real systems can both increase or decrease the minimum time needed to control the whole system. With both empirical data and synthetic models, we further show that spectral properties of generalisations of graph Laplacians to higher-order networks can be used to analytically capture the effect of temporal correlations on controllability. Our work highlights that (i) correlations in the chronological ordering of interactions are an important source of complexity that significantly influences the controllability of temporal networks, and (ii) higher-order network models are a powerful tool to understand the temporal-topological characteristics of empirical systems. ","Higher-order models capture changes in controllability of temporal
  networks"
36,821417330894729216,52381876,Edward Frenkel,['New paper with Aganagic &amp; Okounkov in which we propose a q-deformation of the quantum Langlands correspondence:\n<LINK> <LINK>'],https://arxiv.org/abs/1701.03146,"We formulate a two-parameter generalization of the geometric Langlands correspondence, which we prove for all simply-laced Lie algebras. It identifies the q-conformal blocks of the quantum affine algebra and the deformed W-algebra associated to two Langlands dual Lie algebras. Our proof relies on recent results in quantum K-theory of the Nakajima quiver varieties. The physical origin of the correspondence is the 6d little string theory. The quantum Langlands correspondence emerges in the limit in which the 6d string theory becomes the 6d conformal field theory with (2,0) supersymmetry. ",Quantum q-Langlands Correspondence
37,816978812617400320,378228706,Hannah Wakeford,['We find no evidence of H2O features in the atm. of WASP-101b So is not optimum for #JWST ERS obs. of clear features <LINK>'],http://arxiv.org/abs/1701.00843,"We present results from the first observations of the Hubble Space Telescope (HST) Panchromatic Comparative Exoplanet Treasury (PanCET) program for WASP-101b, a highly inflated hot Jupiter and one of the community targets proposed for the James Webb Space Telescope (JWST) Early Release Science (ERS) program. From a single HST Wide Field Camera 3 (WFC3) observation, we find that the near-infrared transmission spectrum of WASP-101b contains no significant H$_2$O absorption features and we rule out a clear atmosphere at 13{\sigma}. Therefore, WASP-101b is not an optimum target for a JWST ERS program aimed at observing strong molecular transmission features. We compare WASP-101b to the well studied and nearly identical hot Jupiter WASP-31b. These twin planets show similar temperature-pressure profiles and atmospheric features in the near-infrared. We suggest exoplanets in the same parameter space as WASP-101b and WASP-31b will also exhibit cloudy transmission spectral features. For future HST exoplanet studies, our analysis also suggests that a lower count limit needs to be exceeded per pixel on the detector in order to avoid unwanted instrumental systematics. ","HST PanCET program: A Cloudy Atmosphere for the promising JWST target
  WASP-101b"
