,TweetID,AuthorID,AuthorName,Tweets,arxiv_link,Abstract,Title
54,1418134599281090561,92580220,Thomas Spriggs,"['New paper day! 🎉🎉🎉 Introducing the Planetary Nebula Catalogue of the Fornax3D ETGs, along with independent distance estimates! This paper has been accepted in A&amp;A, and is now on Arxiv /ADS: <LINK>\nPlots and overview to follow', 'Introducing our catalogue of 1350 PNe from across 21 ETGs of the Fornax cluster, observed using MUSE as part of the Fornax3D survey. We also include PNLF derived distances to each galaxy. https://t.co/wVQHW44MmR', 'Those distances are in very good agreement with the Surface Brightness Fluctuation (SBF) within the literature, and our average distance to the cluster: D=19.86 +/- 0.32 Mpc, agrees well with other cluster average distances. https://t.co/YgtM94D8HL', 'Now, back to writing the thesis. #PhDlife #Fornax3D #Astrophysics', '@I_Hert_Space']",https://arxiv.org/abs/2107.09680,"Extragalactic planetary nebulae (PNe) offer a way to determine the distance to their host galaxies thanks to the nearly universal shape of the planetary nebulae luminosity function (PNLF). Accurate PNe distance measurements rely on obtaining well-sampled PNLFs and the number of observed PNe scales with the encompassed stellar mass. This means either disposing of wide-field observations or focusing on the bright central regions of galaxies. In this work we take this second approach and conduct a census of the PNe population in the central regions of galaxies in the Fornax cluster, using VLT/MUSE data for the early-type galaxies observed over the course of the Fornax3D survey. Using such integral-field spectroscopic observations to carefully separate the nebular emission from the stellar continuum, we isolated [OIII] 5007 {\AA} sources of interest, filtered out unresolved impostor sources or kinematic outliers, and present a catalogue of 1350 unique PNe sources across 21 early-type galaxies, which includes their positions, [OIII] 5007 {\AA} line magnitudes, and line-of-sight velocities. Using the PNe catalogued within each galaxy, we present independently derived distance estimates based on the fit to the entire observed PNLF observed while carefully accounting for the PNe detection incompleteness. With these individual measurements, we arrive at an average distance to the Fornax cluster itself of 19.86 $\pm$ 0.32 Mpc ($\mu_{PNLF}$ = 31.49 $\pm$ 0.04 mag). Our PNLF distance measurements agree well with previous distances based on surface brightness fluctuations, finding no significant systematic offsets between the two methods as otherwise reported in previous studies. ","The Fornax3D project: Planetary nebulae catalogue and independent
  distance measurements to Fornax cluster galaxies"
55,1418038418882416642,618128128,Shuiwang Ji,['New paper on SSL for Graphs:\nGroup Contrastive Self-Supervised Learning on Graphs\n\nPaper link: <LINK>'],https://arxiv.org/abs/2107.09787,"We study self-supervised learning on graphs using contrastive methods. A general scheme of prior methods is to optimize two-view representations of input graphs. In many studies, a single graph-level representation is computed as one of the contrastive objectives, capturing limited characteristics of graphs. We argue that contrasting graphs in multiple subspaces enables graph encoders to capture more abundant characteristics. To this end, we propose a group contrastive learning framework in this work. Our framework embeds the given graph into multiple subspaces, of which each representation is prompted to encode specific characteristics of graphs. To learn diverse and informative representations, we develop principled objectives that enable us to capture the relations among both intra-space and inter-space representations in groups. Under the proposed framework, we further develop an attention-based representor function to compute representations that capture different substructures of a given graph. Built upon our framework, we extend two current methods into GroupCL and GroupIG, equipped with the proposed objective. Comprehensive experimental results show our framework achieves a promising boost in performance on a variety of datasets. In addition, our qualitative results show that features generated from our representor successfully capture various specific characteristics of graphs. ",Group Contrastive Self-Supervised Learning on Graphs
56,1417924206889603072,1235566258222817280,Andrea Antoni,['Excited to share our new paper out today on the collapse of convective red supergiants in failed supernovae <LINK>'],https://arxiv.org/abs/2107.09068,"During the core collapse of massive stars that do not undergo a canonical energetic explosion, some of the hydrogen envelope of a red supergiant (RSG) progenitor may infall onto the newborn black hole (BH). Within the Athena++ framework, we perform three-dimensional, hydrodynamical simulations of idealized models of supergiant convection and collapse in order to assess whether the infall of the convective envelope can give rise to rotationally-supported material, even if the star has zero angular momentum overall. Our dimensionless, polytropic models are applicable to the optically-thick hydrogen envelope of non-rotating RSGs and cover a factor of 20 in stellar radius. At all radii, the specific angular momentum due to random convective flows implies associated circularization radii of 10 - 1500 times the innermost stable circular orbit of the BH. During collapse, the angular momentum vector of the convective flows is approximately conserved and is slowly varying on the timescale relevant to forming disks at small radii. Our results indicate that otherwise failed explosions of RSGs lead to the formation of rotationally-supported flows that are capable of driving outflows to large radii and powering observable transients. When the BH is able to accrete most of the hydrogen envelope, the final BH spin parameter is $\sim$ 0.5, even though the star is non-rotating. For fractional accretion of the envelope, the spin parameter is generally lower and never exceeds 0.8. We discuss the implications of our results for transients produced by RSG collapse to a black hole. ","Numerical Simulations of the Random Angular Momentum in Convection:
  Implications for Supergiant Collapse to Form Black Holes"
57,1417874378067308544,10471882,matt brehmer,"[""Last year, @eagereyes and I interviewed people about live presentations of data + 📊 in their organizations. \n\nOur #ieeevis '21 paper documents our findings with a musical performance metaphor, along with some new ideas for presenting data. 🎶 \n\npre-print: <LINK> <LINK>""]",https://arxiv.org/abs/2107.09042,"Prior research on communicating with visualization has focused on public presentation and asynchronous individual consumption, such as in the domain of journalism. The visualization research community knows comparatively little about synchronous and multimodal communication around data within organizations, from team meetings to executive briefings. We conducted two qualitative interview studies with individuals who prepare and deliver presentations about data to audiences in organizations. In contrast to prior work, we did not limit our interviews to those who self-identify as data analysts or data scientists. Both studies examined aspects of speaking about data with visual aids such as charts, dashboards, and tables. One study was a retrospective examination of current practices and difficulties, from which we identified three scenarios involving presentations of data. We describe these scenarios using an analogy to musical performance: small collaborative team meetings are akin to jam session, while more structured presentations can range from semi-improvisational performances among peers to formal recitals given to executives or customers. In our second study, we grounded the discussion around three design probes, each examining a different aspect of presenting data: the progressive reveal of visualization to direct attention and advance a narrative, visualization presentation controls that are hidden from the audience's view, and the coordination of a presenter's video with interactive visualization. Our distillation of interviewees' responses surfaced twelve themes, from ways of authoring presentations to creating accessible and engaging audience experiences. ","From Jam Session to Recital: Synchronous Communication and Collaboration
  Around Data in Organizations"
58,1417870039378583554,1360892702,Ekin Dogus Cubuk,"['New paper on ML &amp; physics at ICML!\n \nLearn2Hop: Learned Optimization on Rough Landscapes\nWith Applications to Atomic Structural Optimization\n \nWe adapt learned optimizers for atomic structural optimization, and compare to baselines from physics. \n\nabs: <LINK> <LINK>', ""Finding the low-energy minima of atomic energy landscapes efficiently is one of the most important challenges in materials science.\n \nML has become ubiquitous in physics as a curve-fitting tool, but hasn't been utilized as much for optimization."", 'On the well-studied benchmark of LJ clusters, learned optimizers generalize well across system sizes. They increase the success rate on simple landscapes like LJ13, and lower the final energy on glassy landscapes such as LJ75. https://t.co/dlCIUqORmm', 'Learned optimizers outperform baselines such as Adam and basin-hopping on more realistic landscapes such as ""glassy"" gold clusters and amorphous silicon. https://t.co/UqGOaHPKrw', 'Learned optimizers also show some generalization across the periodic table: e.g. when trained only on gold-silver clusters, they can outperform baselines on palladium-platinum clusters.\n \nThey do better however if also trained on clusters containing palladium or platinum. https://t.co/ksByIKyZJh', 'Still too challenging to train these optimizers on more expensive potentials such as DFT, but we are excited about the future of this direction for involving ML in atomic structural optimization!\n \nwith @Luke_Metz and @sschoenholz, led by the incredible resident @amilmerchant.', 'Check out our presentation at ICML for more details: \n\nhttps://t.co/kFyNd7rYYe']",http://arxiv.org/abs/2107.09661,"Optimization of non-convex loss surfaces containing many local minima remains a critical problem in a variety of domains, including operations research, informatics, and material design. Yet, current techniques either require extremely high iteration counts or a large number of random restarts for good performance. In this work, we propose adapting recent developments in meta-learning to these many-minima problems by learning the optimization algorithm for various loss landscapes. We focus on problems from atomic structural optimization--finding low energy configurations of many-atom systems--including widely studied models such as bimetallic clusters and disordered silicon. We find that our optimizer learns a 'hopping' behavior which enables efficient exploration and improves the rate of low energy minima discovery. Finally, our learned optimizers show promising generalization with efficiency gains on never before seen tasks (e.g. new elements or compositions). Code will be made available shortly. ",Learn2Hop: Learned Optimization on Rough Landscapes
59,1417860509102186499,1050093076159422464,Sina Fazelpour,"['🧵Happy to share the pre-print of our new paper (w/ @mariadearteaga), “Diversity in Sociotechnical Machine Learning Systems”, where we map &amp; explicate different sociocultural diversity-related considerations throughout the machine learning pipeline\n<LINK> <LINK>', 'Research on sociocultural diversity in ML systems falls into two broad lines: One concerns diversity of teams &amp; collectives whose choices shape a system (e.g., designers, developers, labelers). Here, diversity is viewed as a potential organizational response to algorithmic bias.', 'The other research line pertains to the composition of items at some stage of the data-processing pipeline. Here, sociocultural diversity is seen as a design desideratum in curating input datasets or in subset selection of algorithmic output (e.g., in hiring, image search).', ""But currently there's a gap between these works on potential benefits and measures of diversity in ML systems, on the one hand, and broader research on sociocultural diversity in humanities &amp; organizational and social sciences, on the other."", 'Why does it matter? Because as that broader research shows, diversity is not a monolithic concept, but has varied meanings. Different diversity concepts are based on distinct epistemic, ethical &amp; political rationales that should inform how we measure diversity in a context &amp; why.', 'So, without grounding proposed measures in appropriate concepts, we face challenges like disconnects between our motivations in attending to sociocultural diversity and our implementation; or misunderstanding the relation between diversity &amp; other desiderata (e.g., fairness).', 'Similarly, when making claims about the benefits of diversity for collective performance, diversity researchers have emphasized the need for being specific about the precise pathway through which this benefit is supposed to happen (&amp; pathway-specific effect modifiers).', ""Without connecting the discussion of diversity's benefits to specific pathways &amp; relevant effect modifiers, we can end up with uninformative (or false) generalities, flawed experimental designs, or erroneous interpretations of &amp; inferences from empirical findings."", 'To address these issues, in the paper we draw on research on sociocultural diversity in philosophy, psychology, and organizational &amp; social sciences to provide taxonomies of diversity concepts and pathways of potential benefit that we take to be relevant to the ML context.', 'We situate these taxonomies (of concepts and pathways) in the lifecycle of ML systems and make a case for their usefulness in fair and accountable ML by showing how they help clarify existing findings and disagreements, and point towards new directions of research.', ""I'm grateful for having @mariadearteaga as my collaborator on this. The paper is a revised and expanded version of our translation tutorial at #FAccT21. You can watch the video for that tutorial here: https://t.co/gp2qcTRgvl""]",https://arxiv.org/abs/2107.09163,"There has been a surge of recent interest in sociocultural diversity in machine learning (ML) research, with researchers (i) examining the benefits of diversity as an organizational solution for alleviating problems with algorithmic bias, and (ii) proposing measures and methods for implementing diversity as a design desideratum in the construction of predictive algorithms. Currently, however, there is a gap between discussions of measures and benefits of diversity in ML, on the one hand, and the broader research on the underlying concepts of diversity and the precise mechanisms of its functional benefits, on the other. This gap is problematic because diversity is not a monolithic concept. Rather, different concepts of diversity are based on distinct rationales that should inform how we measure diversity in a given context. Similarly, the lack of specificity about the precise mechanisms underpinning diversity's potential benefits can result in uninformative generalities, invalid experimental designs, and illicit interpretations of findings. In this work, we draw on research in philosophy, psychology, and social and organizational sciences to make three contributions: First, we introduce a taxonomy of different diversity concepts from philosophy of science, and explicate the distinct epistemic and political rationales underlying these concepts. Second, we provide an overview of mechanisms by which diversity can benefit group performance. Third, we situate these taxonomies--of concepts and mechanisms--in the lifecycle of sociotechnical ML systems and make a case for their usefulness in fair and accountable ML. We do so by illustrating how they clarify the discourse around diversity in the context of ML systems, promote the formulation of more precise research questions about diversity's impact, and provide conceptual tools to further advance research and practice. ",Diversity in Sociotechnical Machine Learning Systems
60,1417793989231747078,3351977373,Alex Clark,"['Ever wondered if you can find full photon temporal wavepacket indistinguishability from a cw excited emitter? See our new arXiv paper which compares pulsed and cw interference of photons from a DBT molecule! <LINK> @QSUMproject @ImperialPhysics @QETLabsBristol', '@igordownunder @QSUMproject @ImperialPhysics @QETLabsBristol In cw, the length will just shift the side dips in the histogram to different times. The only requirement is that they are far enough away from the central dip. There are photons at all times, and the histogram shows those that arrive simultaneously in the central dip.']",https://arxiv.org/abs/2107.09434,"The indistinguishability of successively generated photons from a single quantum emitter is most commonly measured using two-photon interference at a beam splitter. Whilst for sources excited in the pulsed regime the measured bunching of photons reflects the full wavepacket indistinguishability of the emitted photons, for continuous wave (cw) excitation the inevitable dependence on detector timing resolution and driving strength obscures the underlying photon interference process. Here we derive a method to extract the photon indistinguishability from cw measurements by considering the relevant correlation functions. The equivalence of both methods is experimentally verified through comparison of cw and pulsed excitation of an archetypal source of photons, a single molecule. ","Photon indistinguishability measurements under pulsed and continuous
  excitation"
61,1417712570647998473,145500767,Enrique Lopez Rodriguez,"['New paper w/ @asborlaff @suzIQUV from our Legacy Program on extragalactic magnetism: The gas streams of NGC1097 follow the B-field, which feeds the black hole with matter from the host galaxy. We used @ehtelescope techniques to estimate B-field modes. \n<LINK> <LINK>']",https://arxiv.org/abs/2107.09063,"Galactic bars are frequent in disk galaxies and they may support the transfer of matter towards the central engine of active nuclei. The barred galaxy NGC 1097 has magnetic forces controlling the gas flow at several kpc scales, which suggest that magnetic fields (B-fields) are dynamically important along the bar and nuclear ring. However, the effect of the B-field on the gas flows in the central kpc scale has not been characterized. Using thermal polarized emission at $89$ $\mu$m with HAWC+/SOFIA, here, we measure that the polarized flux is spatially located at the contact regions of the outer-bar with the starburst ring. The linear polarization decomposition analysis shows that the $89$ $\mu$m and radio ($3.5$ and $6.2$ cm) polarization traces two different modes, $m$, of the B-field: a constant B-field orientation and dominated by $m=0$ at $89$ $\mu$m, and a spiral B-field dominated by $m=2$ at radio. We show that the B-field at 89 $\mu$m is concentrated in the warmest region of a shock driven by the galactic-bar dynamics in the contact regions between the outer-bar with the starburst ring. Radio polarization traces a superposition of the spiral B-field outside and within the starburst ring. According to Faraday rotation measures between $3.5$ and $6.2$ cm, the radial component of the B-field along the contact regions points toward the galaxy's center on both sides. We conclude that gas streams outside and within the starburst ring follow the B-field, which feeds the black hole with matter from the host galaxy. ","Extragalactic magnetism with SOFIA (Legacy Program) -- II: A
  magnetically-driven flow in the starburst ring of NGC 1097"
62,1417658290553585665,370378404,Takehiko Yasuda,"['In my new paper, I discuss the isomorphism problem for projective schemes. A subject different from ones that I worked on previously.\n<LINK>']",https://arxiv.org/abs/2107.09277,"We discuss the isomorphism problem of projective schemes; given two projective schemes, can we algorithmically decide whether they are isomorphic? We give affirmative answers in the case of one-dimensional projective schemes, the case of smooth irreducible varieties with a big canonical sheaf or a big anti-canonical sheaf, and the case of K3 surfaces with a finite automorphism group. As related algorithmic problems, we also discuss decidability of positivity properties of invertible sheaves, and approximation of the nef cone and the pseudo-effective cone. ","The isomorphism problem of projective schemes and related algorithmic
  problems"
63,1417647947018379272,32965031,Sami Douba,"['New paper 🙃 Together with work of @agolian, Przytycki–Wise, Liu, and others, the main result implies that a closed aspherical 3-manifold admits a nonpositively curved Riemannian metric if and only if its fundamental group embeds in a compact Lie group. <LINK>']",https://arxiv.org/abs/2107.09490,"Let $\Gamma$ be a finitely generated group of matrices over $\mathbb{C}$. We construct an isometric action of $\Gamma$ on a complete CAT(0) space $X$ such that the restriction of this action to any subgroup of $\Gamma$ containing no nontrivial unipotent elements is well behaved. As an application, we show that if $M$ is a graph manifold that does not admit a nonpositively curved Riemannian metric, then any finite-dimensional $\mathbb{C}$-linear representation of $\pi_1(M)$ maps a nontrivial element of $\pi_1(M)$ to a unipotent matrix. In particular, the fundamental groups of such 3-manifolds do not admit any faithful finite-dimensional unitary representations. ",Proper CAT(0) actions of unipotent-free linear groups
64,1417638452602892291,11778512,Mason Porter,"['We have an exciting new methods paper on arXiv: <LINK>\n\nTitle: Analysis of Spatiotemporal Anomalies Using Persistent Homology: Case Studies with COVID-19 Data\n\nAuthors: Abigail Hickok, Deanna Needell, Mason A. Porter <LINK>']",https://arxiv.org/abs/2107.09188,"We develop a method for analyzing spatial and spatiotemporal anomalies in geospatial data using topological data analysis (TDA). To do this, we use persistent homology (PH), which allows one to algorithmically detect geometric voids in a data set and quantify the persistence of such voids. We construct an efficient filtered simplicial complex (FSC) such that the voids in our FSC are in one-to-one correspondence with the anomalies. Our approach goes beyond simply identifying anomalies; it also encodes information about the relationships between anomalies. We use vineyards, which one can interpret as time-varying persistence diagrams (which are an approach for visualizing PH), to track how the locations of the anomalies change with time. We conduct two case studies using spatially heterogeneous COVID-19 data. First, we examine vaccination rates in New York City by zip code at a single point in time. Second, we study a year-long data set of COVID-19 case rates in neighborhoods of the city of Los Angeles. ","Analysis of Spatial and Spatiotemporal Anomalies Using Persistent
  Homology: Case Studies with COVID-19 Data"
