,TweetID,AuthorID,AuthorName,Tweets,arxiv_link,Abstract,Title
94,1167308433382469632,911474423412219904,Julien Tierny,['Need to compare in-situ simulations to an acquired ground-truth? Checkout our new #ldav 2019 application paper using #TopologicalDataAnalysis and #OptimalTransport <LINK> #TopologyToolKit #datascience #visualization #machinelearning @INS2I_CNRS @Kitware <LINK>'],https://arxiv.org/abs/1908.07841,"This application paper presents a novel framework based on topological data analysis for the automatic evaluation and ranking of viscous finger simulation runs in an ensemble with respect to a reference acquisition. Individual fingers in a given time-step are associated with critical point pairs in the distance field to the injection point, forming persistence diagrams. Different metrics, based on optimal transport, for comparing time-varying persistence diagrams in this specific applicative case are introduced. We evaluate the relevance of the rankings obtained with these metrics, both qualitatively thanks to a lightweight web visual interface, and quantitatively by studying the deviation from a reference ranking suggested by experts. Extensive experiments show the quantitative superiority of our approach compared to traditional alternatives. Our web interface allows experts to conveniently explore the produced rankings. We show a complete viscous fingering case study demonstrating the utility of our approach in the context of porous media fluid flow, where our framework can be used to automatically discard physically-irrelevant simulation runs from the ensemble and rank the most plausible ones. We document an in-situ implementation to lighten I/O and performance constraints arising in the context of parametric studies. ","Ranking Viscous Finger Simulations to an Acquired Ground Truth with
  Topology-aware Matchings"
95,1166424051167793152,348889317,Marsden Lab,"[""Just out on the @arxiv  Jongmin's new paper on UQ in coronary models with FSI using clinically-derived data uncertainty.  @simvascular @ICMEStanford <LINK>""]",https://arxiv.org/abs/1908.07522,"Cardiovascular simulations are increasingly used for non-invasive diagnosis of cardiovascular disease, to guide treatment decisions, and in the design of medical devices. Quantitative assessment of the variability of simulation outputs due to input uncertainty is a key step toward further integration of cardiovascular simulations in the clinical workflow. In this study, we present uncertainty quantification in computational models of the coronary circulation to investigate the effect of uncertain parameters, including coronary pressure waveform, intramyocardial pressure, morphometry exponent, and the vascular wall Young's modulus. We employ a left coronary artery model with deformable vessel walls, simulated via an ALE framework for FSI, with a prescribed inlet pressure and open-loop lumped parameter network outlet boundary conditions. Stochastic modeling of the uncertain inputs is determined from intra-coronary catheterization data or gathered from the literature. Uncertainty propagation is performed using several approaches including Monte Carlo, Quasi MC, stochastic collocation, and multiwavelet stochastic expansion. Variabilities in QoI, including branch pressure, flow, wall shear stress, and wall deformation are assessed. We find that uncertainty in inlet pressures and intramyocardial pressures significantly affect all resulting QoIs, while uncertainty in elastic modulus only affects the mechanical response of the vascular wall. Variability in the morphometry exponent has little effect on coronary hemodynamics or wall mechanics. Finally, we compare convergence behaviors of statistics of QoIs using several uncertainty propagation methods. From the simulation results, we conclude that the multi-wavelet stochastic expansion shows superior accuracy and performance against Quasi Monte Carlo and stochastic collocation methods. ","The effects of clinically-derived parametric data uncertainty in
  patient-specific coronary simulations with deformable walls"
96,1164875248283656192,908673384611041281,Dieuwke Hupkes,"['Curious what people may mean when they say a neural network is (not) compositional? And how that relates to linguistics and philosophy literature on compositionality? \n\nCheck our new paper on compositionality in neural networks: <LINK>! <LINK>', 'Whether neural networks are able to learn linguistic compositionally has been the topic of debate ever since neural networks were first used for natural language processing.', 'But what does it actually mean for a neural network to be compositional? What definition of compositionality is used? And how does this relate to the principle of compositionality and the vast amount of literature about this topic?', 'In this paper, we are explicit about different aspects of compositionality that may be considered important by different researchers, starting from linguistic and philosophical research about compositionality.', 'We propose five theoretically grounded tests and use them to diagnose three popular sequence to sequence architectures: a recurrent architecture, a convolution-based architecture and a transformer model. https://t.co/6P1Q0KP4e6', 'We instantiate these tests on a strongly compositional artificial data set. But make sure the distribution of lengths and parse tree depths of the sentences match the distributions observed in a corpus with English sentences (WMT17) https://t.co/Re5Ed706sF', 'We test if models can deal with this compositional data set at all;', 'If models can systematically recombine new pairs of words not seen in the training data;', 'If they can productivey generalise to input sentences that are longer than the ones they are trained on;', 'Under what conditions they infer that words are synonyms, and how they deal with that;', 'If they compute representations in a *localist* fashion, computing the meanings of all smaller parts first, or instead use the global composition operations.', 'And how much evidence they need to learn *exceptions* to rules. Do they *overgeneralise* when they are presented with exceptions during training?', 'Some teasers from our findings:', 'They do overgeneralise!\n\nConvolution based models and Transformers first overgeneralise and then memorise the exception, LSTMs have difficulty accommodating both rules and exceptions.\n\n(For the impact of the exception frequency, check the paper!) https://t.co/FJYLhjcUu4', 'Although models generally have good scores on the task itself, they do not seem to compute the meanings of phrases in a localist fashion.', 'When comparing the consistency of *incorrect* outputs, however, it seems that in the most difficult condition, none of the models really inferred that words were synonyms.', 'The systematicity scores for all models are surprisingly much lower than the scores for the overall data set, which also requires systematic recombinations of input words.', 'They do overgeneralise!\n\nConvolution based models and Transformers first overgeneralise and then memorise the exception, LSTMs have difficulty accomodating both rules and exceptions.\n\n(For the impact of the exception frequency, check the paper!) https://t.co/DKVRrcXTij', 'Although models generally have good scores on the task itself, they do not seem to compute the meanings of phrases in a localist fashion.', ""To take apart models' ability to correctly compute compositional meanings and to infer synonyms, for this test we look at their *consistency* rather than their accuracy. Also, we consider how close synonyms are in the embedding space."", ""Interestingly, even when the synonyms are distributionally dissimilar (but are identical wrt their 'translation'), transformer models put them close together in the embedding space."", 'When comparing the consistency of *incorrect* outputs, however, it seems that in the most difficult condition, none of the models really inferred that words were synonyms.', 'To assess models productivity, we redistribute the training data such that all long sequences are in the test data.', 'This allows us to compare models\' accuracy when they  *do* have evidence for a particular length of sequence and when they do not. We measure this in terms of different definitions of ""length"", such as number of tokens and parse tree depth.', 'Probably unsurprisingly to many, models are not very good at generalising to longer sequences. https://t.co/Mv7dLzZ65e', 'Interestingly, this does *not* seem to stem from early emission of their end-of-sequence symbol (the ""&lt;eos&gt;-problem""): For all architectures, the percentage of times the generated output is contained in the true output is less than 20%.', 'The systematicity scores for all models are surprisingly much lower than the scores for the overall data set, which also requires systematic recombinations of input words.', 'Why? What else? And what does this have to do with compositionality in natural language?\n\nFor more results, motivation and elaborate discussion, have a look: https://t.co/AqyUZUGHNg!', ""@strubell @AmsterdamNLP I looked at your workshop website before! It looks really interesting and I would love to be there but I won't be able to attend NeurIPS this year""]",https://arxiv.org/abs/1908.08351,"Despite a multitude of empirical studies, little consensus exists on whether neural networks are able to generalise compositionally, a controversy that, in part, stems from a lack of agreement about what it means for a neural model to be compositional. As a response to this controversy, we present a set of tests that provide a bridge between, on the one hand, the vast amount of linguistic and philosophical theory about compositionality of language and, on the other, the successful neural models of language. We collect different interpretations of compositionality and translate them into five theoretically grounded tests for models that are formulated on a task-independent level. In particular, we provide tests to investigate (i) if models systematically recombine known parts and rules (ii) if models can extend their predictions beyond the length they have seen in the training data (iii) if models' composition operations are local or global (iv) if models' predictions are robust to synonym substitutions and (v) if models favour rules or exceptions during training. To demonstrate the usefulness of this evaluation paradigm, we instantiate these five tests on a highly compositional data set which we dub PCFG SET and apply the resulting tests to three popular sequence-to-sequence models: a recurrent, a convolution-based and a transformer model. We provide an in-depth analysis of the results, which uncover the strengths and weaknesses of these three architectures and point to potential areas of improvement. ",Compositionality decomposed: how do neural networks generalise?
97,1164334533908545536,1001049754787368960,Dr. Yu-Dai Tsai,['Our new paper is now out on arXiv: <LINK>'],https://arxiv.org/abs/1908.07525,"We study hidden sector and long-lived particles at past (CHARM and NuCal), present (NA62 and SeaQuest/DarkQuest), and future (LongQuest) experiments that are at the high-energy frontier of the intensity frontier. We focus on exploring the minimal vector portal and variere-lifetime particles (VLP). VLP models have mostly been devised to explain experimental anomalies while avoiding existing constraints, and we demonstrate that proton fixed-target experiments provide one of the most powerful probes for the sub-GeV to few GeV mass range of the VLP models, using inelastic dark matter (iDM) as an example. We consider an iDM model with small mass splitting that yields the observed dark matter (DM) relic abundance, and a scenario with a sizable mass splitting that can also explain the muon $g-2$ anomaly. We set strong limits based on the CHARM and NuCal experiments, which come close to excluding iDM as full-abundance thermal DM candidates in the MeV to GeV mass range, for the mass arrangements and small mass splittings we consider. We also study the future projections based on NA62 and SeaQuest/DarkQuest, and update the constraints of the minimal dark photon parameter space. We found that NuCal sets the only existing constraint in $\epsilon \sim 10^{-8} - 10^{-4}$ regime reaching $\sim$ 800 MeV in dark photon mass due to the resonant enhancement of the proton bremsstrahlung production. Finally, we propose LongQuest, a three-stage thorough retool of the SeaQuest experiment with short ($\lesssim$ 5 m), medium ($\sim$ 5 m), and long baseline ($\gtrsim$ 35 m) tracking stations/detectors, as a multi-purpose machine to explore dark sector particles with a wide range of couplings to the standard model sector. ","The High-Energy Frontier of the Intensity Frontier: Closing the Dark
  Photon, Inelastic Dark Matter, and Muon g-2 Windows"
98,1161443195479371776,280403336,Sean Welleck,"['our new paper:\n\n""Neural Text d̶e̶Generation with Unlikelihood Training""\n\nis now on arxiv! (w/ @uralik1, @stephenroller, Emily Dinan, @kchonyc, @jaseweston) <LINK>\n\nA step towards solving the case of neural text degeneration 🔎 <LINK>', ""@uralik1 @stephenroller @kchonyc @jaseweston Language models (e.g. GPT-2) tend to produce repetitive and dull ('degenerate') text, especially with greedy or beam search https://t.co/EFLQlZdu3a"", ""We propose 'unlikelihood training', which augments maximum likelihood with penalties on certain candidate tokens https://t.co/kxdQYZzjpH"", 'Using unlikelihood loss at the token and sequence levels  reduces repetitions, leading to improved generation quality https://t.co/EeM93TccUd']",https://arxiv.org/abs/1908.04319,"Neural text generation is a key tool in natural language applications, but it is well known there are major problems at its core. In particular, standard likelihood training and decoding leads to dull and repetitive outputs. While some post-hoc fixes have been proposed, in particular top-$k$ and nucleus sampling, they do not address the fact that the token-level probabilities predicted by the model are poor. In this paper we show that the likelihood objective itself is at fault, resulting in a model that assigns too much probability to sequences containing repeats and frequent words, unlike those from the human training distribution. We propose a new objective, unlikelihood training, which forces unlikely generations to be assigned lower probability by the model. We show that both token and sequence level unlikelihood training give less repetitive, less dull text while maintaining perplexity, giving superior generations using standard greedy or beam search. According to human evaluations, our approach with standard beam search also outperforms the currently popular decoding methods of nucleus sampling or beam blocking, thus providing a strong alternative to existing techniques. ",Neural Text Generation with Unlikelihood Training
99,1159778961381089280,1002014071,Frank Wilczek,['New paper with Jordan Cotler on measuring entangled many-body wave functions: <LINK> .   Strategy reminiscent of Mastermind: <LINK> <LINK>'],https://arxiv.org/abs/1908.02754,"It is now experimentally possible to entangle thousands of qubits, and efficiently measure each qubit in parallel in a distinct basis. To fully characterize an unknown entangled state of $n$ qubits, one requires an exponential number of measurements in $n$, which is experimentally unfeasible even for modest system sizes. By leveraging (i) that single-qubit measurements can be made in parallel, and (ii) the theory of perfect hash families, we show that all $k$-qubit reduced density matrices of an $n$ qubit state can be determined with at most $e^{\mathcal{O}(k)} \log^2(n)$ rounds of parallel measurements. We provide concrete measurement protocols which realize this bound. As an example, we argue that with current experiments, the entanglement between every pair of qubits in a system of 1000 qubits could be measured and completely characterized in a few days. This corresponds to completely characterizing entanglement of nearly half a million pairs of qubits. ",Quantum Overlapping Tomography
100,1159696764921733120,751985317742120961,Andrew Zic,"['New paper out on the arXiv: <LINK>\nWe were using ASKAP to target Proxima Cen as a VAST survey test obs, and we noticed a circularly polarised point source with no archival multiwavelength counterparts. Parkes UWL follow-up found a 2.7 ms pulsar! <LINK>', 'this finding is an excellent illustration of the strength of wide-field radio astronomy for finding unexpected things in your data!', 'Awesome work by the whole team to put this together quickly -  D Kaplan, S Dai, @elenchically, @taraxmurphy, @Astro_Dougal, @jfkaczmarek and others from @CSIRO_ATNF \n\nWhat a blast']",https://arxiv.org/abs/1908.03163,"We identified a highly-polarized, steep-spectrum radio source in a deep image with the Australian Square Kilometre Array Pathfinder (ASKAP) telescope at 888 MHz. After considering and rejecting a stellar origin for this source, we discovered a new millisecond pulsar (MSP) using observations from the Parkes radio telescope. This pulsar has period 2.77 ms and dispersion measure 228.27 pc/cm**3. Although this pulsar does not yet appear to be particularly remarkable, the short spin period, wide profile and high dispersion measure do make it relatively hard to discover through traditional blind periodicity searches. Over the course of several weeks we see changes in the barycentric period of this pulsar that are consistent with orbital motion in a binary system, but the properties of any binary need to be confirmed by further observations. While even a deep ASKAP survey may not identify large numbers of new MSPs compared to the existing population, it would be competitive with existing all-sky surveys and could discover interesting new MSPs at high Galactic latitude without the need for computationally-expensive all-sky periodicity searches. ","Serendipitous Discovery of PSR J1431-6328 as a Highly-Polarized Point
  Source with the Australian SKA Pathfinder"
101,1159365444735815680,1086210121,Jan Bolmer,['New paper out: New constraints on the physical conditions in H2-bearing GRB-host damped Lyman-α absorbers\n<LINK>'],https://arxiv.org/abs/1908.02309,"We report the detections of molecular hydrogen (H$_2$), vibrationally-excited H$_2$ (H$^*_2$), and neutral atomic carbon (CI), in two new afterglow spectra of GRBs\,181020A ($z=2.938$) and 190114A ($z=3.376$), observed with X-shooter at the Very Large Telescope (VLT). Both host-galaxy absorption systems are characterized by strong damped Lyman-$\alpha$ absorbers (DLAs) and substantial amounts of molecular hydrogen with $\log N$(HI, H$_2$) = $22.20\pm 0.05,~20.40\pm 0.04$ (GRB\,181020A) and $\log N$(HI, H$_2$) = $22.15\pm 0.05,~19.44\pm 0.04$ (GRB\,190114A). The DLA metallicites, depletion levels and dust extinctions are [Zn/H] = $-1.57\pm 0.06$, [Zn/Fe] = $0.67\pm 0.03$, and $A_V = 0.27\pm 0.02$\,mag (GRB\,181020A) and [Zn/H] = $-1.23\pm 0.07$, [Zn/Fe] = $1.06\pm 0.08$, and $A_V = 0.36\pm 0.02$\,mag (GRB\,190114A). We then examine the molecular gas content of all known H$_2$-bearing GRB-DLAs and explore the physical conditions and characteristics of these systems. We confirm that H$_2$ is detected in all CI- and H$^*_2$-bearing GRB absorption systems, but that these rarer features are not necessarily detected in all GRB H$_2$ absorbers. We find that a large molecular fraction of $f_{\rm H_2} \gtrsim 10^{-3}$ is required for CI to be detected. The defining characteristic for H$^*_2$ to be present is less clear, though a large H$_2$ column density is an essential factor. We then derive the H$_2$ excitation temperatures of the molecular gas and find that they are relatively low with $T_{\rm ex} \approx 100 - 300$\,K, however, there could be evidence of warmer components populating the high-$J$ H$_2$ levels in GRBs\,181020A and 190114A. Finally, we demonstrate that the otherwise successful X-shooter GRB afterglow campaign is hampered by a significant dust bias excluding the most dust-obscured H$_2$ absorbers from identification [Abridged]. ","New constraints on the physical conditions in H$_2$-bearing GRB-host
  damped Lyman-$\alpha$ absorbers"
102,1171721215138045953,4873684235,Ryan McConville,['In this work we propose a new reinforcement learning method that integrates feedback from multiple sources to better tailor policy. We demonstrate it performing feature selection on a #wearable to improve energy efficiency in a #smarthome #IoT setting.\n\n<LINK>'],https://arxiv.org/abs/1908.06134,"Recent advances in both machine learning and Internet-of-Things have attracted attention to automatic Activity Recognition, where users wear a device with sensors and their outputs are mapped to a predefined set of activities. However, few studies have considered the balance between wearable power consumption and activity recognition accuracy. This is particularly important when part of the computational load happens on the wearable device. In this paper, we present a new methodology to perform feature selection on the device based on Reinforcement Learning (RL) to find the optimum balance between power consumption and accuracy. To accelerate the learning speed, we extend the RL algorithm to address multiple sources of feedback, and use them to tailor the policy in conjunction with estimating the feedback accuracy. We evaluated our system on the SPHERE challenge dataset, a publicly available research dataset. The results show that our proposed method achieves a good trade-off between wearable power consumption and activity recognition accuracy. ","Online Feature Selection for Activity Recognition using Reinforcement
  Learning with Multiple Feedback"
103,1169154244496302085,1485111200,Franck Iutzeler,"['""On the convergence of single-call stochastic extra-gradient methods"" <LINK> w/ Y.-G. Hsieh, P. Mertikopoulos, J. Malick is accepted at #NeurIPS2019 \nWe study the rate of Extragradient variants with 1 oracle call/iter. to solve Variational Inequalities']",https://arxiv.org/abs/1908.08465,"Variational inequalities have recently attracted considerable interest in machine learning as a flexible paradigm for models that go beyond ordinary loss function minimization (such as generative adversarial networks and related deep learning systems). In this setting, the optimal $\mathcal{O}(1/t)$ convergence rate for solving smooth monotone variational inequalities is achieved by the Extra-Gradient (EG) algorithm and its variants. Aiming to alleviate the cost of an extra gradient step per iteration (which can become quite substantial in deep learning applications), several algorithms have been proposed as surrogates to Extra-Gradient with a \emph{single} oracle call per iteration. In this paper, we develop a synthetic view of such algorithms, and we complement the existing literature by showing that they retain a $\mathcal{O}(1/t)$ ergodic convergence rate in smooth, deterministic problems. Subsequently, beyond the monotone deterministic case, we also show that the last iterate of single-call, \emph{stochastic} extra-gradient methods still enjoys a $\mathcal{O}(1/t)$ local convergence rate to solutions of \emph{non-monotone} variational inequalities that satisfy a second-order sufficient condition. ",On the convergence of single-call stochastic extra-gradient methods
104,1168406057821048832,1710697381,Diego F. Torres,"['1/n: We release today (MNRAS) our study on the ""Synchro-curvature modelling of the multi-frequency non-thermal emission of pulsars"". <LINK> It includes the analysis of the MW spectrum of 36 pulsars developing further a theoretical model we introduced last year. <LINK>']",https://arxiv.org/abs/1908.11574,"We apply a synchro-curvature spectral emission model based on characterizing the dynamics of magnetospheric particles to fit the phase-average spectra of the most extended database for the non-thermal spectra of pulsars. We consider 36 pulsars with well-determined non-thermal spectra from X-rays to gamma-rays. The sample includes Crab and Crab twin, for which the spectra extends even to the optical/ultraviolet and infrared energies. We find that the model --with just three physical parameters and a global scaling-- can fit the observations well across eight orders of magnitude for 18 of the 36 pulsars studied. Additionally, we find a set of 8 pulsars for which the model still provides arguably good fits and another set of 10 pulsars for which the model fails in reproducing the spectra. We discuss why, propose and provide physical interpretations for a simple model extension (related to the geometry of the accelerating system with regards to the observer) that allows dealing with all such cases, ultimately providing very good fits for all pulsars. The extended model is still austere, adding only two additional parameters to the former set, of the same kind of the ones previously used. We use these fits to discuss issues going from the observed spectral origin, to the extent of the dominance of synchrotron or curvature regimes, the use of a model as predictor for searching new non-thermal pulsars starting from gamma-ray surveys, and how the model offers a setting where phase shifts between X-ray and gamma-ray light curves would naturally arise. ","Synchro-curvature modelling of the multi-frequency non-thermal emission
  of pulsars"
