,TweetID,AuthorID,AuthorName,Tweets,arxiv_link,Abstract,Title
29,1164698872939188224,382008009,Miles Cranmer,"['New paper with @richardgalvez, Lauren Anderson, @DavidSpergel and @cosmo_shirley! Check it out: <LINK>. \n \nWe use a ""normalizing flow"" to model Gaia\'s color-magnitude diagram, and generate a catalog of distances to 640 million nearby stars. <LINK>']",https://arxiv.org/abs/1908.08045,"We demonstrate an algorithm for learning a flexible color-magnitude diagram from noisy parallax and photometry measurements using a normalizing flow, a deep neural network capable of learning an arbitrary multi-dimensional probability distribution. We present a catalog of 640M photometric distance posteriors to nearby stars derived from this data-driven model using Gaia DR2 photometry and parallaxes. Dust estimation and dereddening is done iteratively inside the model and without prior distance information, using the Bayestar map. The signal-to-noise (precision) of distance measurements improves on average by more than 48% over the raw Gaia data, and we also demonstrate how the accuracy of distances have improved over other models, especially in the noisy-parallax regime. Applications are discussed, including significantly improved Milky Way disk separation and substructure detection. We conclude with a discussion of future work, which exploits the normalizing flow architecture to allow us to exactly marginalize over missing photometry, enabling the inclusion of many surveys without losing coverage. ","Modeling the Gaia Color-Magnitude Diagram with Bayesian Neural Flows to
  Constrain Distance Estimates"
30,1164665133890592768,1137569442404036609,Daniel Liu,"['New paper 📰:\nAdversarial point perturbations on 3D objects\n<LINK>\n\nBlog post: <LINK>\n\n*FOUR* novel #adversarial attacks against #3D #pointcloud #DeepLearning!\n\n#security #MachineLearning\n\n1/10 <LINK>', 'Thanks to Ronald Yu and Hao Su from @UCSanDiego for minimally mentoring me and providing GPUs even though I am a high school student!\n\nThis paper would not be possible without previous work by @goodfellow_ian @aleks_madry @NicolasPapernot @alexey2004 and many others!\n\n2/10', 'Idea 💡: shape-aware attacks with *just* unordered point sets.\n\nTwo categories:\n- Distributional: imperceptible; measures perturbation through Hausdorff metric.\n- Shape: global changes to shape; realistic and robust against point removal defenses.\n\n3/10 https://t.co/EKOSqIN1qO', 'Distributional attack: estimate shape of point set and use projected gradient descent to keep perturbations on the shape.\n\nShape estimation uses triangulation algorithms, and projection is sped up with a metric tree.\n\n4/10 https://t.co/nf3YqF5mkD', 'For reference, directly using gradient descent results in many outlier points floating around in mid-air:\n\n5/10 https://t.co/tcMVqQYSTx', 'Perturbation resampling attack: gradient descent + resampling points onto shape inferred through triangulation to maintain an even sampling of points on the shape.\n\n6/10 https://t.co/V73fsEiUWk', 'Adversarial sticks: perturb a few points and connect them to triangulated shape by resampling points, instead of the harder task of orienting sticks in 3D. This is easier to construct IRL.\n\n7/10 https://t.co/87ZqfUFGnc', 'Adversarial sinks: instead of perturbing single points, move ""black holes"" that attract points based on a radial basis function to change the shape. This is fully differentiable.\n\n8/10 https://t.co/hYzl6eOoou', 'Shape attacks perform much better than naive gradient descent (iter. gradient L_2) even when we remove up to half of the points (using previously proposed algorithms) as a defense.\n\n9/10 https://t.co/Yj5aItwIYV', 'Please read the blog post (https://t.co/FPbzLsT2Op) for a brief history of ideas in the field of point set adversarial attacks.\n\n10/10', '@UCSanDiego @goodfellow_ian @aleks_madry @NicolasPapernot @alexey2004 Also @ChrSzegedy for the first paper on adversarial examples!']",https://arxiv.org/abs/1908.06062,"The importance of training robust neural network grows as 3D data is increasingly utilized in deep learning for vision tasks in robotics, drone control, and autonomous driving. One commonly used 3D data type is 3D point clouds, which describe shape information. We examine the problem of creating robust models from the perspective of the attacker, which is necessary in understanding how 3D neural networks can be exploited. We explore two categories of attacks: distributional attacks that involve imperceptible perturbations to the distribution of points, and shape attacks that involve deforming the shape represented by a point cloud. We explore three possible shape attacks for attacking 3D point cloud classification and show that some of them are able to be effective even against preprocessing steps, like the previously proposed point-removal defenses. ",Adversarial shape perturbations on 3D point clouds
31,1164542112785997824,201811433,Ameet Talwalkar,"['Want to learn more about Federated Learning (i.e., privacy-preserving training in distributed, heterogenous networks)? Check out our new survey paper: <LINK>']",https://arxiv.org/abs/1908.07873,"Federated learning involves training statistical models over remote devices or siloed data centers, such as mobile phones or hospitals, while keeping data localized. Training in heterogeneous and potentially massive networks introduces novel challenges that require a fundamental departure from standard approaches for large-scale machine learning, distributed optimization, and privacy-preserving data analysis. In this article, we discuss the unique characteristics and challenges of federated learning, provide a broad overview of current approaches, and outline several directions of future work that are relevant to a wide range of research communities. ","Federated Learning: Challenges, Methods, and Future Directions"
32,1164528114170499073,3297640734,Stéphane Kéna-Cohen,"[""Ashutosh's paper finally on arXiv after patent submission. A new paradigm for grating design: <LINK>. A bit of ingenuity gives higher efficiency than AI-optimized gratings!""]",https://arxiv.org/abs/1908.07988,"Conventional surface-relief gratings are inefficient at deflecting normally-incident light by large angles. This constrains their use in many applications and limits the overall efficiency of any optical instrument integrating gratings. Here, we demonstrate a simple approach for the design of diffraction gratings that can be highly efficient for large deflection angles, while also offering additional functionality. The gratings are composed of a unit cell comprising a vertically-oriented asymmetric slot-waveguide. The unit cell shows oscillating unidirectional scattering behavior that can be precisely tuned as a function of the waveguide length. This occurs due to interference between multiple modes excited by the incident light. In contrast to metasurface-based gratings with multiple resonant sub-elements, a periodic arrangement of such non-resonant diffracting elements allows for broadband operation and a strong tolerance for variations in angle of incidence. Full-wave simulations show that our grating designs can exhibit diffraction efficiencies ranging from 94% for a deflection angle of 47$^\circ$ to 80% for deflection angle of 80$^\circ$. To demonstrate the multifunctionality of our grating design technique, we have also proposed a flat polarization beamsplitter, which allows for the separation of the two orthogonal polarizations by 80$^\circ$, with an efficiency of 80%. ","Large-Angle, Broadband and Multifunctional Gratings Based on Directively
  Radiating Waveguide Scatterers"
33,1164509296417263617,1049562817240674304,Marius Lindauer,"['Easily combining efficient multi-fidelity hyperparameter optimization (#HPO) and subsequent analysis of the results, now possible with #BOAH. Check out our new open-source #AutoML software paper: <LINK>']",https://arxiv.org/abs/1908.06756,"Hyperparameter optimization and neural architecture search can become prohibitively expensive for regular black-box Bayesian optimization because the training and evaluation of a single model can easily take several hours. To overcome this, we introduce a comprehensive tool suite for effective multi-fidelity Bayesian optimization and the analysis of its runs. The suite, written in Python, provides a simple way to specify complex design spaces, a robust and efficient combination of Bayesian optimization and HyperBand, and a comprehensive analysis of the optimization process and its outcomes. ","BOAH: A Tool Suite for Multi-Fidelity Bayesian Optimization & Analysis
  of Hyperparameters"
34,1164453782975143937,81312314,Stephan Leitner,['In our new paper we present an agent-based version of the hidden-action problem and shift the attention from decision-influencing on decision-facilitating information. #econtwitter #ABM \n\nCheck out the results at #arXiv 👇\n\n<LINK>'],https://arxiv.org/abs/1908.07998,"The hidden-action model captures a fundamental problem of principal-agent theory and provides an optimal sharing rule when only the outcome but not the effort can be observed. However, the hidden-action model builds on various explicit and also implicit assumptions about the information of the contracting parties. This paper relaxes key assumptions regarding the availability of information included in the hidden-action model in order to study whether and, if so, how fast the optimal sharing rule is achieved and how this is affected by the various types of information employed in the principal-agent relation. Our analysis particularly focuses on information about the environment and about feasible actions for the agent. We follow an approach to transfer closed-form mathematical models into agent-based computational models and show that the extent of information about feasible options to carry out a task only has an impact on performance if decision makers are well informed about the environment, and that the decision whether to perform exploration or exploitation when searching for new feasible options only affects performance in specific situations. Having good information about the environment, on the contrary, appears to be crucial in almost all situations. ","Decision-facilitating information in hidden-action setups: An
  agent-based approach"
35,1164223578922979328,2584290836,David Glowacki,"['new arXiv paper by helen deeks, @beccawalters95,  @AdrianMulholla1 &amp; @mikeoconnor0308 showing that interactive MD in VR can generate binding/unbinding pathways that recover crystallographic poses. <LINK> <LINK>', '@share1992 @share1992 apologies for forgetting to include you in this tweet. i totally spaced.', 'and couldnt have done it without the dimensionality reduction analysis by @share1992']",https://arxiv.org/abs/1908.07395,"Simulating drug binding and unbinding is a challenge, as the rugged energy landscapes that separate bound and unbound states require extensive sampling that consumes significant computational resources. Here, we describe the use of interactive molecular dynamics in virtual reality (iMD-VR) as an accurate low-cost strategy for flexible protein-ligand docking. We outline an experimental protocol which enables expert iMD-VR users to guide ligands into and out of the binding pockets of trypsin, neuraminidase, and HIV-1 protease, and recreate their respective crystallographic protein-ligand binding poses within 5 - 10 minutes. Following a brief training phase, our studies shown that iMD-VR novices were able to generate unbinding and rebinding pathways on similar timescales as iMD-VR experts, with the majority able to recover binding poses within 2.15 Angstrom RMSD of the crystallographic binding pose. These results indicate that iMD-VR affords sufficient control for users to carry out the detailed atomic manipulations required to dock flexible ligands into dynamic enzyme active sites and recover crystallographic poses, offering an interesting new approach for simulating drug docking and generating binding hypotheses. ","Interactive molecular dynamics in virtual reality for accurate flexible
  protein-ligand docking"
36,1164172727722418176,2746722060,Tristan Smith,"['Our (me, @VivPoulin, and Mustafa Amin) new paper came out today: <LINK> - we show that a fully dynamical oscillating scalar field can resolve the Hubble tension and fits the Planck CMB measurements as well as LCDM!', 'We also point out that these models generically predict additional isocurvature perturbations in the field and, for some forms of the scalar field potential, can undergo self-resonance, leading to the growth of scalar field perturbations', 'We also find that if a scenario like this explains the Hubble tension then (near) future CMB experiments (like @SimonsObs and CMB-S4) will detect departures from LCDM at very high significance!', 'Its super exciting to work on a theoretical topic with predictions that can be seen with near future measurements!']",http://arxiv.org/abs/1908.06995,"We present a detailed investigation of a sub-dominant oscillating scalar field ('early dark energy', EDE) in the context of resolving the Hubble tension. Consistent with earlier work, but without relying on fluid approximations, we find that a scalar field frozen due to Hubble friction until ${\rm log}_{10}(z_c)\sim3.5$, reaching $\rho_{\rm EDE}(z_c)/\rho_{\rm tot}\sim10$%, and diluting faster than matter afterwards can bring cosmic microwave background (CMB), baryonic acoustic oscillations, supernovae luminosity distances, and the late-time estimate of the Hubble constant from the SH0ES collaboration into agreement. A scalar field potential which scales as $V(\phi) \propto \phi^{2n}$ with $2\lesssim n\lesssim 3.4$ around the minimum is preferred at the 68% confidence level, and the {\em Planck} polarization places additional constraints on the dynamics of perturbations in the scalar field. In particular, the data prefers a potential which flattens at large field displacements. An MCMC analysis of mock data shows that the next-generation CMB observations (i.e., CMB-S4) can unambiguously detect the presence of the EDE at very high significance. This projected sensitivity to the EDE dynamics is mainly driven by improved measurements of the $E$-mode polarization. We also explore new observational signatures of EDE scalar field dynamics: (i) We find that depending on the strength of the tensor-to-scalar ratio, the presence of the EDE might imply the existence of isocurvature perturbations in the CMB. (ii) We show that a strikingly rapid, scale-dependent growth of EDE field perturbations can result from parametric resonance driven by the anharmonic oscillating field for $n\approx 2$. This instability and ensuing potentially nonlinear, spatially inhomogenoues, dynamics may provide unique signatures of this scenario. ","Oscillating scalar fields and the Hubble tension: a resolution with
  novel signatures"
37,1163817153587367942,1131272636321845248,Sohtaro Kanda,['We have posted new article to arXiv. This paper describes a new experimental proposal to search for a time-reversal symmetry breaking process in muon decay and the Majorana neutrinos. <LINK>'],https://arxiv.org/abs/1908.01630,"We propose a new experiment to search for a time-reversal (T) symmetry breaking process in muon decay and the Majoranality of the neutrinos. In the presence of V+A interactions, the Majoranality appears as a T-violating term in the muon decay width as shown by Doi et al, while in the Standard Model such a T-violating term is negligibly small. The presences of V+A interactions and the corresponding heavy right-handed Majorana neutrinos give us an important clue to solve two major issues in particle physics, the deficit of baryon asymmetry in the universe and the Majoranality of neutrinos. In the experiment, the polarization of positrons from muon decays is measured using a polarimeter consisting of a magnetized foil and a segmented calorimeter. According to our result of numerical calculation, a factor of ten improvement in sensitivity to the T-violating process is expected by a year of measurement at J-PARC Materials and Life Science Experimental Facility, compared to the most recent precursor experiment. ",Hunting for T-violation and Majoranality of Neutrinos in Muon Decays
38,1163812978254155777,627909670,Anna M Nierenberg,['Narrow-line lensing lets you see dark matter in twice the number of lenses! See our companion paper tonight for how this lets us put awesome new constraints on WDM\n<LINK>'],https://arxiv.org/abs/1908.06344,"The magnifications of compact-source lenses are extremely sensitive to the presence of low mass dark matter halos along the entire sight line from the source to the observer. Traditionally, the study of dark matter structure in compact-source strong gravitational lenses has been limited to radio-loud systems, as the radio emission is extended and thus unaffected by microlensing which can mimic the signal of dark matter structure. An alternate approach is to measure quasar nuclear-narrow line emission, which is free from microlensing and present in virtually all quasar lenses. In this paper, we double the number of systems which can be used for gravitational lensing analyses by presenting measurements of narrow-line emission from a sample of 8 quadruply imaged quasar lens systems, WGD J0405-3308, HS 0810+2554, RX J0911+0551, SDSS J1330+1810, PS J1606-2333, WFI 2026-4536, WFI 2033-4723 and WGD J2038-4008. We describe our updated grism spectral modelling pipeline, which we use to measure narrow-line fluxes with uncertainties of 2-10\%, presented here. We fit the lensed image positions with smooth mass models and demonstrate that these models fail to produce the observed distribution of image fluxes over the entire sample of lenses. Furthermore, typical deviations are larger than those expected from macromodel uncertainties. This discrepancy indicates the presence of perturbations caused by small-scale dark matter structure. The interpretation of this result in terms of dark matter models is presented in a companion paper. ","Double dark matter vision: twice the number of compact-source lenses
  with narrow-line lensing and the WFC3 grism"
39,1163793700557926400,994489580643549184,Alexander Rothkopf,"['It’s a pleasure to announce our new paper on #quarkonium #dynamics in the #QGP as quantum Brownian motion\n\n<LINK>\n\n1st derivation of nonlinear Schrödinger eq. for QQbar from microscopic #QCD. With T. Miura, Y. Akamatsu &amp; M. Asakawa from @osaka_univ @UniStavanger <LINK>']",http://arxiv.org/abs/1908.06293,"In this paper we study the real-time evolution of heavy quarkonium in the quark-gluon plasma (QGP) on the basis of the open quantum systems approach. In particular, we shed light on how quantum dissipation affects the dynamics of the relative motion of the quarkonium state over time. To this end we present a novel non-equilibrium master equation for the relative motion of quarkonium in a medium, starting from Lindblad operators derived systematically from quantum field theory. In order to implement the corresponding dynamics, we deploy the well established quantum state diffusion method. In turn we reveal how the full quantum evolution can be cast in the form of a stochastic non-linear Schr\""odinger equation. This for the first time provides a direct link from quantum chromodynamics (QCD) to phenomenological models based on non-linear Schr\""odinger equations. Proof of principle simulations in one-dimension show that dissipative effects indeed allow the relative motion of the constituent quarks in a quarkonium at rest to thermalize. Dissipation turns out to be relevant already at early times well within the QGP lifetime in relativistic heavy ion collisions. ",Quantum Brownian motion of a heavy quark pair in the quark-gluon plasma
40,1163783699206422530,14551614,Jason Weston,"['New EMNLP paper: \n\nMaking dialogue safer by asking humans to attack our models and learning from the experience!\n\nBuild it Break it Fix it for Dialogue Safety: Robustness from Adversarial Human Attack\n@em_dinan, Sam Humeau, B. Chintagunta, @jaseweston\n <LINK>', ""@em_dinan @emilymbender @haldaume3 @AllysonEttinger Thanks to @emilymbender @haldaume3 @AllysonEttinger Harita Kannan Sudha Rao Ephraim Rothschild for introducing Build It, Break It ideas to NLPers (or at least to us) at EMNLP '17""]",https://arxiv.org/abs/1908.06083,"The detection of offensive language in the context of a dialogue has become an increasingly important application of natural language processing. The detection of trolls in public forums (Gal\'an-Garc\'ia et al., 2016), and the deployment of chatbots in the public domain (Wolf et al., 2017) are two examples that show the necessity of guarding against adversarially offensive behavior on the part of humans. In this work, we develop a training scheme for a model to become robust to such human attacks by an iterative build it, break it, fix it strategy with humans and models in the loop. In detailed experiments we show this approach is considerably more robust than previous systems. Further, we show that offensive language used within a conversation critically depends on the dialogue context, and cannot be viewed as a single sentence offensive detection task as in most previous work. Our newly collected tasks and methods will be made open source and publicly available. ","Build it Break it Fix it for Dialogue Safety: Robustness from
  Adversarial Human Attack"
41,1163760584489390080,4836585957,Shaaban M. Shaaban,['Do you want to learn about whistler heat-flux instability in the Solar wind? Read our new paper <LINK> <LINK>'],https://arxiv.org/abs/1908.06666v1,"In collision-poor plasmas from space, e.g., solar wind or stellar outflows, the heat-flux carried by the strahl or beaming electrons is expected to be regulated by the self-generated instabilities. Recently, simultaneous field and particle observations have indeed revealed enhanced whistler-like fluctuations in the presence of counter-beaming populations of electrons, connecting these fluctuations to the whistler heat-flux instability (WHFI). This instability is predicted only for limited conditions of electron beam-plasmas, and was not captured in numerical simulations yet. In this letter we report the first simulations of WHFI in particle-in-cell (PIC) setups, realistic for the solar wind conditions, and without temperature gradients or anisotropies to trigger the instability in the initiation phase. The velocity distributions have a complex reaction to the enhanced whistler fluctuations conditioning the instability saturation by a decrease of the relative drifts combined with induced (effective) temperature anisotropies (heating the core electrons and pitch-angle and energy scattering the strahl). These results are in good agreement with a recent quasilinear approach, and support therefore a largely accepted belief that WHFI saturates at moderate amplitudes. In anti-sunward direction the strahl becomes skewed with a pitch-angle distribution decreasing in width as electron energy increases, that seems to be characteristic to self-generated whistlers and not to small-scale turbulence. ","] Particle-in-cell simulations of the whistler heat-flux instability in
  the solar wind conditions"
42,1163691784926633984,157973000,Michael Pfarrhofer,['New working paper online on the measurement of international uncertainty shocks and their consequences @SCEUS_Salzburg  #econometrics\n<LINK>'],https://arxiv.org/abs/1908.06325,"This paper investigates the time-varying impacts of international macroeconomic uncertainty shocks. We use a global vector autoregressive specification with drifting coefficients and factor stochastic volatility in the errors to model six economies jointly. The measure of uncertainty is constructed endogenously by estimating a scalar driving the innovation variances of the latent factors, which is also included in the mean of the process. To achieve regularization, we use Bayesian techniques for estimation, and introduce a set of hierarchical global-local priors. The adopted priors center the model on a constant parameter specification with homoscedastic errors, but allow for time-variation if suggested by likelihood information. Moreover, we assume coefficients across economies to be similar, but provide sufficient flexibility via the hierarchical prior for country-specific idiosyncrasies. The results point towards pronounced real and financial effects of uncertainty shocks in all countries, with differences across economies and over time. ","Measuring international uncertainty using global vector autoregressions
  with drifting parameters"
