,TweetID,AuthorID,AuthorName,Tweets,arxiv_link,Abstract,Title
122,1501934846796390400,40639812,Colin Cotter,"[""A new paper on the ArXiV, on new numerical algorithms to solve the optimal transport formulation of the semigeostrophic equations applied to Eady's frontogenesis problem.\n\n<LINK>"", 'This came about because I had spent several years trying to understand Mike Cullen\'s ""geometric algorithm""  for solving this formulation. Mike has also inspired great new work from my co-authors in Heriot-Watt, and I helped them to apply it to the frontogenesis problem.', 'The optimal transport formulation is written in terms of a transport map from the physical domain to a ""geostrophic"" one. In the discretisation, this is replaced by a many-to-one map characterised by Laguerre cells (or power cells) in this physical domain.', 'Each cell is mapped to a point in geostrophic space, which evolve according to an equation defined by the map. The calculation of these cells is accelerated by a recent damped Newton algorithm of Merigot et al.', 'My collaborators David, Charlie, Beatrice and Mark have also used this algorithm to provide a new proof of global-in-time weak solutions for the 3D semigeostrophic equations.\n\nhttps://t.co/QWvM9UwdLC']",https://arxiv.org/abs/2203.04903,"We present a new implementation of the geometric method of Cullen & Purser (1984) for solving the semi-geostrophic Eady slice equations which model large scale atmospheric flows and frontogenesis. The geometric method is a Lagrangian discretisation, where the PDE is approximated by a particle system. An important property of the discretisation is that it is energy conserving. We restate the geometric method in the language of semi-discrete optimal transport theory and exploit this to develop a fast implementation that combines the latest results from numerical optimal transport theory with a novel adaptive time-stepping scheme. Our results enable a controlled comparison between the Eady-Boussinesq vertical slice equations and their semi-geostrophic approximation. We provide further evidence that weak solutions of the Eady-Boussinesq vertical slice equations converge to weak solutions of the semi-geostrophic Eady slice equations as the Rossby number tends to zero. ","A new implementation of the geometric method for solving the Eady slice
  equations"
123,1501866964540608516,1440653053321891843,Luis Alfredo Anchordoqui,['New paper on arXiv today in which we set constraints on Dynamical Dark Matter ensembles from cosmological observations <LINK>'],https://arxiv.org/abs/2203.04818,"Decaying cold dark matter (CDM) has been considered as a mechanism to tackle the tensions in the Hubble expansion rate and the clustering of matter. However, polarization measurements of the cosmic microwave background (CMB) severely constrain the fraction of dark matter decaying before recombination, and lensing of the CMB anisotropies by large-scale structure set strong constraints on dark matter decaying after recombination. Together, these constraints make an explanation of the Hubble tension in terms of decaying dark matter unlikely. In response to this situation, we investigate whether a dark matter ensemble with CDM particles decaying into free streaming dark radiation in different epochs can alleviate the problem. We find that it does not. ","Decay of multiple dark matter particles to dark radiation in different
  epochs does not alleviate the Hubble tension"
124,1501860954891563013,1005395495949406208,Francesco Locatello,"['New paper from the @awscloud Causal Representation Learning team and @EPFL_en: ""Score matching enables causal discovery of nonlinear additive noise models"": the gradient of the log likelihood gives the topological order.\n\n<LINK> <LINK>', ""This work introduces a new approach for scalable causal discovery with machine learning: it (1) doesn't require enforcing the dag constraint so it's efficient and deep learning friendly (2) can leverage advances in scalable score based methods."", 'Work led by P. Rolland, w/ @CevherLIONS, M. Kleindessner, @c_russl, @bschoelkopf, D. Janzing and myself.']",https://arxiv.org/abs/2203.04413,"This paper demonstrates how to recover causal graphs from the score of the data distribution in non-linear additive (Gaussian) noise models. Using score matching algorithms as a building block, we show how to design a new generation of scalable causal discovery methods. To showcase our approach, we also propose a new efficient method for approximating the score's Jacobian, enabling to recover the causal graph. Empirically, we find that the new algorithm, called SCORE, is competitive with state-of-the-art causal discovery methods while being significantly faster. ","Score matching enables causal discovery of nonlinear additive noise
  models"
125,1501853905059303425,1134375290581524480,Kai Schmitz,"['New paper on the @arxiv: <LINK>, in which I paint a broad-brush picture of modern #cosmology for a more general audience. E.g. if you are an undergraduate wondering whether pursuing a #PhD in cosmology would be something for you, I recommend having a closer look.']",https://arxiv.org/abs/2203.04757,"This essay is a nontechnical primer for a broader audience, in which I paint a broad-brush picture of modern cosmology. I begin by reviewing the evidence for the big bang, including the expansion of our Universe, the cosmic microwave background, and the primordial abundances of the light elements. Next, I discuss how these and other cosmological observations can be well explained by means of the concordance model of cosmology, putting a particular emphasis on the composition of the cosmic energy budget in terms of visible matter, dark matter, and dark energy. This sets the stage for a short overview of the history of the Universe from the earliest moments of its existence all the way to the accelerated expansion at late times and beyond. Finally, I summarize the current status of the field, including the challenges it is currently facing such as the Hubble tension, and conclude with an outlook onto the bright future that awaits us in the coming years and decades. The text is complemented by an extensive bibliography serving as a guide for readers who wish to delve deeper. ","Modern Cosmology, an Amuse-Gueule"
126,1501751386542952452,549460404,吉田 紅 (Beni Yoshida),"['A new article (short review). \n\nSnowmass White Paper: New ideas for many-body quantum systems from string theory and black holes\n<LINK>', '素粒子物理では、こういうレビュー論文みたいなのを定期的に書くのが習慣らしいです。僕は、弦理論の発展から刺激されて生まれた物性理論の発展を、量子情報的な視点から解説しました。他の方の箇所も面白いので、是非。']",https://arxiv.org/abs/2203.04718,"During the last two decades many new insights into the dynamics of strongly coupled quantum many-body systems have been obtained using gauge/gravity duality, with black holes often playing a universal role. In this white paper we summarize the results obtained and offer some outlook for future developments, including the ongoing mutually beneficial feedback loop with the study of more general, not necessarily holographic, quantum many-body systems. ","Snowmass White Paper: New ideas for many-body quantum systems from
  string theory and black holes"
127,1501673107756568579,69202541,Jonathan Le Roux,"['New paper out w/ O. Slizovskaia @veleslavia, G. Wichern, @ZhongqiuWang, ""Locate This, Not That: Class-Conditioned Sound Event DOA Estimation,"" to be presented at #ICASSP2022.\n<LINK>', 'We propose a class-conditioned sound event localization &amp; detection (SELD) model, which alternately focuses on each target class specified as input. The model thus learns to be more robust to directional interference, while leveraging data from all classes. https://t.co/5QtClo0Za0']",https://arxiv.org/abs/2203.04197,"Existing systems for sound event localization and detection (SELD) typically operate by estimating a source location for all classes at every time instant. In this paper, we propose an alternative class-conditioned SELD model for situations where we may not be interested in localizing all classes all of the time. This class-conditioned SELD model takes as input the spatial and spectral features from the sound file, and also a one-hot vector indicating the class we are currently interested in localizing. We inject the conditioning information at several points in our model using feature-wise linear modulation (FiLM) layers. Through experiments on the DCASE 2020 Task 3 dataset, we show that the proposed class-conditioned SELD model performs better in terms of common SELD metrics than the baseline model that locates all classes simultaneously, and also outperforms specialist models that are trained to locate only a single class of interest. We also evaluate performance on the DCASE 2021 Task 3 dataset, which includes directional interference (sound events from classes we are not interested in localizing) and notice especially strong improvement from the class-conditioned model. ","Locate This, Not That: Class-Conditioned Sound Event DOA Estimation"
128,1501623912920199173,3209362451,Burton Lab,"['New paper from our group that uses supervised machine learning to extract forces from dynamics. We use real, noisy experimental data: the 3D motion of micron-sized particles in a dusty plasma. The effort was led by graduate student Wentao Yu!\n<LINK> <LINK>']",https://arxiv.org/abs/2203.03740,"Extracting environmental forces from noisy data is a common yet challenging task in complex physical systems. Machine learning represents a robust approach to this problem, yet is mostly tested on simulated data with known parameters. Here we use supervised machine learning to extract the electrostatic, hydrodynamic, and stochastic forces acting on micron-sized charged particles levitated in an argon plasma. Trained on simulated particle trajectories using more than 100 dynamical and statistical features, the model predicts system parameters with 50\% better accuracy than conventional methods, and provides non-contact measurements of the particle charge and Debye length. ",Extracting Forces from Noisy Dynamics in Dusty Plasmas
129,1501614028380119046,573729628,"Steve Taylor, PhD","['New paper today with Matthew Mould and Davide Gerosa on using Deep Neural Networks to measure the population demographics of hierarchical Black Hole Mergers! An amazing piece of work led by Matthew (1/2). <LINK>', 'We found that in the current LIGO-Virgo catalog, the distribution of cluster escape speeds favors &lt;100 km/s, but is relatively flat. Also there is evidence of multimodal structure in the mass and spin distributions from repeated black-hole mergers. @UoBIGWaves @VanderbiltU']",https://arxiv.org/abs/2203.03651,"The catalog of gravitational-wave events is growing, and so are our hopes of constraining the underlying astrophysics of stellar-mass black-hole mergers by inferring the distributions of, e.g., masses and spins. While conventional analyses parametrize this population with simple phenomenological models, we propose an innovative physics-first approach that compares gravitational-wave data against astrophysical simulations. We combine state-of-the-art deep-learning techniques with hierarchical Bayesian inference and exploit our approach to constrain the properties of repeated black-hole mergers from the gravitational-wave events in the most recent LIGO/Virgo catalog. Deep neural networks allow us to (i) construct a flexible population model that accurately emulates simulations of hierarchical mergers, (ii) estimate selection effects, and (iii) recover the branching ratios of repeated-merger generations. Among our results we find that: the distribution of host-environment escape speeds favors values <100 km s$^{-1}$ but is relatively flat; first-generation black holes are born with a maximum mass that is compatible with current estimates from pair-instability supernovae; there is multimodal substructure in both the mass and spin distributions due to repeated mergers; and binaries with a higher-generation component make up at least 15% of the underlying population. The deep-learning pipeline we present is ready to be used in conjunction with realistic astrophysical population-synthesis predictions. ","Deep learning and Bayesian inference of gravitational-wave populations:
  hierarchical black-hole mergers"
130,1501482717761916929,521154902,Massimiliano Luca,['New preprint out🎉 \n\nCan next-location predictors generalize? Not really\n\n👉Many test trajectories are  seen during training\n\n👉Mobility laws can be used to support predictors and improve generalization \n\npaper: <LINK>\nwt @brulepri @GianniBarlacchi @lucpappalard <LINK>'],https://arxiv.org/abs/2203.03208,"Next-location prediction, consisting of forecasting a user's location given their historical trajectories, has important implications in several fields, such as urban planning, geo-marketing, and disease spreading. Several predictors have been proposed in the last few years to address it, including last-generation ones based on deep learning. This paper tests the generalization capability of these predictors on public mobility datasets, stratifying the datasets by whether the trajectories in the test set also appear fully or partially in the training set. We consistently discover a severe problem of trajectory overlapping in all analyzed datasets, highlighting that predictors memorize trajectories while having limited generalization capacities. We thus propose a methodology to rerank the outputs of the next-location predictors based on spatial mobility patterns. With these techniques, we significantly improve the predictors' generalization capability, with a relative improvement on the accuracy up to 96.15% on the trajectories that cannot be memorized (i.e., low overlap with the training set). ",Trajectory Test-Train Overlap in Next-Location Prediction Datasets
131,1501294412126560257,1092693586263457792,Greg Yang,"[""1/ You can't train GPT-3 on a single GPU, much less tune its hyperparameters (HPs).\n\nBut what if I tell you…\n\n…you *can* tune its HPs on a single GPU thanks to new theoretical advances?\n\npaper <LINK>\ncode <LINK>\nblog <LINK> <LINK>"", '2/ The idea is actually really simple: in a special parametrization introduced in https://t.co/vhvvXylq58 called µP, narrow and wide neural networks share the same set of optimal hyperparameters. This works even as width -&gt; ∞. https://t.co/lFiPMyIs1t', '3/ The hyperparameters can include learning rate, learning rate schedule, initialization, parameter multipliers, and more, even individually for each parameter tensor. We empirically verified this on Transformers up to width 4096. https://t.co/O2CbmjMgde', '4/ Using this insight, we can just tune a tiny version of GPT-3 on a single GPU --- if the hyperparameters we get on the small model is near optimal, then they should also be near optimal on the large model! We call this way of tuning *µTransfer*. https://t.co/qbUQmjJZZW', '5/ We µTransferred hyperparameters from a small 40 million parameter version of GPT-3 — small enough to fit on a single GPU — to the 6.7 billion version. \nWith some asterisks, we get a performance comparable to the original GPT-3 model with twice the parameter count! https://t.co/g8lQ2ZgffX', '6/ The total tuning cost is only 7% of the whole pretrain compute cost! Since the direct tuning of the small model costs roughly the same even as the large model increases in size, tuning the 175B GPT-3 this way would prolly cost at most 0.3% of the total pretrain compute.', '7/ You: ""wait can I shrink the model only in width?""\n\nBad news: there\'s not much theoretical guarantee for non-width stuff\n\ngood news: we empirically tested transfer across depth, batch size, sequence length, &amp; timestep work within reasonable ranges on preLN transformers. https://t.co/xP95DryEyP', '8/ We applied this to tune BERT-base and BERT-large simultaneously by shrinking them to the same small model in both width and depth, where we did the direct tuning. We got a really nice improvement over the already well-tuned megatron BERT baseline, especially for BERT-large! https://t.co/qne6thlU9Q', ""9/ In general, it seems that the larger a model is, the less well tuned it is --- which totally makes sense --- and thus the more to gain from µTransfer. We didn't have compute to retrain the GPT-3 175B model, but I'll leave your mouth watering with that thought."", '10/ OK, so what actually is µP and how do you implement it?', ""11/ It's encapsulated by the following table for how to scale your initialization and learning rate with fanin or fanout. The purple text is µP and the gray text in parenthesis is pytorch default, for reference, and the black text is shared by both. https://t.co/uyq6s9gjYn"", ""12/ But just like you don't typically want to implement autograd by hand even though autograd is just chain rule, we recommend using our package https://t.co/5S0YAg026Z to implement µP in your models."", '13/ The really curious ones of you: ""OK what is the theoretical motivation behind all this?""\n\nUnfortunately, this is already getting long, so people let me know if this is something you want to hear for another time!', ""14/ It's been an amazing collaboration with @edwardjhu @ibab_ml @sidorszymon David Farhi, Nick Ryder, @merettm @AllenLao @WeizhuChen @JianfengGao0217!"", '15/ Also thanks to my wonderful friends and colleagues who gave feedback - pinging those on twitter @ArthurJacot3 @colinraffel @ilyasut @jaschasd @jxbz @LenaicChizat @Luke_Metz @markchen90 @sschoenholz @prfsanjeevarora @TacoCohen @2prime_PKU @yisongyue', '@jacobmbuckman Thanks Jacob! μP is architecturally universal (due to Tensor Programs applicable essentially to any computation graph), so if you just follow the paper/our repo https://t.co/5S0YAghCYx it should work automatically.', '@jacobmbuckman In particular, if you just following the table and scale the ""attention logit""-like calculations, where you are summing a width-dimensional vector (here, the vector is the pointwise product btw key and query), like 1/d, then you are good to go. https://t.co/x9jGkxGaSI', '@jacobmbuckman for conv layer, fan-in/fan-out are the number of input/output channels. We assume the input to the conv layer is either data or some hidden activation from previous layers, trained from random initialization. Layernorm/batchnorm are compatible with this.']",https://arxiv.org/abs/2203.03466,"Hyperparameter (HP) tuning in deep learning is an expensive process, prohibitively so for neural networks (NNs) with billions of parameters. We show that, in the recently discovered Maximal Update Parametrization (muP), many optimal HPs remain stable even as model size changes. This leads to a new HP tuning paradigm we call muTransfer: parametrize the target model in muP, tune the HP indirectly on a smaller model, and zero-shot transfer them to the full-sized model, i.e., without directly tuning the latter at all. We verify muTransfer on Transformer and ResNet. For example, 1) by transferring pretraining HPs from a model of 13M parameters, we outperform published numbers of BERT-large (350M parameters), with a total tuning cost equivalent to pretraining BERT-large once; 2) by transferring from 40M parameters, we outperform published numbers of the 6.7B GPT-3 model, with tuning cost only 7% of total pretraining cost. A Pytorch implementation of our technique can be found at github.com/microsoft/mup and installable via `pip install mup`. ","Tensor Programs V: Tuning Large Neural Networks via Zero-Shot
  Hyperparameter Transfer"
132,1501214185555959816,959316810448318464,Theo O'Neill,"['New paper out today! 🎉 Led by Jon Swift, we detail first results from the recently renovated Thacher Observatory in Ojai, CA.  \n\nTake a look if you’re interested in observatory management, astronomy education, or want to see some pretty light curves!\n\n<LINK>']",https://arxiv.org/abs/2203.02529,"Located on the campus of the Thacher School in Southern California, the Thacher Observatory has a legacy of astronomy research and education that dates back to the late 1950's. In 2016, the observatory was fully renovated with upgrades including a new 0.7-m telescope, a research grade camera, and a slit dome with full automation capabilities. The low-elevation site is bordered by the Los Padres National Forest and therefore affords dark to very dark skies allowing for accurate and precise photometric observations. We present a characterization of the site including sky brightness, weather, and seeing, and we demonstrate the on-sky performance of the facility. Our primary research programs are based around our multi-band photometric capabilities and include photometric monitoring of variable sources, a nearby supernova search and followup program, a quick response transient followup effort, and exoplanet and eclipsing binary light curves. Select results from these programs are included in this work which highlight the broad range of science available to an automated observatory with a moderately sized telescope. ",The Renovated Thacher Observatory and First Science Results
133,1501135939724263426,1411414442974355464,Sokratis Trifinopoulos,['A pure #pheno paper today constraining light new physics in anticipation of the @belle2collab results!\n<LINK>'],https://arxiv.org/abs/2203.03280,"With a design luminosity of 50 ab$^{-1}$ and detectors with tracking capabilities extending beyond 1 m, the Belle II experiment is the perfect laboratory for the search of particles that couple weakly to the Standard Model and have a characteristic decay length of a few centimetres and more. We show that for models of dark photons and other light vector bosons, Belle II will be successful in probing regions of parameter space which are as of now unexplored by any experiment. In addition, for models where the vector boson couples sub-dominantly to the electron and quarks as compared to muons, e.g. in the $L_\mu-L_\tau$ model, Belle II will probe regions of mass and couplings compatible with the anomalous magnetic moment of muon. We discuss these results and derive the projected sensitivity of Belle II for a handful of other models. Finally, even with the currently accumulated data, $\sim 200$ fb$^{-1}$, Belle II should be able to cover regions of parameter space pertaining to the X(17) boson postulated to solve the ATOMKI anomaly. ",Displaced Searches for Vector Bosons at Belle II
134,1501014250256576518,175590531,Alejandro Flores V.,"[""The preprint is out! <LINK> 📰\nThe problem of reducing training sets while maintaining the exact class boundaries of the nearest-neighbor classifier, has been a long-standing one. I'm proposing a new algorithm for this problem, improving a fairly recent paper! 🧵"", ""For almost three decades, the best know result was Clarkson's [1], but just a few months ago Prof. David Eppstein [2] proposed a new, much improved, algorithm for this problem...\n[1] https://t.co/gbuHR43uXt\n[2] https://t.co/SQuRWKaOyN"", ""My take on this is to improve Eppstein's algorithm by simplifying it... Basically, chopping half of the algorithm while proving it is still correct. And reducing it's time complexity along the way...""]",https://arxiv.org/abs/2203.03567,"Given a training set $P \subset \mathbb{R}^d$, the nearest-neighbor classifier assigns any query point $q \in \mathbb{R}^d$ to the class of its closest point in $P$. To answer these classification queries, some training points are more relevant than others. We say a training point is relevant if its omission from the training set could induce the misclassification of some query point in $\mathbb{R}^d$. These relevant points are commonly known as border points, as they define the boundaries of the Voronoi diagram of $P$ that separate points of different classes. Being able to compute this set of points efficiently is crucial to reduce the size of the training set without affecting the accuracy of the nearest-neighbor classifier. Improving over a decades-long result by Clarkson, in a recent paper by Eppstein an output-sensitive algorithm was proposed to find the set of border points of $P$ in $O( n^2 + nk^2 )$ time, where $k$ is the size of such set. In this paper, we improve this algorithm to have time complexity equal to $O( nk^2 )$ by proving that the first steps of their algorithm, which require $O( n^2 )$ time, are unnecessary. ",Improved Search of Relevant Points for Nearest-Neighbor Classification
135,1501010017939427328,769369833259479040,Yuto Minami,['Our new paper is available.\n<LINK>'],https://arxiv.org/abs/2203.02495,"We report an improved measurement of the degree-scale CMB $B$-mode angular power spectrum over 670 square-degree sky area with POLARBEAR. In the original analysis of the data, errors in the angle measurement of the continuously rotating half-wave plate, a polarization modulator, caused significant data loss. By introducing an angle-correction algorithm, the data volume is increased by a factor of 1.8. We report a new analysis using the larger data set. We find the measured $B$-mode spectrum is consistent with the $\Lambda$CDM model with Galactic foregrounds. We place an upper limit on the tensor-to-scalar ratio $r$ < 0.33 at 95% confidence level. ","Improved upper limit on degree-scale CMB B-mode polarization power from
  the 670 square-degree POLARBEAR survey"
