,TweetID,AuthorID,AuthorName,Tweets,arxiv_link,Abstract,Title
213,1409758535857082369,869647136480219136,Turlier lab,"['What are the physical principles underlying the formation of a blastocoel, the first biological cavity in animal development? We wrote a small review to draw new perspectives on this surprisingly little studied question.\n<LINK>', 'Some teaser: &lt;Blastulation might not be “the most important time in our life”, to refer to the famous quote of Lewis Wolpert on gastrulation, but it remains the very first morphogenetic event common to most animals.&gt;', '@WalentekLab Well, actually not in all species, which may raise the question of its function(s) we believe.', '@WalentekLab Happy to get any feedbacks !']",https://arxiv.org/abs/2106.14509,"The blastocoel is a fluid-filled cavity characteristic of animal embryos at the blastula stage. Its emergence is commonly described as the result of cleavage patterning, but this historical view conceals a large diversity of mechanisms and overlooks many unsolved questions from a biophysics perspective. In this review, we describe generic mechanisms for blastocoel morphogenesis, rooted in biological literature and simple physical principles. We propose novel directions of study and emphasize the importance to study blastocoel morphogenesis as an evolutionary and physical continuum. ",Blastocoel morphogenesis: a biophysics perspective
214,1409748895966584837,23237589,Tanya Urrutia,"['With the slew of eROSITA papers coming out, let me highlight the ones I was most involved with. The first is by @MarcellaBrusa (<LINK>) and highlights how we can find red quasars (feedbacking) with eROSITA. 1/n', 'Incidentally, the red quasar we found with X-ray techniques had already been found by me in 2009, this time using radio techniques (https://t.co/EP3UEnbWFq). The paper previews how with the all sky survey, we expect to find about 700 red quasars this way. 2/n', 'The next paper is by Yoshiki Toba (https://t.co/afD6aiQLZs) and compared the WISE W4 selected point sources with the X-ray catalog. The bright W4 population is expected to be AGN dominated as was proven by Spitzer a decade ago. 3/n', 'The W4 sources that have X-ray counterparts (~700) are mostly unobscured. But when we stack the undetected sources (~7500), we find that they show X-ray SEDs showing some obscuration. This effect is highlighted when we divide the sample in photo-z bins. 4/n', ""There's a big science potential with such huge X-ray areas now being covered with eROSITA also in stacking, which was my main contribution to the paper (and others in the works). 5/n"", ""Lastly, let me highlight that this work wouldn't have been possible without the X-ray catalog in the eFEDS region (https://t.co/hBXUpQjUg9) and *especially* without the counterpart assignment and identification in a mammoth paper lead by Mara Salvato (https://t.co/bEYcgoGKxT) 6/6""]",https://arxiv.org/abs/2106.14525,"Theoretical models of galaxy-AGN co-evolution ascribe an important role for the feedback process to a short, luminous, obscured, and dust-enshrouded phase during which the accretion rate of the SMBH is expected to be at its maximum and the associated AGN-driven winds are also predicted to be maximally developed. To test this scenario, we have isolated a text-book candidate from the eROSITA Final Equatorial-Depth Survey (eFEDS) obtained within the Performance and Verification program of the eROSITA telescope on board Spectrum Roentgen Gamma. From an initial catalog of 246 hard X-ray selected sources matched with the photometric and spectroscopic information available within the eROSITA and Hyper Suprime-Cam consortia, three candidates Quasars in the feedback phase have been isolated applying the diagnostic proposed in Brusa et al. (2015). Only one source (eFEDSU J091157.5+014327) has a spectrum already available (from SDSS-DR16, z=0.603) and it unambiguously shows the presence of a broad component (FWHM~1650 km/s) in the [OIII]5007 line. The associated observed L_[OIII] is ~2.6x10^{42} erg/s, one to two orders of magnitude larger than that observed in local Seyferts and comparable to those observed in a sample of z~0.5 Type 1 Quasars. From the multiwavelength data available we derive an Eddington Ratio (L_bol/L_Edd) of ~0.25, and a bolometric correction in the hard X-ray of k_bol~10, lower than those observed for objects at similar bolometric luminosity. The presence of an outflow, the high X-ray luminosity and moderate X-ray obscuration (L_X~10^44.8 erg/s, N_H~2.7x10^22 cm^-2) and the red optical color, all match the prediction of quasars in the feedback phase from merger driven models. Forecasting to the full eROSITA all-sky survey with its spectroscopic follow-up, we predict that by the end of 2024 we will have a sample of few hundreds such objects at z=0.5-2. ","The eROSITA Final Equatorial-Depth Survey (eFEDS): The first archetypal
  Quasar in the feedback phase discovered by eROSITA"
215,1409699591147032576,905159827936075776,Sam Greydanus,"['“Piecewise-constant Neural ODEs” ⏱️\n\nPaper: <LINK>\nBlog: <LINK>\n\nWe propose a neural network which jumps through time adaptively. When used as a planner for billiards, it can focus compute around collisions and skip over boring, linear motion: <LINK>', '2\nLike an RNN, our model predicts a hidden state. Like a Neural ODE, it predicts a derivative of a hidden state (“state velocity”).\n\nWe assume that this hidden state velocity is piecewise-constant over variable durations of time (also predicted by the model). https://t.co/1MLzRHcSNo', '3\nIt makes sense to plan with variable durations rather than uniform RNN ticks.\n\nConsider billiards: to make a shot, humans think about ball collisions but rarely about the motion in between. https://t.co/xtkUATwbpv', '4\nWe tested our model in a billiards planning environment. It showed modest improvements over baselines in terms of planning speed and accuracy. https://t.co/8AIYBdqLn0', '5\nCool obs: our model learns a coordinate transformation (encoder/decoder) and a latent dynamics model (hidden state dynamics). Training encourages large steps through time.\n\nSo it learns coordinate transformations (observation &lt;-&gt; latent space) s.t. dynamics are maximally linear', '6\nSo, if we train on Cartesian coordinates of an object undergoing circular motion, it will approximately recover a Cartesian-to-Polar change of basis!! https://t.co/VsKbtz09Eh', '7\nIt also sort of learned a change of basis from pixels to Cartesian-like coordinates, but this got messy :(', '8\nThe topic of “temporal abstract planning with RNNs/NODEs” has a lot of papers/previous work (we cite as many as possible).\n\nAnd yet, no previous results (or this work, for that matter) seem to work super well. I think this is one area where more great papers &amp; work are needed.', '9\nWe make our code available, etc. My coauthors were Alan Fern and Stefan Lee (thanks for the great collab). A number of others (including those @mlcollective) gave good advice and feedback 🙏']",https://arxiv.org/abs/2106.06621,"Neural networks are a popular tool for modeling sequential data but they generally do not treat time as a continuous variable. Neural ODEs represent an important exception: they parameterize the time derivative of a hidden state with a neural network and then integrate over arbitrary amounts of time. But these parameterizations, which have arbitrary curvature, can be hard to integrate and thus train and evaluate. In this paper, we propose making a piecewise-constant approximation to Neural ODEs to mitigate these issues. Our model can be integrated exactly via Euler integration and can generate autoregressive samples in 3-20 times fewer steps than comparable RNN and ODE-RNN models. We evaluate our model on several synthetic physics tasks and a planning task inspired by the game of billiards. We find that it matches the performance of baseline approaches while requiring less time to train and evaluate. ",Piecewise-constant Neural ODEs
216,1409698766966333445,702236063431942144,"Mercedes Gimeno-Segovia, PhD",['New paper on arXiv!📝 Long time in the making 😅 so very happy to finally share some newly minted schemes on entanglement generation for linear optical quantum computing. Hope you find the results as interesting and shocking as we did 🤓<LINK>'],https://arxiv.org/abs/2106.13825,"Using only linear optical elements, the creation of dual-rail photonic entangled states is inherently probabilistic. Known entanglement generation schemes have low success probabilities, requiring large-scale multiplexing to achieve near-deterministic operation of quantum information processing protocols. In this paper, we introduce multiple techniques and methods to generate photonic entangled states with high probability, which have the potential to reduce the footprint of Linear Optical Quantum Computing (LOQC) architectures drastically. Most notably, we are showing how to improve Bell state preparation from four single photons to up to p=2/3, boost Type-I fusion to 75% with a dual-rail Bell state ancilla and improve Type-II fusion beyond the limits of Bell state discrimination. ",Creation of Entangled Photonic States Using Linear Optics
217,1409497657052209161,1310552063999438849,Hauke Group,"['🎉Congrats to Kevin, Janika &amp; @PhilippHauke for the work on measuring currents in quantum simulators, which is published on @_arXiv_quant_ph\n📖Full article👉🏼<LINK>\n\n🗣""We propose a flexible non-invasive technique to measure currents in analog quantum simulators."" <LINK>']",https://arxiv.org/abs/2106.12599,"Despite the pristine abilities of analog quantum simulators to study quantum dynamics, possibilities to detect currents are sparse. Here, we propose a flexible non-invasive technique to measure currents in quantum many-body systems by weakly coupling the system to an ancilla, followed by a measurement of the ancilla population. We numerically benchmark the scheme at the example of interacting bosons in a Harper-Hofstadter optical-lattice ladder, and discuss potential experimental error sources. The highly flexible protocol can be used with both hard-core and soft-core bosons as well as fermions, is easily extendable to more general observables like current-current correlations, and applies to other setups beyond cold atoms as we exemplify for the trapped-ion platform. ",Non-invasive measurement of currents in analog quantum simulators
218,1409471296480722946,735281203008376832,Felipe Martins,"['Our work (me, @MateusGM, @HansBassani, @pedro_mbraga and Edna S. Barros) is now available on arXiv!\n\n<LINK>\n\nWe propose a framework for creating reinforcement learning environments for IEEE VSSS and RoboCup Small Size League robot soccer competitions.', 'Very proud of this contribution, which is part of my masters research, we will use this framework as a base for further research on reinforcement learning for robot soccer. Feel free to reach me on here if there is any questions about the work!']",https://arxiv.org/abs/2106.12895,"Reinforcement learning is an active research area with a vast number of applications in robotics, and the RoboCup competition is an interesting environment for studying and evaluating reinforcement learning methods. A known difficulty in applying reinforcement learning to robotics is the high number of experience samples required, being the use of simulated environments for training the agents followed by transfer learning to real-world (sim-to-real) a viable path. This article introduces an open-source simulator for the IEEE Very Small Size Soccer and the Small Size League optimized for reinforcement learning experiments. We also propose a framework for creating OpenAI Gym environments with a set of benchmarks tasks for evaluating single-agent and multi-agent robot soccer skills. We then demonstrate the learning capabilities of two state-of-the-art reinforcement learning methods as well as their limitations in certain scenarios introduced in this framework. We believe this will make it easier for more teams to compete in these categories using end-to-end reinforcement learning approaches and further develop this research area. ","rSoccer: A Framework for Studying Reinforcement Learning in Small and
  Very Small Size Robot Soccer"
219,1408357448835112967,434250693,Peter Karpov,"['Our preprint with Francesco Piazza on quantum droplets in extended Bose-Hubbard models is out! Interestingly, different BH models have been studied for ages, but there is still room for new phases we find: superfluid/Mott/supersolid/density-wave droplets <LINK>']",https://arxiv.org/abs/2106.13226,"Multimode optical cavities can be used to implement interatomic interactions which are highly tunable in strength and range. For bosonic atoms trapped in an optical lattice, cavity-mediated interactions compete with the short-range interatomic repulsion, which we study using an extended Bose-Hubbard model. Already in a single-mode cavity, where the corresponding interaction has an infinite range, a rich phase diagram has been experimentally observed, featuring density-wave and supersolid self-organized phases in addition to the usual superfluid and Mott insulator. Here we show that, for any finite range of the cavity-mediated interaction, quantum self-bound droplets dominate the ground state phase diagram. Their size and in turn density is not externally fixed but rather emerges from the competition between local repulsion and finite-range attraction. Therefore, the phase diagram becomes very rich, featuring both compressible superfluid/supersolid as well as incompressible Mott and density-wave droplets. Additionally, we observe droplets with a compressible core and incompressible outer shells. ","Light-induced quantum droplet phases of lattice bosons in multimode
  cavities"
220,1408351220557881350,21599898,Jake Lishman,"['A quantum advantage requires creating large coherent superpositions, but multilevel coherence is less studied than multipartite entanglement.  We demonstrate a practical measurement to quantify the number of superposed classical states.\n\n👇 New preprint! <LINK>', ""It can't produce false positives, even if you don't have direct measurement access to the classical-state basis you care about.  All you need is to take a one-dimensional interference pattern by letting the system evolve through time."", ""We did it with the motional state of a single trapped ion, but the same method is applicable to pretty much any system - there's nothing specific to trapped ions in the theory."", 'We built on a previous theory result out of Imperial about using these interference patterns with rank-1 projective measurements (👇), and we extended it so it works for any type of measurement.\n\nhttps://t.co/4cET5Qn1sh', ""Since the method is provably safe against false positives, even if your coherent manipulations can't be trusted, it's useful for characterisation and verification of properties of NISQ devices."", 'Experimental work done by the ion trappers at Imperial College London (@iontrapimperial), with the theory side handled by me and Florian Mintert.\n\nhttps://t.co/wSdddPW1D6']",https://arxiv.org/abs/2106.12939,"Quantum coherence is one of the clearest departures from classical physics, exhibited when a system is in a superposition of different basis states. Here the coherent superposition of three motional Fock states of a single trapped ion is experimentally certified, with a procedure provably robust against imperfect operation. As the motional state cannot be directly interrogated, our scheme uses an interference pattern generated by projective measurement of the coupled qubit state. The minimum number of coherently superposed states is inferred from a series of threshold values based on analysis of the interference pattern. This demonstrates that high-level coherence can be verified and investigated with simple, nonideal control methods well-suited to noisy intermediate-scale quantum devices. ",Certifying Multilevel Coherence in the Motional State of a Trapped Ion
221,1408342557663318020,1061375141274439685,Xabier Cid Vidal 🛰️,"['New paper! On <LINK> with @CharlesTheVS and many others we study the LHCb sensitivity to the wonderful baryogenesis model proposed in <LINK>. Spoiler alert: we CAN discover DM at LHCb! The mechanism involves b-hadron decays to a dark sector 👇👇', 'particle which we can\'t detect but can look for as ""missing-pT"" in the direction of flight of the hadron. This type of signatures appear in other LHCb analyses and we know we can do them pretty well. I\'m specially happy for Saul Lopez,', 'to which I propose doing his Master thesis working on this and who will now get his work (hopefully) published. If you want to know more, I recommend you attend the #offshell2021 conference, where we will present our work.']",https://arxiv.org/abs/2106.12870,"A model that can simultaneously explain Dark Matter relic density and the apparent matter anti-matter imbalance of the universe has been recently proposed. The model requires $b$-hadron branching fractions to Dark Matter at the per mille level. The $b$-hadrons decay to a dark sector baryon, $\psi_{\rm{DS}}$, which has a mass in the region $940$ MeV/c$^{2} \leq m(\psi_{\rm{DS}}) \leq 4430$ MeV/c$^{2}$. In this paper, we discuss the sensitivity of the LHCb experiment to search for this dark baryon, covering different types of topology and giving prospects for Runs 3 and 4 of the LHC, as well as for the proposed Phase-II Upgrade. We show that the LHCb experiment can cover the entire mass range of the hypothetical dark baryon. ","Prospects on searches for baryonic Dark Matter produced in $b$-hadron
  decays at LHCb"
222,1408331159633866752,786855300322172928,Alkistis Pourtsidou,"['A new paper led by @PedroCarrilho11 and Chiara Moretti performs a validation and mcmc forecast study for a non-standard (interacting) DE model <LINK>, focusing on the theoretical systematic of non-linearities when we interpret galaxy clustering measurements.', 'Pedro and Chiara (+ Ben Bose and @DidaMarkovic) carefully compared the performance of the most popular perturbation theory approaches,  that have been used for the analysis of e.g. BOSS data. https://t.co/OND8fo6bYD', 'They finally forecast unbiased constraints on the coupling parameter of the interacting dark energy model for surveys similar to @EC_Euclid and @desisurvey https://t.co/8z7TBDzNt2']",https://arxiv.org/abs/2106.13163,"Interacting dark energy models have been proposed as attractive alternatives to $\Lambda$CDM. Forthcoming Stage-IV galaxy clustering surveys will constrain these models, but they require accurate modelling of the galaxy power spectrum multipoles on mildly non-linear scales. In this work we consider a dark scattering model with a simple 1-parameter extension to $w$CDM - adding only $A$, which describes a pure momentum exchange between dark energy and dark matter. We then provide a comprehensive comparison of three approaches of modeling non-linearities, while including the effects of this dark sector coupling. We base our modeling of non-linearities on the two most popular perturbation theory approaches: TNS and EFTofLSS. To test the validity and precision of the modelling, we perform an MCMC analysis using simulated data corresponding to a $\Lambda$CDM fiducial cosmology and Stage-IV surveys specifications in two redshift bins, $z=0.5$ and $z=1$. We find the most complex EFTofLSS-based model studied to be better suited at both, describing the mock data up to smaller scales, and extracting the most information. Using this model, we forecast uncertainties on the dark energy equation of state, $w$, and on the interaction parameter, $A$, finding $\sigma_w=0.06$ and $\sigma_A=1.1$ b/GeV for the analysis at $z=0.5$ and $\sigma_w=0.06$ and $\sigma_A=2.0$ b/GeV for the analysis at $z=1$. In addition, we show that a false detection of exotic dark energy up to 3$\sigma$ would occur should the non-linear modelling be incorrect, demonstrating the importance of the validation stage for accurate interpretation of measurements. ",Interacting dark energy from redshift-space galaxy clustering
223,1408224623725064195,110103071,Andrej Risteski,"['In the invariant feature approach to domain generalization, the goal is to identify invariant features after seeing a small # of environments. How many envs are needed? We study this q in a variant of a toy data model we introduced w @ElanRosenfeld in <LINK>. <LINK>', ""For this variant, we show that while ERM and IRM both can fail with sublinear number of environments, an *iterative* feature matching approach we introduce in the paper succeeds using only logarithmic # of domains. (For more details see Tengyu's tweet and paper)"", 'Joint work with @cynnjjs, @elanrosenfeld, Mark Sellke, and @tengyuma .']",https://arxiv.org/abs/2106.09913,"Domain generalization aims at performing well on unseen test environments with data from a limited number of training environments. Despite a proliferation of proposal algorithms for this task, assessing their performance both theoretically and empirically is still very challenging. Distributional matching algorithms such as (Conditional) Domain Adversarial Networks [Ganin et al., 2016, Long et al., 2018] are popular and enjoy empirical success, but they lack formal guarantees. Other approaches such as Invariant Risk Minimization (IRM) require a prohibitively large number of training environments -- linear in the dimension of the spurious feature space $d_s$ -- even on simple data models like the one proposed by [Rosenfeld et al., 2021]. Under a variant of this model, we show that both ERM and IRM cannot generalize with $o(d_s)$ environments. We then present an iterative feature matching algorithm that is guaranteed with high probability to yield a predictor that generalizes after seeing only $O(\log d_s)$ environments. Our results provide the first theoretical justification for a family of distribution-matching algorithms widely used in practice under a concrete nontrivial data model. ","Iterative Feature Matching: Toward Provable Domain Generalization with
  Logarithmic Environments"
224,1408158879775485953,1124967058414825472,Sindhana Pannir-Sivajothi,"['My first paper in grad school 🤩 Thanks for being a wonderful advisor @ucsd_yuen! I learned a lot from you @JorgeACamGA and @LamQ310.\n\nOur first paper together @ShubhamSinha029 ❤️\n\nWe find that polariton condensation can change reaction yields and rates.\n<LINK> <LINK>', '@pleplostelous @ucsd_yuen @JorgeACamGA @LamQ310 @ShubhamSinha029 Thanks Avishek! :)', '@Sridevi292 @ucsd_yuen @JorgeACamGA @LamQ310 @ShubhamSinha029 Thanks Sridevi! :)', '@maity_indra_ @ucsd_yuen @JorgeACamGA @LamQ310 @ShubhamSinha029 Thanks Indrajit :D']",https://arxiv.org/abs/2106.12156,"When molecular transitions strongly couple to photon modes, they form hybrid light-matter modes called polaritons. Collective vibrational strong coupling is a promising avenue for control of chemistry, but this can be deterred by the large number of quasi-degenerate dark modes. The macroscopic occupation of a single polariton mode by excitations, as observed in Bose-Einstein condensation, offers promise for overcoming this issue. Here we theoretically investigate the effect of vibrational polariton condensation on the kinetics of electron transfer processes. Compared with excitation with infrared laser sources, the condensate changes the reaction yield significantly due to additional channels with reduced activation barriers resulting from the large accumulation of energy in the lower polariton, and the many modes available for energy redistribution during the reaction. Our results offer tantalizing opportunities to use condensates for driving chemical reactions, kinetically bypassing usual constraints of fast intramolecular vibrational redistribution in condensed phase. ",Driving chemical reactions with polariton condensates
