,TweetID,AuthorID,AuthorName,Tweets,arxiv_link,Abstract,Title
177,1509084870999486464,3236251346,Mikel Sanz,"['New paper “Quantum Genetic Algorithm with Individuals in Multiple Registers” <LINK> with @raist272 and @Gatgian we propose a subroutine-based fully quantum genetic algorithm distributable among quantum processors @OpenSuperQ @QUANTEK2122 @Ikerbasque @BCAMBilbao <LINK>', 'The use multiple registers allows us to introduce all the natural elements characterizing genetic algorithms: population-based search with selection of many individuals, crossover and mutation. Surprisingly, the mutation subroutine, has small impact on the average performance 2/3 https://t.co/l02rWINXWi', 'Finally, and I like this a lot 🙃, we introduce a quantum channel analysis to prove the exponential convergence of our algorithm and even predict its convergence-ratio. @NquireC @ryc_upvehu @upvehu https://t.co/11SXwuDgIt']",http://arxiv.org/abs/2203.15039,"Genetic algorithms are heuristic optimization techniques inspired by Darwinian evolution, which are characterized by successfully finding robust solutions for optimization problems. Here, we propose a subroutine-based quantum genetic algorithm with individuals codified in independent registers. This distinctive codification allows our proposal to depict all the fundamental elements characterizing genetic algorithms, i.e. population-based search with selection of many individuals, crossover, and mutation. Our subroutine-based construction permits us to consider several variants of the algorithm. For instance, we firstly analyze the performance of two different quantum cloning machines, a key component of the crossover subroutine. Indeed, we study two paradigmatic examples, namely, the biomimetic cloning of quantum observables and the Bu\v zek-Hillery universal quantum cloning machine, observing a faster average convergence of the former, but better final populations of the latter. Additionally, we analyzed the effect of introducing a mutation subroutine, concluding a minor impact on the average performance. Furthermore, we introduce a quantum channel analysis to prove the exponential convergence of our algorithm and even predict its convergence-ratio. This tool could be extended to formally prove results on the convergence of general non-unitary iteration-based algorithms. ",Quantum Genetic Algorithm with Individuals in Multiple Registers
178,1509083448690065414,957689165902118912,Alexandre Dauphin,"['Fresh from the arXivs: <LINK>\nWe study the fate of the topological Mott Insulator in a  cold-atom setup with dressed-Rydberg interactions. We derive the phase diagram in the presence of long-range interactions and study its stability with respect to temperature. <LINK>', 'We also verify with DMRG calculations that the quantum anomalous Hall phase also appears on quasi 2D ladders. Finally,we discuss realistic experimental parameters where the phase could be observed. It has been a nice collaboration with @lorenzocarda , S. Juliá-Farré and M. Müller']",https://arxiv.org/abs/2203.14818,"The interplay between many-body interactions and the kinetic energy gives rise to rich phase diagrams hosting, among others, interaction-induced topological phases. These phases are characterized by both a local order parameter and a global topological invariant, and can exhibit exotic ground states such as self-trapped polarons and interaction-induced edge states. In this work, we investigate a realistic scenario for the quantum simulation of such systems using cold Rydberg-dressed atoms in optical lattices. We consider spinless fermions on a checkerboard lattice, interacting via the tunable-range effective potential induced by the Rydberg dressing. We perform a detailed analysis of the phase diagram at half- and incommensurate fillings, in the mean-field approximation. We furthermore study the stability of the phases with respect to temperature within the mean-field approximation and with respect to quantum fluctuations using the density matrix renormalization group method. Finally, we propose an implementation protocol, and in particular identify attainable regimes of experimental parameters in which the topological properties of the model become accessible. Our work, thereby, opens a realistic pathway to the outstanding experimental observation of this predicted phase in state-of-the-art cold atom quantum simulators. ","Accessing the topological Mott insulator in cold atom quantum simulators
  with realistic Rydberg dressing"
179,1509069578269302785,248142831,Yuhuang Hu,['New paper accepted at #ICPR2022. Kernel Modulation: A Parameter-Efficient Method for Training Convolutional Neural Networks (<LINK>).\n\nWe propose a parameter-efficient kernel modulation (KM) method that adapts the parameters of a base network.'],https://arxiv.org/abs/2203.15297,"Deep Neural Networks, particularly Convolutional Neural Networks (ConvNets), have achieved incredible success in many vision tasks, but they usually require millions of parameters for good accuracy performance. With increasing applications that use ConvNets, updating hundreds of networks for multiple tasks on an embedded device can be costly in terms of memory, bandwidth, and energy. Approaches to reduce this cost include model compression and parameter-efficient models that adapt a subset of network layers for each new task. This work proposes a novel parameter-efficient kernel modulation (KM) method that adapts all parameters of a base network instead of a subset of layers. KM uses lightweight task-specialized kernel modulators that require only an additional 1.4% of the base network parameters. With multiple tasks, only the task-specialized KM weights are communicated and stored on the end-user device. We applied this method in training ConvNets for Transfer Learning and Meta-Learning scenarios. Our results show that KM delivers up to 9% higher accuracy than other parameter-efficient methods on the Transfer Learning benchmark. ","Kernel Modulation: A Parameter-Efficient Method for Training
  Convolutional Neural Networks"
180,1508791099887923200,871719324867854336,Christos Charalambous,"['How can, a small group of people with prejudices, convince the rest of a community about their preference faster? We find that this requires the biased agents to form a more endogamous community, while the unbiased agents a more exogamous one. <LINK>', 'In the classical voter model, agents copy their neighbor’s opinion, if this is different. In the variation considered here, all agents have confidence, i.e. a non-zero probability to remain with their current opinion.', 'A subgroup of agents has an opinion-dependent confidence, modelling a prejudice towards one of the opinions.We study the problem analytically and numerically,at both the thermodynamic limit and when finite size effects are in place,on a complete graph and on an ER random network.', 'Finally, we consider the case where the topology of interactions depends on the type of agents residing at each node. We ask the question “how can the heterogeneous topology be exploited by the biased agents to convince the rest of the society about their prejudice faster?”', 'Given a constant global average number of interactions in the community, we find that increasing the number of confrontations among members of the two groups(inter-group biased and unbiased) at the expense of the interactions among their peers, does not benefit the biased agents.', 'On the contrary, if the inter-group (biased interacting with unbiased) interactions are kept constant, and the interactions of biased agents among themselves are increased at the expense of the interactions of unbiased agents among themselves, this reduces the time to consensus.', 'A closed biased group (biased agents interact more among themselves rather than with unbiased agents) and an open unbiased group (unbiased agents interact more with biased agents rather than among themselves) is a scenario that favors the biased agents to spread their preference.']",https://arxiv.org/abs/2203.05376,"We study the voter model dynamics in the presence of confidence and bias. We assume two types of voters. Unbiased voters whose confidence is indifferent to the state of the voter and biased voters whose confidence is biased towards a common fixed preferred state. We study the problem analytically on the complete graph using mean field theory and on an Erd\H{o}s-R\'enyi random network topology using the pair approximation, where we assume that the network of interactions topology is independent of the type of voters. We find that for the case of a random initial setup, and for sufficiently large number of voters $N$, the time to consensus increases proportionally to $\log(N)/\gamma v$, with $\gamma$ the fraction of biased voters and $v$ the parameter quantifying the bias of the voters ($v=0$ no bias). We verify our analytical results through numerical simulations. We study this model on a biased-dependent topology of the network of interactions and examine two distinct, global average-degree preserving strategies (model I and model II) to obtain such biased-dependent random topologies starting from the biased-independent random topology case as the initial setup. Keeping all other parameters constant, in model I, $\mu_{BU}$, the average number of links among biased (B) and unbiased (U) voters is varied at the expense of $\mu_{UU}$ and $\mu_{BB}$, i.e. the average number of links among only unbiased and biased voters respectively. In model II, $\mu_{BU}$ is kept constant, while $\mu_{BB}$ is varied at the expense of $\mu_{UU}$. We find that if the agents follow the strategy described by model II, they can achieve a significant reduction in the time to reach consensus as well as an increment in the probability to reach consensus to the preferred state. ",Biased-voter model: how persuasive a small group can be?
181,1508718414055059458,1271852576296906755,Ashley Chrimes,"['New paper on arxiv today! We find NIR emission at the location of 6 Galactic magnetars for the first time, and show that some known NIR counterparts are highly variable. We also discuss the nature of the NIR emission - more to come on that, so stay tuned! <LINK>']",https://arxiv.org/abs/2203.14947,"We report the discovery of six new magnetar counterpart candidates from deep near-infrared Hubble Space Telescope imaging. The new candidates are among a sample of nineteen magnetars for which we present HST data obtained between 2018-2020. We confirm the variability of previously established near-infrared counterparts, and newly identify candidates for PSRJ1622-4950, SwiftJ1822.3-1606, CXOUJ171405.7-381031, SwiftJ1833-0832, SwiftJ1834.9-0846 and AXJ1818.8-1559 based on their proximity to X-ray localisations. The new candidates are compared with the existing counterpart population in terms of their colours, magnitudes, and near-infrared to X-ray spectral indices. We find two candidates for AXJ1818.8-1559 which are both consistent with previously established counterparts. The other new candidates are likely to be chance alignments, or otherwise have a different origin for their near-infrared emission not previously seen in magnetar counterparts. Further observations and studies of these candidates are needed to firmly establish their nature. ","New candidates for magnetar counterparts from a deep search with the
  Hubble Space Telescope"
182,1508694462024749056,439364141,Ramon Ruiz-Dolz,"['We propose a new hybrid method for the automatic evaluation of natural language argumentative debates. This approach allows to estimate the outcome of professional debates considering both, the underlying logic of arguments and their natural language.\n\n<LINK>', '#NLP #Argumentation #DeepLearning #NeuralNetworks https://t.co/GFkl1KJiIc']",http://arxiv.org/abs/2203.14647,"The lack of annotated data on professional argumentation and complete argumentative debates has led to the oversimplification and the inability of approaching more complex natural language processing tasks. Such is the case of the automatic debate evaluation. In this paper, we propose an original hybrid method to automatically evaluate argumentative debates. For that purpose, we combine concepts from argumentation theory such as argumentation frameworks and semantics, with Transformer-based architectures and neural graph networks. Furthermore, we obtain promising results that lay the basis on an unexplored new instance of the automatic analysis of natural language arguments. ","Automatic Debate Evaluation with Argumentation Semantics and Natural
  Language Argument Graph Networks"
183,1508581494880673802,948010010,Antonis Anastasopoulos,"['Revisiting the Effects of Leakage on Dependency Parsing, ACL Findings\n<LINK>\nWe propose new measures on leakage (having similar trees in train and test) and find that it may explain zero-shot cross-lingual performance.\nHowever, 1/3 <LINK>', 'we think that more ""easy"" examples (e.g. short sentences) tend to leak; not that leakage allows  parsers to (seem to) perform better (as previous --cool-- work suggested).\nMore interestingly, 2/3', 'we also do a study on Faroese, transferring from various Germanic languages, and show that a smaller, diverse (in terms of syntax tree isomorphisms) training set is just as good or better than using the whole training set! 3/3 https://t.co/ZqnYpWM9Zp', 'Congratulations to @miriamwanner and Nate Krasner for their first published paper, two undergrads with a bright research future ahead of them! \nAnd thank you to @NSF for funding our REU site here at @GMUCompSci.', ""@complingy @miriamwanner @NSF @GMUCompSci Ah, good point, the original claim was about monolingual parsing, I should have been more clear!\nWe did experiments reproducing the original claim on more languages with more systems in a monolingual setting first -- it's only in zero-shot cross-lingual settings where it holds!"", '@miriamwanner @NSF @GMUCompSci Let me also highlight this earlier paper (which we had missed till now, yay for twitter #nlproc community): https://t.co/7h30sHk0Ie by Mark Anderson, Anders Søgaard, and @carlosgr_nlp, who also discuss the issues with the previous study (Søgaard, 2020).']",https://arxiv.org/abs/2203.12815,"Recent work by S{\o}gaard (2020) showed that, treebank size aside, overlap between training and test graphs (termed leakage) explains more of the observed variation in dependency parsing performance than other explanations. In this work we revisit this claim, testing it on more models and languages. We find that it only holds for zero-shot cross-lingual settings. We then propose a more fine-grained measure of such leakage which, unlike the original measure, not only explains but also correlates with observed performance variation. Code and data are available here: this https URL ",Revisiting the Effects of Leakage on Dependency Parsing
184,1508504916125528075,1159484728359043072,Fangyuan Xu 许方园,"['🤔 How do we answer complex questions, such as “How much money is needed in order to not have to work for the rest of your life”? We (w/ @eunsolc and @jessyjli) study the discourse structure of long-form answers. #ACL2022 \nPaper: <LINK> <LINK>', 'We design 6 functional roles, annotate answers from ELI5, NQ and WebGPT, and discover their *different* answer structures. Yet, in all, 40%+ of the sentences don’t directly address the question but serve other roles – e.g. provide background information, give an example, etc.', 'How about model generated answers? We annotate answers from a state-of-the-art LFQA system. Interestingly, the same set of human annotators agree with each other *less* on assigning roles and the role distribution is also different, with less sentences addressing the questions.', 'More analysis in the paper! LFQA is a challenging yet interesting problem, and we hope our work can inspire future research on discourse level modelling and evaluation of long-form QA systems. \nData and code: https://t.co/grqpYnK6l1\nWebsite: https://t.co/dmc7vkHQx2']",https://arxiv.org/abs/2203.11048,"Long-form answers, consisting of multiple sentences, can provide nuanced and comprehensive answers to a broader set of questions. To better understand this complex and understudied task, we study the functional structure of long-form answers collected from three datasets, ELI5, WebGPT and Natural Questions. Our main goal is to understand how humans organize information to craft complex answers. We develop an ontology of six sentence-level functional roles for long-form answers, and annotate 3.9k sentences in 640 answer paragraphs. Different answer collection methods manifest in different discourse structures. We further analyze model-generated answers -- finding that annotators agree less with each other when annotating model-generated answers compared to annotating human-written answers. Our annotated data enables training a strong classifier that can be used for automatic analysis. We hope our work can inspire future research on discourse-level modeling and evaluation of long-form QA systems. ","How Do We Answer Complex Questions: Discourse Structure of Long-form
  Answers"
185,1508462295231442948,1120914312,Arnav,['🚨 New pre-print alert! 🚨\n\nWe design probes to study whether Pre-Trained Language Models pick up on cross-cultural differences in values and whether those align with existing value surveys : <LINK>\n\nWork with my amazing colleagues @frimelle @IAugenstein\n#NLProc <LINK>'],https://arxiv.org/abs/2203.13722,"Language embeds information about social, cultural, and political values people hold. Prior work has explored social and potentially harmful biases encoded in Pre-Trained Language models (PTLMs). However, there has been no systematic study investigating how values embedded in these models vary across cultures. In this paper, we introduce probes to study which values across cultures are embedded in these models, and whether they align with existing theories and cross-cultural value surveys. We find that PTLMs capture differences in values across cultures, but those only weakly align with established value surveys. We discuss implications of using mis-aligned models in cross-cultural settings, as well as ways of aligning PTLMs with value surveys. ","Probing Pre-Trained Language Models for Cross-Cultural Differences in
  Values"
186,1508407909155278848,13800042,Lukas Heinrich,"['Short new paper on lhood-free inference:We use the profile lhood ratio b/c of its asymptotically optimal properties but often need to approximate p(x|θ) to compute it. But if we take its properties seriously, we can find it in a fully likelihood-free way: <LINK> <LINK>', ""As in the likelihood ratio trick, the idea is simple: if we use a test stat because it's optimal, that just means we can find it through optimization. The LRT is (asymptotically) optimal is various ways e.g. has best average power in a certain sense"", 'The idea is to optimizing a neural network-based statistic for best average power - this will generally give you a good test statistic. If the underlying model behaves asymptotically, this recovers the profile likelihood ratio without ever having to evaluate or fit p(x|θ)']",http://arxiv.org/abs/2203.13079,"The design of optimal test statistics is a key task in frequentist statistics and for a number of scenarios optimal test statistics such as the profile-likelihood ratio are known. By turning this argument around we can find the profile likelihood ratio even in likelihood-free cases, where only samples from a simulator are available, by optimizing a test statistic within those scenarios. We propose a likelihood-free training algorithm that produces test statistics that are equivalent to the profile likelihood ratios in cases where the latter is known to be optimal. ",Learning Optimal Test Statistics in the Presence of Nuisance Parameters
187,1507408630269636609,976521596289671172,Thomas Fai,"['Announcing our latest preprint, joint with postdoc Ying Zhang, on the influence of the endothelial surface layer (ESL) on red blood cell motion. ESL structure is disrupted in diseases such as sepsis, and we here study its effect by simulating blood flow.  <LINK>', 'In particular, we study how ESL roughness influences the wall-induced migration of red cells. Interestingly, we find that ESL surface roughness causes increased lift and larger cell free layer at vessel walls, with potential implications for oxygen transport and immune response. https://t.co/kZ5km8U9eB']",https://arxiv.org/abs/2203.12113,"The endothelial lining of blood vessels presents a large surface area for exchanging materials between blood and tissues. The endothelial surface layer (ESL) plays a critical role in regulating vascular permeability, hindering leukocyte adhesion as well as inhibiting coagulation during inflammation. Changes in the ESL structure are believed to cause vascular hyperpermeability and induce thrombus formation during sepsis. In addition, ESL topography is relevant for the interactions between red blood cells (RBCs) and the vessel wall, including the wall-induced migration of RBCs and formation of a cell-free layer. To investigate the influence of the ESL on the motion of RBCs, we construct two models to represent the ESL using the immersed boundary method. In particular, we use simulations to study how lift force and drag force change over time when a RBC is placed close to the ESL as the thickness, roughness, and permeability of the ESL vary. We find that roughness has a significant effect on the wall-induced migration of the RBC when the ESL is highly permeable and that the wall-induced migration can be significantly inhibited by the presence of a thick ESL. ","Influence of the Endothelial Surface Layer on the Wall-induced Migration
  of Red Blood Cells"
188,1507400626979831808,972878356319473665,Sophia Economou,"['New paper on arxiv. We propose a new, easier to measure objective function combined with the ADAPT-VQE strategy to create Gibbs states with high fidelity. <LINK> With Ada Warren, @linghua_zhu, Ed Barnes and @nick_mayhall']",https://arxiv.org/abs/2203.12757,"The preparation of Gibbs thermal states is an important task in quantum computation with applications in quantum simulation, quantum optimization, and quantum machine learning. However, many algorithms for preparing Gibbs states rely on quantum subroutines which are difficult to implement on near-term hardware. Here, we address this by (i) introducing an objective function that, unlike the free energy, is easily measured, and (ii) using dynamically generated, problem-tailored ans\""atze. This allows for arbitrarily accurate Gibbs state preparation using low-depth circuits. To verify the effectiveness of our approach, we numerically demonstrate that our algorithm can prepare high-fidelity Gibbs states across a broad range of temperatures and for a variety of Hamiltonians. ",Adaptive variational algorithms for quantum Gibbs state preparation
189,1506959849934004225,3379982859,Hazel Doughty,"[""Excited to share our #CVPR2022 work 'How Do You Do It? Fine-Grained Action Understanding with Pseudo-Adverbs'\xa0<LINK>\xa0w/ @cgmsnoek\n\nWe propose a semi-supervised method to recognize adverbs so that subtle differences in videos can be described. <LINK>"", 'Our method uses multiple adverb pseudo-labelling and adaptive thresholding to successfully recognize adverbs despite the long-tail distribution. With this we can recognize adverbs in seen action-adverb compositions, unseen compositions and unseen domains.', 'We also find that adverbs can describe relationships between fine-grained actions.\n\nFor our new adverb datasets and more info check out the project page:\xa0https://t.co/iT8tBsKYA7 https://t.co/cpnBJmfhl7']",https://arxiv.org/abs/2203.12344,"We aim to understand how actions are performed and identify subtle differences, such as 'fold firmly' vs. 'fold gently'. To this end, we propose a method which recognizes adverbs across different actions. However, such fine-grained annotations are difficult to obtain and their long-tailed nature makes it challenging to recognize adverbs in rare action-adverb compositions. Our approach therefore uses semi-supervised learning with multiple adverb pseudo-labels to leverage videos with only action labels. Combined with adaptive thresholding of these pseudo-adverbs we are able to make efficient use of the available data while tackling the long-tailed distribution. Additionally, we gather adverb annotations for three existing video retrieval datasets, which allows us to introduce the new tasks of recognizing adverbs in unseen action-adverb compositions and unseen domains. Experiments demonstrate the effectiveness of our method, which outperforms prior work in recognizing adverbs and semi-supervised works adapted for adverb recognition. We also show how adverbs can relate fine-grained actions. ",How Do You Do It? Fine-Grained Action Understanding with Pseudo-Adverbs
