,TweetID,AuthorID,AuthorName,Tweets,arxiv_link,Abstract,Title
18,833597768996384768,292313052,Martin Kilbinger,"['New paper: <LINK>: Limber &amp;  flat-sky approximations of weak-lensing projections sufficient for current surveys.', '@energie_sombre For sub-percent accuract needed for Euclid/LSST/... we recommend 2nd-order Limber approximation.', '@energie_sombre Code available at https://t.co/j4LVZrNlZJ, version 2.7 released']",http://arxiv.org/abs/1702.05301,"We compute the spherical-sky weak-lensing power spectrum of the shear and convergence. We discuss various approximations, such as flat-sky, and first- and second- order Limber equations for the projection. We find that the impact of adopting these approximations is negligible when constraining cosmological parameters from current weak lensing surveys. This is demonstrated using data from the Canada-France-Hawaii Telescope Lensing Survey (CFHTLenS). We find that the reported tension with Planck Cosmic Microwave Background (CMB) temperature anisotropy results cannot be alleviated. For future large-scale surveys with unprecedented precision, we show that the spherical second-order Limber approximation will provide sufficient accuracy. In this case, the cosmic-shear power spectrum is shown to be in agreement with the full projection at the sub-percent level for l > 3, with the corresponding errors an order of magnitude below cosmic variance for all l. When computing the two-point shear correlation function, we show that the flat-sky fast Hankel transformation results in errors below two percent compared to the full spherical transformation. In the spirit of reproducible research, our numerical implementation of all approximations and the full projection are publicly available within the package nicaea at this http URL ",Precision calculations of the cosmic shear power spectrum projection
19,833596692465381377,232642215,Jukka Suomela,"['A new paper: LCL problems on grids, <LINK>\n\nSome slides: <LINK> <LINK>']",https://arxiv.org/abs/1702.05456,"LCLs or locally checkable labelling problems (e.g. maximal independent set, maximal matching, and vertex colouring) in the LOCAL model of computation are very well-understood in cycles (toroidal 1-dimensional grids): every problem has a complexity of $O(1)$, $\Theta(\log^* n)$, or $\Theta(n)$, and the design of optimal algorithms can be fully automated. This work develops the complexity theory of LCL problems for toroidal 2-dimensional grids. The complexity classes are the same as in the 1-dimensional case: $O(1)$, $\Theta(\log^* n)$, and $\Theta(n)$. However, given an LCL problem it is undecidable whether its complexity is $\Theta(\log^* n)$ or $\Theta(n)$ in 2-dimensional grids. Nevertheless, if we correctly guess that the complexity of a problem is $\Theta(\log^* n)$, we can completely automate the design of optimal algorithms. For any problem we can find an algorithm that is of a normal form $A' \circ S_k$, where $A'$ is a finite function, $S_k$ is an algorithm for finding a maximal independent set in $k$th power of the grid, and $k$ is a constant. Finally, partially with the help of automated design tools, we classify the complexity of several concrete LCL problems related to colourings and orientations. ",LCL problems on grids
20,833596117724061696,1689286236,Goodwin Group Oxford,"[""Like a supramolecular mattress: @clobar's new paper on Au...Au helices! <LINK> @Matthew_R_Ryder @MMCLabOx @nowatchesnomaps""]",https://arxiv.org/abs/1702.05145,"We report the mechanical properties of the `giant' negative compressibility material zinc(II) dicyanoaurate, as determined using a combination of single-crystal nanoindentation measurements and \emph{ab initio} density functional theory calculations. While the elastic response of zinc dicyanoaurate is found to be intermediate to the behaviour of dense and open framework structures, we discover the material to exhibit a particularly strong elastic recovery, which is advantageous for a range of practical applications. We attribute this response to the existence of supramolecular helices that function as atomic-scale springs, storing mechanical energy during compressive stress and hence inhibiting plastic deformation. Our results are consistent with the relationship noted in [Cheng \& Cheng, \textit{Appl. Phys. Lett.}, 1998, {\textbf{73}}, 614] between the magnitude of elastic recovery, on the one hand, and the ratio of material hardness to Young's modulus, on the other hand. Drawing on comparisons with other metal--organic frameworks containing helical structure motifs, we suggest helices as an attractive supramolecular motif for imparting resistance to plastic deformation in the design of functional materials. ",Large elastic recovery of zinc dicyanoaurate
21,833280388571209728,4833028707,David Lederman,"['Our new review paper on #bioelectronics available at <LINK>. In collab w @WeizmannScience', 'Written at @ucsc @ucscphysics @WestVirginiaU @WeizmannScience']",http://arxiv.org/abs/1702.05028,"We review the status of protein-based molecular electronics. First we discuss fundamental concepts of electron transfer and transport in and across proteins and proposed mechanisms for these processes. We then describe the immobilization of proteins to solid-state surfaces in both nanoscale and macroscopic approaches, and highlight how different methodologies can alter protein electronic properties. Because immobilizing proteins while retaining biological activity is crucial to the successful development of bioelectronic devices, we discuss this process at length. We briefly discuss computational predictions and their link to experimental results. We then summarize how the biological activity of immobilized proteins is beneficial for bioelectronics devices, and how conductance measurements can shed light on protein properties. Finally, we consider how the research to date could influence the development of future bioelectronics devices. ",Protein bioelectronics: a review of what we do and do not know
22,832567255586177024,15421904,Lance Fortnow,['New paper: Compression Complexity <LINK>'],https://arxiv.org/abs/1702.04779,"The Kolmogorov complexity of x, denoted C(x), is the length of the shortest program that generates x. For such a simple definition, Kolmogorov complexity has a rich and deep theory, as well as applications to a wide variety of topics including learning theory, complexity lower bounds and SAT algorithms. Kolmogorov complexity typically focuses on decompression, going from the compressed program to the original string. This paper develops a dual notion of compression, the mapping from a string to its compressed version. Typical lossless compression algorithms such as Lempel-Ziv or Huffman Encoding always produce a string that will decompress to the original. We define a general compression concept based on this observation. For every m, we exhibit a single compression algorithm q of length about m which for n and strings x of length n >= m, the output of q will have length within n-m+O(1) bits of C(x). We also show this bound is tight in a strong way, for every n >= m there is an x of length n with C(x) about m such that no compression program of size slightly less than m can compress x at all. We also consider a polynomial time-bounded version of compression complexity and show that similar results for this version would rule out cryptographic one-way functions. ",Compression Complexity
23,832523697261015040,26716739,Mattias Villani,"[""New paper 'Tree Ensembles with Rule Structured Horseshoe Regularization' <LINK> <LINK>""]",https://arxiv.org/abs/1702.05008,"We propose a new Bayesian model for flexible nonlinear regression and classification using tree ensembles. The model is based on the RuleFit approach in Friedman and Popescu (2008) where rules from decision trees and linear terms are used in a L1-regularized regression. We modify RuleFit by replacing the L1-regularization by a horseshoe prior, which is well known to give aggressive shrinkage of noise predictor while leaving the important signal essentially untouched. This is especially important when a large number of rules are used as predictors as many of them only contribute noise. Our horseshoe prior has an additional hierarchical layer that applies more shrinkage a priori to rules with a large number of splits, and to rules that are only satisfied by a few observations. The aggressive noise shrinkage of our prior also makes it possible to complement the rules from boosting in Friedman and Popescu (2008) with an additional set of trees from random forest, which brings a desirable diversity to the ensemble. We sample from the posterior distribution using a very efficient and easily implemented Gibbs sampler. The new model is shown to outperform state-of-the-art methods like RuleFit, BART and random forest on 16 datasets. The model and its interpretation is demonstrated on the well known Boston housing data, and on gene expression data for cancer classification. The posterior sampling, prediction and graphical tools for interpreting the model results are implemented in a publicly available R package. ",Tree Ensembles with Rule Structured Horseshoe Regularization
24,832494701672534016,733640801914343425,Adam Santoro,['Our new paper on reasoning about relations (accepted at the ICLR Worksop): <LINK>'],https://arxiv.org/abs/1702.05068,"Our world can be succinctly and compactly described as structured scenes of objects and relations. A typical room, for example, contains salient objects such as tables, chairs and books, and these objects typically relate to each other by their underlying causes and semantics. This gives rise to correlated features, such as position, function and shape. Humans exploit knowledge of objects and their relations for learning a wide spectrum of tasks, and more generally when learning the structure underlying observed data. In this work, we introduce relation networks (RNs) - a general purpose neural network architecture for object-relation reasoning. We show that RNs are capable of learning object relations from scene description data. Furthermore, we show that RNs can act as a bottleneck that induces the factorization of objects from entangled scene description inputs, and from distributed deep representations of scene images provided by a variational autoencoder. The model can also be used in conjunction with differentiable memory mechanisms for implicit relation discovery in one-shot learning tasks. Our results suggest that relation networks are a potentially powerful architecture for solving a variety of problems that require object relation reasoning. ","Discovering objects and their relations from entangled scene
  representations"
25,832440882779480066,21114887,Raphael Gottardo 📊🧪🖥️,['New paper for clustering flow cytometry data <LINK> using sequential DPM'],https://arxiv.org/abs/1702.04407,"Flow cytometry is a high-throughput technology used to quantify multiple surface and intracellular markers at the level of a single cell. This enables to identify cell sub-types, and to determine their relative proportions. Improvements of this technology allow to describe millions of individual cells from a blood sample using multiple markers. This results in high-dimensional datasets, whose manual analysis is highly time-consuming and poorly reproducible. While several methods have been developed to perform automatic recognition of cell populations, most of them treat and analyze each sample independently. However, in practice, individual samples are rarely independent (e.g. longitudinal studies). Here, we propose to use a Bayesian nonparametric approach with Dirichlet process mixture (DPM) of multivariate skew $t$-distributions to perform model based clustering of flow-cytometry data. DPM models directly estimate the number of cell populations from the data, avoiding model selection issues, and skew $t$-distributions provides robustness to outliers and non-elliptical shape of cell populations. To accommodate repeated measurements, we propose a sequential strategy relying on a parametric approximation of the posterior. We illustrate the good performance of our method on simulated data, on an experimental benchmark dataset, and on new longitudinal data from the DALIA-1 trial which evaluates a therapeutic vaccine against HIV. On the benchmark dataset, the sequential strategy outperforms all other methods evaluated, and similarly, leads to improved performance on the DALIA-1 data. We have made the method available for the community in the R package NPflow. ","Sequential Dirichlet Process Mixtures of Multivariate Skew
  t-distributions for Model-based Clustering of Flow Cytometry Data"
26,832284422283988993,43560393,Maurice Herlihy,['New paper: Adding Concurrency to Smart Contracts \n<LINK>'],https://arxiv.org/abs/1702.04467,"Modern cryptocurrency systems, such as Ethereum, permit complex financial transactions through scripts called smart contracts. These smart contracts are executed many, many times, always without real concurrency. First, all smart contracts are serially executed by miners before appending them to the blockchain. Later, those contracts are serially re-executed by validators to verify that the smart contracts were executed correctly by miners. Serial execution limits system throughput and fails to exploit today's concurrent multicore and cluster architectures. Nevertheless, serial execution appears to be required: contracts share state, and contract programming languages have a serial semantics. This paper presents a novel way to permit miners and validators to execute smart contracts in parallel, based on techniques adapted from software transactional memory. Miners execute smart contracts speculatively in parallel, allowing non-conflicting contracts to proceed concurrently, and ""discovering"" a serializable concurrent schedule for a block's transactions, This schedule is captured and encoded as a deterministic fork-join program used by validators to re-execute the miner's parallel schedule deterministically but concurrently. Smart contract benchmarks run on a JVM with ScalaSTM show that a speedup of of 1.33x can be obtained for miners and 1.69x for validators with just three concurrent threads. ",Adding Concurrency to Smart Contracts
27,831900313279934469,14118089,Henry Segerman,"['New paper on hyperbolic virtual reality, with @vihartvihart , @AndreaHawksley and @Sabetta_. <LINK> <LINK>']",https://arxiv.org/abs/1702.04004,We describe our initial explorations in simulating non-euclidean geometries in virtual reality. Our simulations of three-dimensional hyperbolic space are available at this http URL ,Non-euclidean virtual reality I: explorations of $\mathbb{H}^3$
28,831693781208485888,795877354266456064,KoheiKamadaPhys,['My new paper has appeared. On the primordial MFs &amp; their relation to particle physics. Please have a look at it! \n<LINK>'],https://arxiv.org/abs/1702.03928,"Production of axionlike particles (ALPs) by primordial magnetic fields may have significant impacts on cosmology. We discuss the production of ALPs in the presence of the primordial magnetic fields. We find a region of the ALP mass and photon coupling which realizes the observed properties of the dark matter with appropriate initial conditions for the magnetic fields. This region may be interesting in light of recent indications for the 3.5 keV lines from galaxy clusters. For a small axion mass, a region of previously allowed parameter spaces is excluded by overproduction of ALPs as a hot/warm dark matter component. Since the abundance of ALPs strongly depends on the initial conditions of primordial magnetic fields, our results provide implications for scenarios of magnetogenesis. ",Axion production from primordial magnetic fields
29,831633920164716544,1580467730,Michael Busch,['The boundary between comets and asteroids continues to be fuzzy.  New paper by Moreno et al. (including @astrokiwi): <LINK>'],https://arxiv.org/abs/1702.03665,"We present deep imaging observations, orbital dynamics, and dust tail model analyses of the double-component asteroid P/2016 J1 (J1-A and J1-B). The observations were acquired at the Gran Telescopio Canarias (GTC) and the Canada-France-Hawaii Telescope (CFHT) from mid March to late July, 2016. A statistical analysis of backward-in-time integrations of the orbits of a large sample of clone objects of P/2016 J1-A and J1-B shows that the minimum separation between them occurred most likely $\sim$2300 days prior to the current perihelion passage, i.e., during the previous orbit near perihelion. This closest approach was probably linked to a fragmentation event of their parent body. Monte Carlo dust tail models show that those two components became active simultaneously $\sim$250 days before the current perihelion, with comparable maximum loss rates of $\sim$0.7 kg s$^{-1}$ and $\sim$0.5 kg s$^{-1}$, and total ejected masses of 8$\times$10$^{6}$ kg and 6$\times$10$^{6}$ kg for fragments J1-A and J1-B, respectively. In consequence, the fragmentation event and the present dust activity are unrelated. The simultaneous activation times of the two components and the fact that the activity lasted 6 to 9 months or longer, strongly indicate ice sublimation as the most likely mechanism involved in the dust emission process. ",The splitting of double-component active asteroid P/2016 J1 (PANSTARRS)
30,831459512951439360,549226519,Katarina Stensson (PP),"['We got a new paper up on #arxiv ! ""Two-photon interference from two blinking quantum emitters"" <LINK> Now, back to the lab.']",https://arxiv.org/abs/1702.03278,We investigate the effect of blinking on the two-photon interference measurement from two independent quantum emitters. We find that blinking significantly alters the statistics in the second-order intensity correlation function g$^{(2)}(\tau)$ and the outcome of two-photon interference measurements performed with independent quantum emitters. We theoretically demonstrate that the presence of blinking can be experimentally recognized by a deviation from the g$^{(2)}_{D}(0)=0.5$ value when distinguishable photons impinge on a beam splitter. Our results show that blinking imposes a mandatory cross-check measurement to correctly estimate the degree of indistinguishablility of photons emitted by independent quantum emitters. ,Two-photon interference from two blinking quantum emitters
31,830411530357395457,779636032476176385,Alan McKenzie,['Just posted a new paper on arXiv (<LINK>).\n<LINK>'],https://arxiv.org/abs/1702.02019,"Anthony Aguirre and Max Tegmark have famously speculated that the Level I Multiverse is the same as the Level III Multiverse. By this, they mean that the parallel universes of the Level III Multiverse can be regarded as similar or identical copies of our own Hubble volume distributed throughout the whole of our (possibly infinite) bubble universe. However, we show that our bubble universe is in a single quantum eigenstate that extends to regions of space that are receding from each other at superluminal velocities because of general relativistic expansion. Such a bubble universe cannot accommodate Hubble volumes in the different orthogonal eigenstates required by the Level III Multiverse. Instead, quantum uncertainty arises from large numbers of alternative bubble universes in Hilbert space, isolated from each other. The conclusion of the paper is that the Level I Multiverse is not the same as the Level III Multiverse. ",The Level I Multiverse is not the same as the Level III Multiverse
32,830110988473077760,333597222,Matt Lease,"['New paper ""Exploiting Domain Knowledge via Grouped Weight Sharing..."" with Ye Zhang &amp; @byron_c_wallace: <LINK> @UTiSchool']",https://arxiv.org/abs/1702.02535,"A fundamental advantage of neural models for NLP is their ability to learn representations from scratch. However, in practice this often means ignoring existing external linguistic resources, e.g., WordNet or domain specific ontologies such as the Unified Medical Language System (UMLS). We propose a general, novel method for exploiting such resources via weight sharing. Prior work on weight sharing in neural networks has considered it largely as a means of model compression. In contrast, we treat weight sharing as a flexible mechanism for incorporating prior knowledge into neural models. We show that this approach consistently yields improved performance on classification tasks compared to baseline strategies that do not exploit weight sharing. ","Exploiting Domain Knowledge via Grouped Weight Sharing with Application
  to Text Categorization"
33,830017220189188096,16674284,Mirco Musolesi,['New survey paper: Sensing and Modeling Human Behavior Using Social Media and Mobile Data <LINK> \\w @mehrotrabhinav'],https://arxiv.org/abs/1702.01181,"In the past years we have witnessed the emergence of the new discipline of computational social science, which promotes a new data-driven and computation-based approach to social sciences. In this article we discuss how the availability of new technologies such as online social media and mobile smartphones has allowed researchers to passively collect human behavioral data at a scale and a level of granularity that were just unthinkable some years ago. We also discuss how these digital traces can then be used to prove (or disprove) existing theories and develop new models of human behavior. ",Sensing and Modeling Human Behavior Using Social Media and Mobile Data
34,829822071551188993,1523174335,Kolja Kleineberg,['Geometric correlations and the robustness of multiplex networks! Supp. Vid. of new paper <LINK> <LINK>'],https://arxiv.org/abs/1702.02246,"We show that real multiplex networks are unexpectedly robust against targeted attacks on high degree nodes, and that hidden interlayer geometric correlations predict this robustness. Without geometric correlations, multiplexes exhibit an abrupt breakdown of mutual connectivity, even with interlayer degree correlations. With geometric correlations, we instead observe a multistep cascading process leading into a continuous transition, which apparently becomes fully continuous in the thermodynamic limit. Our results are important for the design of efficient protection strategies and of robust interacting networks in many domains. ","Geometric correlations mitigate the extreme vulnerability of multiplex
  networks against targeted attacks"
35,829598056806903809,1523174335,Kolja Kleineberg,"['New paper: Geometric correlations mitigate the extreme vulnerability of multiplex networks against targeted attacks <LINK> <LINK>', '@KoljaKleineberg ... and now with geometric correlations https://t.co/olmclANaHO @FuturICT @net_science @cxdig @clabbarcelona https://t.co/cXbDJ2VUdl']",https://arxiv.org/abs/1702.02246,"We show that real multiplex networks are unexpectedly robust against targeted attacks on high degree nodes, and that hidden interlayer geometric correlations predict this robustness. Without geometric correlations, multiplexes exhibit an abrupt breakdown of mutual connectivity, even with interlayer degree correlations. With geometric correlations, we instead observe a multistep cascading process leading into a continuous transition, which apparently becomes fully continuous in the thermodynamic limit. Our results are important for the design of efficient protection strategies and of robust interacting networks in many domains. ","Geometric correlations mitigate the extreme vulnerability of multiplex
  networks against targeted attacks"
36,828905962555715584,3306423411,Andrew Bond,"['New paper: <LINK> ! Possible extensions to the standard model based on UV fixed point in gauge couplings #AsymptoticSafety', 'Possible experimental collider signatures: changes to running of weak &amp; strong coupling constants, diboson signatures, R-hadrons.']",https://arxiv.org/abs/1702.01727,"Building on recent advances in the understanding of gauge-Yukawa theories we explore possibilities to UV-complete the Standard Model in an asymptotically safe manner. Minimal extensions are based on a large flavor sector of additional fermions coupled to a scalar singlet matrix field. We find that asymptotic safety requires fermions in higher representations of $SU(3)_C\times SU(2)_L$. Possible signatures at colliders are worked out and include $R$-hadron searches, diboson signatures and the evolution of the strong and weak coupling constants. ",Directions for model building from asymptotic safety
