,TweetID,AuthorID,AuthorName,Tweets,arxiv_link,Abstract,Title
147,1402305593793073155,400026483,Oem Trivedi,"['My new paper on Lorentz violating Inflation and the Swampland divinely hit the arxiv today ! Link - <LINK>\n\nSo now its time to unpack it 😇😁\n\nA thread ..... 1/n', ""Swampland conjectures are certain field theoretic criterion which have been reasoned out from String theory. The premise of these criterion is that these are the requirements for any low energy EFT's to have a consistent UV Completion 2/n"", 'The story for this paper starts of with the paper by @WKCosmo @SunnyVagnozzi @lucavisinelli ( https://t.co/hj8Eh5rSUR), which showed that GR based single field Inflation is in almost unavoidable conflicts with these criterion and hence, possibly with Quantum gravity. 3/n', 'The implications in that paper were so strong that even models like Higgs inflation got into tensions with the conjectures (https://t.co/YEA1OvsA7v). However, it has been shown that single field models in non GR Cosmologies or in Warm inflation models can be consistent ..4/n', 'And also, multi field Inflationary models can be in amicable terms with the conjectures too. I myself was of the thought that there cannot be essentially GR based inflation scenarios which would still be consistent with the conjectures and I was quite firm in this regard ..5/n', 'That was until I had the opportunity to attend the 4th IUCSS Summer  school on Lorentz and CPT violations and Standard model extension hosted by Indiana University Bloomington. While attending the school, I was fortunate to learn a lot about Lorentz violations and ...6/n', 'I began to wonder about its implications to Cosmology. Eventually, I stumbled upon how one can consider single field Inflation in a Lorentz violating background. So in this paper, I considered a time-like Lorentz violating background for inflation in an essentially GR regime .7/n', 'So in the paper, I consider this scenario. What is then shown in the paper is that the Swampland conjectures imply a lower bound on the Lorentz violating parameter for these Inflationary models and this one bound can satisfy all the swampy issues of inflation.. 8/n', 'Now here comes the fun part, we consider models of Inflation in this Lorentz violating scenario which would have been in the Swampland in usual GR based single field Inflation. These models are the Higgs model, Radion gauge model( found by @malcfairbairn ) and..9/n', 'A spontaneous symmetry breaking model of Inflation. I also consider a quadratic Inflation tbh but I dont work out the parameter myself but take it from another work and this model is still in the Swampland even with Lorentz violations(these models have issues with data too)..10/n', 'What is very exciting tho is that Higgs, Radion gauge and the spontaneous symmetry breaking models are EASILY consistent with the conjectures here! This is exciting because these models would have had unavoidable swamp issues in usual GR based single field Inflation..11/n', 'But from these examples, it is shown that single field Inflation can STILL BE CONSISTENT with the Swampland conjectures in an essentially GR based Cosmology !🤩These examples cover the full range from 0 to 2 free parameter models, all being consistent!.. 12/n', 'So this goes to show that inflation can be consistent with the Swampland even in a GR based Cosmology, when one considers some Lorentz violations in the background! This is a very nice outcome, because this possibly points towards the notion that.. 13/n', 'Quantum gravity(whatever that is) might indicate towards a greater significance of Lorentz violations in the early Universe than one envisages at this time, as previously swamp inconsistent regimes become consistent by just considering a certain form of these violations ..14/n', ""That's the big outcome from the paper! Thank you so much for reading it through eveyeone, hope you liked this thread and the paper too !😇🙏🏻😁🥳"", '@adamsolo Thanks a ton Adam! Your paper on non canonical inflation and Swampland was a treat to read btw 😁🥳', '@WKCosmo Thank you so much  ! This work has sprung out due to that paper of yours and also your other papers on the TCC which were very insightful! So thanks a ton for those works too']",https://arxiv.org/abs/2106.03578,"The swampland conjectures from String theory have had very interesting implications for cosmology and particularly for Inflation. It has been shown that the single field inflationary models in a GR based cosmology are in unavoidable tensions with these conjectures, while these single field models can still be consistent in certain non-trivial inflationary regimes. So it becomes interesting to see whether there is a way to overcome the issues of the swampland and single field inflation in an essentially GR based cosmology. We show that this can indeed be the case and for this, we consider a certain type of Lorentz violating inflationary scenario. We work out the swampland bounds for Lorentz violating inflationary models after which show that inflationary models which would have had otherwise serious tensions with these conjectures in a usual GR based scenario, can be very tranquil with the criterion in this regime. For this we take examples of Higgs inflation, radion gauge inflation and Spontaenous symmetry breaking inflation and show that the bounds imposed by the swampland on the Lorentz violating parameter can be easily satisfied in these models. ",Lorentz violating inflation and the Swampland
148,1402251145255477254,918851521416134656,Chin-Wei Huang,"['Super excited to share our new theory paper on connecting diffusion models &amp; score matching from a variational perspective (i.e. likelihood training)!\n\n<LINK>\n\nWe derive a new ELBO for general continuous-time diffusion models.\nw/ @jaehyunlim0606 &amp; @AaronCourville <LINK>', 'TL;DR: We derive a new lower bound on the likelihood of a diffusion model.\nThe lower bound subsumes continuous-time flows &amp; score-based models (with certain loss weighting) as special cases, explaining the success of reverse SDE and equiv ODE proposed in \nhttps://t.co/x6sWhII3Z5', 'Marginalization: Consider a generative SDE: dX = μdt+σdBt, with X0~N(0,1)\nUsing the Feynman-Kac formula, we show that the marginal density of Xt can be expressed as an expectation. \n\nThis can be seen as a mixture of continuous-time flow. https://t.co/S8Pr3kxcMj', 'Lower bounding: Using your favorite Jensen’s inequality + Girsanov theorem, we introduce an inference SDE and lower bound the likelihood. \n\n(It’s the same procedure as deriving the ELBO for a VAE; all the technicality is to deal with an infinite-dim latent space.) https://t.co/Blom3o4XNW', 'Consistency: We show that this continuous-time (CT) ELBO is consistent with the traditional variational framework. Let 𝓔L denote the ELBO of the discretized diffusion model. We show that 𝓔L-&gt;𝓔∞. This means maximizing CT ELBO is equivalent to training an infinitely-deep VAE. https://t.co/lkQgF8PFJd', 'Score matching: Finally, we show that if we reparameterize our generative &amp; inference SDEs as \ndX = (g^2s - f)dt + gdB and dY= fdt + gdB, then the CT-ELBO boils down to score-matching loss after rearrangement. https://t.co/8EWmqXJnPu', 'A continuum of ELBOs: More? We show that this procedure can be used to derive an ELBO of a family of “plug-in reverse” SDEs, including the reverse SDE &amp; equiv ODE used in Song et al. as special cases λ=0 &amp; λ=1 --- min score-matching loss = max ELBO of the entire family. https://t.co/fRdX1DrXBh', 'Concurrently to us, @YSongStanford &amp; @conormdurkan also recently arXived their paper on the same topic. Check out their impressive empirical result that complements ours!\nhttps://t.co/2NkTlTWech\n\nHere’s a list of diff in the main technical contribs. https://t.co/bdtOQXmT7c']",https://arxiv.org/abs/2106.02808,"Discrete-time diffusion-based generative models and score matching methods have shown promising results in modeling high-dimensional image data. Recently, Song et al. (2021) show that diffusion processes that transform data into noise can be reversed via learning the score function, i.e. the gradient of the log-density of the perturbed data. They propose to plug the learned score function into an inverse formula to define a generative diffusion process. Despite the empirical success, a theoretical underpinning of this procedure is still lacking. In this work, we approach the (continuous-time) generative diffusion directly and derive a variational framework for likelihood estimation, which includes continuous-time normalizing flows as a special case, and can be seen as an infinitely deep variational autoencoder. Under this framework, we show that minimizing the score-matching loss is equivalent to maximizing a lower bound of the likelihood of the plug-in reverse SDE proposed by Song et al. (2021), bridging the theoretical gap. ","A Variational Perspective on Diffusion-Based Generative Models and Score
  Matching"
149,1402241733262458891,1024678848422653952,Stef Czischek,['State-of-the-art tensor network simulations based on #PastaQ @ITensorLib capture measurement-induced entanglement phase transitions in hybrid circuits with trapped ion native gates\n\nCheck out our new paper <LINK> \nWith @giactorlai @muniasr Rajibul Islam @rgmelko <LINK>'],https://arxiv.org/abs/2106.03769,"The rise of programmable quantum devices has motivated the exploration of circuit models which could realize novel physics. A promising candidate is a class of hybrid circuits, where entangling unitary dynamics compete with disentangling measurements. Novel phase transitions between different entanglement regimes have been identified in their dynamical states, with universal properties hinting at unexplored critical phenomena. Trapped ion hardware is a leading contender for the experimental realization of such physics, which requires not only traditional two-qubit entangling gates, but a constant rate of local measurements accurately addressed throughout the circuit. Recent progress in engineering high-precision optical addressing of individual ions makes preparing a constant rate of measurements throughout a unitary circuit feasible. Using tensor network simulations, we show that the resulting class of hybrid circuits, prepared with native gates, exhibits a volume-law to area-law transition in the entanglement entropy. This displays universal hallmarks of a measurement-induced phase transition. Our simulations are able to characterize the critical exponents using circuit sizes with tens of qubits and thousands of gates. We argue that this transition should be robust against additional sources of experimental noise expected in modern trapped ion hardware, and will rather be limited by statistical requirements on post selection. Our work highlights the powerful role that tensor network simulations can play in advancing the theoretical and experimental frontiers of critical phenomena. ","Simulating a measurement-induced phase transition for trapped ion
  circuits"
150,1402240883261689857,859294200,Eric Malmi,"['📝New #ACL2021NLP Paper📝\nPaper: <LINK>\nData: <LINK>\n\nOn the benefits of large LMs: We find that grammatical error correction (GEC) performance depends frustratingly(?) heavily on model size. More below👇 <LINK>', 'Our synthetically pre-trained 11B-param T5 model yields new SOTA for English, German, Russian, and Czech GEC. \n\nSince the model is costly and impractical to run, we use it to create a cleaned version of the popular Lang-8 corpus to distill the model to smaller ones.', ""I view Grammatical Error Correction as a great example of beneficial applications of large LMs:\n1. GEC can level the playing field between native and non-native speakers.\n2. GEC models don't try to generate new content but only to fix grammatical errors""]",https://arxiv.org/abs/2106.03830,"This paper presents a simple recipe to train state-of-the-art multilingual Grammatical Error Correction (GEC) models. We achieve this by first proposing a language-agnostic method to generate a large number of synthetic examples. The second ingredient is to use large-scale multilingual language models (up to 11B parameters). Once fine-tuned on language-specific supervised sets we surpass the previous state-of-the-art results on GEC benchmarks in four languages: English, Czech, German and Russian. Having established a new set of baselines for GEC, we make our results easily reproducible and accessible by releasing a cLang-8 dataset. It is produced by using our best model, which we call gT5, to clean the targets of a widely used yet noisy lang-8 dataset. cLang-8 greatly simplifies typical GEC training pipelines composed of multiple fine-tuning stages -- we demonstrate that performing a single fine-tuning step on cLang-8 with the off-the-shelf language models yields further accuracy improvements over an already top-performing gT5 model for English. ",A Simple Recipe for Multilingual Grammatical Error Correction
151,1402184147762925569,481539448,Richard Alexander,"['New paper, led by Alison Young, with @bec_nealon, @cwalshastrochem, @Alice_Centauri, and Christophe Pinte. Alison used hydrodynamics, chemistry, and radiative transfer models, to investigate how chemical changes can trace warps in planet-forming discs.\n\n<LINK>', 'Protoplanetary discs (unlike discs around black holes or compact objects) are mainly heated by light from the star. So when a disc becomes warped, the misaligned (inner) part casts shadows that change the (outer) disc temperature - the disc has a ""hot side"" and a ""cold side"". https://t.co/pt7rVGNeWW', 'These azimuthal temperature variations affect the disc chemistry, and Alison showed that they cause variations in the chemical abundances. The chemistry therefore traces the warped disc structure - the dominant molecules differ on the ""bright side"" vs the ""dark side"". https://t.co/OFHafebw5n', 'These abundance and temperature variations are then observable in line emission, and we expect to see clear asymmetries in the emission maps made with ALMA. This gives us a new way to probe the structure of planet-forming discs.😀 https://t.co/8rXyUoL01S', 'This is just a quick summary of a huge amount of work though, and there is *way* more in the paper than I can cover in a few tweets. So click through for all the details:\nhttps://t.co/4E2q7qqSNh']",https://arxiv.org/abs/2106.02660,"Circumstellar discs may become warped or broken into distinct planes if there is a stellar or planetary companion with an orbit that is misaligned with respect to the disc. There is mounting observational evidence for protoplanetary discs with misaligned inner discs and warps that may be caused by such interactions with a previously undetected companion, giving us a tantalising indication of possible planets forming there. Hydrodynamical and radiative transfer models indicate that the temperature varies azimuthally in warped discs due to the variable angle at which the disc surface faces the star and this impacts the disc chemistry. We perform chemical modelling based on a hydrodynamical model of a protoplanetary disc with an embedded planet orbiting at a 12$^{\circ}$ inclination to the disc. Even for this small misalignment, abundances of species including CO and HCO$^+$ vary azimuthally and this results in detectable azimuthal variations in submillimetre line emission. Azimuthal variations in line emission may therefore indicate the presence of an unseen embedded companion. Nonaxisymmetric chemical abundances should be considered when interpreting molecular line maps of warped or shadowed protoplanetary discs. ",Chemical signatures of a warped protoplanetary disc
152,1402171755129622530,1369326436864102401,Marlin Schäfer,"[""I'm happy to share that today our new paper in collaboration with the Uni Jena appeared on arXiv! We tested how training networks differently influences their GW detection capability and found an interesting improvement to the basic architecture.\n<LINK>""]",https://arxiv.org/abs/2106.03741,"Compact binary systems emit gravitational radiation which is potentially detectable by current Earth bound detectors. Extracting these signals from the instruments' background noise is a complex problem and the computational cost of most current searches depends on the complexity of the source model. Deep learning may be capable of finding signals where current algorithms hit computational limits. Here we restrict our analysis to signals from non-spinning binary black holes and systematically test different strategies by which training data is presented to the networks. To assess the impact of the training strategies, we re-analyze the first published networks and directly compare them to an equivalent matched-filter search. We find that the deep learning algorithms can generalize low signal-to-noise ratio (SNR) signals to high SNR ones but not vice versa. As such, it is not beneficial to provide high SNR signals during training, and fastest convergence is achieved when low SNR samples are provided early on. During testing we found that the networks are sometimes unable to recover any signals when a false alarm probability $<10^{-3}$ is required. We resolve this restriction by applying a modification we call unbounded Softmax replacement (USR) after training. With this alteration we find that the machine learning search retains $\geq 91.5\%$ of the sensitivity of the matched-filter search down to a false-alarm rate of 1 per month. ",Training Strategies for Deep Learning Gravitational-Wave Searches
153,1402138605955526658,191413731,Wil van der Aalst,"['New paper (accepted for FI) with surprising new results for free-choice nets, e.g., free-choice nets with home clusters are lucent even when they are not well-formed! More general and without using the standard #PetriNet machinery, see <LINK>. #weekendprojects <LINK>']",https://arxiv.org/abs/2106.03554,"A marked Petri net is lucent if there are no two different reachable markings enabling the same set of transitions, i.e., states are fully characterized by the transitions they enable. Characterizing the class of systems that are lucent is a foundational and also challenging question. However, little research has been done on the topic. In this paper, it is shown that all free-choice nets having a home cluster are lucent. These nets have a so-called home marking such that it is always possible to reach this marking again. Such a home marking can serve as a regeneration point or as an end-point. The result is highly relevant because in many applications, we want the system to be lucent and many well-behaved process models fall into the class identified in this paper. Unlike previous work, we do not require the marked Petri net to be live and strongly connected. Most of the analysis techniques for free-choice nets are tailored towards well-formed nets. The approach presented in this paper provides a novel perspective enabling new analysis techniques for free-choice nets that do not need to be well-formed. Therefore, we can also model systems and processes that are terminating and/or have an initialization phase. ",Free-Choice Nets With Home Clusters Are Lucent
154,1402110089801179139,110103071,Andrej Risteski,"['New paper with new student @_Yuchen_Li_ , at ACL\'21: \n<LINK> \nRecent approaches to incorporating syntax in neural architectures are often based on learning a syntactic distance which can be used to ""greedily"" build up a parse tree. (e.g. PRPN, ON-LSTM, ...)', 'In this paper, we explore how much their representational power is affected by the amount of ""context"" they are allowed. The context for calculating the syntactic distance at a given position is the surrounding window that the model is allowed to consider to calculate it.', 'We show that if the context is limited in either direction (i.e. possibly infinite window in one direction, finite in the other), the model can be ""arbitrarily wrong"". To formalize this, we consider as a sandbox the setting of PCFGs.', 'We show that for any particular bound on the context, there exists a PCFG, s.t. the probability (under the sentences generated from grammar) that any syntactic distance induces the maximum likelihood parse is arbitrarily low.', 'The hard instances formalize the intuition (e.g. in English) that often to disambiguate the correct parse we need to read-ahead a lot (possibly see the entire sentence). https://t.co/I2GuSAPczv', 'This formalizes a conjecture by @phu_pmh  @sleepinyourhat  @kchonyc in https://t.co/B5tgWx7DIf that unidirectional models may struggle with capturing complex syntactic relationships. [P.S. results in the paper also for transition-based approaches ala https://t.co/4OYGkRytws]']",https://arxiv.org/abs/2106.01580,"Incorporating syntax into neural approaches in NLP has a multitude of practical and scientific benefits. For instance, a language model that is syntax-aware is likely to be able to produce better samples; even a discriminative model like BERT with a syntax module could be used for core NLP tasks like unsupervised syntactic parsing. Rapid progress in recent years was arguably spurred on by the empirical success of the Parsing-Reading-Predict architecture of (Shen et al., 2018a), later simplified by the Order Neuron LSTM of (Shen et al., 2019). Most notably, this is the first time neural approaches were able to successfully perform unsupervised syntactic parsing (evaluated by various metrics like F-1 score). However, even heuristic (much less fully mathematical) understanding of why and when these architectures work is lagging severely behind. In this work, we answer representational questions raised by the architectures in (Shen et al., 2018a, 2019), as well as some transition-based syntax-aware language models (Dyer et al., 2016): what kind of syntactic structure can current neural approaches to syntax represent? Concretely, we ground this question in the sandbox of probabilistic context-free-grammars (PCFGs), and identify a key aspect of the representational power of these approaches: the amount and directionality of context that the predictor has access to when forced to make parsing decision. We show that with limited context (either bounded, or unidirectional), there are PCFGs, for which these approaches cannot represent the max-likelihood parse; conversely, if the context is unlimited, they can represent the max-likelihood parse of any PCFG. ",The Limitations of Limited Context for Constituency Parsing
155,1402099463922106370,1206262662562242560,Yixuan Wang,"['Our new paper addressing the controller design and verification is now available at <LINK>. By integrating the verification in a closed-loop manner, i.e. design-while-verify, the synthesized controller is formally guaranteed to be reach-avoid.']",https://arxiv.org/abs/2106.03245,"In the current control design of safety-critical autonomous systems, formal verification techniques are typically applied after the controller is designed to evaluate whether the required properties (e.g., safety) are satisfied. However, due to the increasing system complexity and the fundamental hardness of designing a controller with formal guarantees, such an open-loop process of design-then-verify often results in many iterations and fails to provide the necessary guarantees. In this paper, we propose a correct-by-construction control learning framework that integrates the verification into the control design process in a closed-loop manner, i.e., design-while-verify. Specifically, we leverage the verification results (computed reachable set of the system state) to construct feedback metrics for control learning, which measure how likely the current design of control parameters can meet the required reach-avoid property for safety and goal-reaching. We formulate an optimization problem based on such metrics for tuning the controller parameters, and develop an approximated gradient descent algorithm with a difference method to solve the optimization problem and learn the controller. The learned controller is formally guaranteed to meet the required reach-avoid property. By treating verifiability as a first-class objective and effectively leveraging the verification results during the control learning process, our approach can significantly improve the chance of finding a control design with formal property guarantees. This is demonstrated via a set of experiments on both linear and non-linear systems that use model-based or neural network based controllers. ","Verification in the Loop: Correct-by-Construction Control Learning with
  Reach-avoid Guarantees"
