,TweetID,AuthorID,AuthorName,Tweets,arxiv_link,Abstract,Title
17,910554878946054144,51700215,Phil Bull,['New paper: MeerKLASS survey will be a vital bridge between nascent radio + established optical cosmo communities  <LINK>'],https://arxiv.org/abs/1709.06099,"We discuss the ground-breaking science that will be possible with a wide area survey, using the MeerKAT telescope, known as MeerKLASS (MeerKAT Large Area Synoptic Survey). The current specifications of MeerKAT make it a great fit for science applications that require large survey speeds but not necessarily high angular resolutions. In particular, for cosmology, a large survey over $\sim 4,000 \, {\rm deg}^2$ for $\sim 4,000$ hours will potentially provide the first ever measurements of the baryon acoustic oscillations using the 21cm intensity mapping technique, with enough accuracy to impose constraints on the nature of dark energy. The combination with multi-wavelength data will give unique additional information, such as exquisite constraints on primordial non-Gaussianity using the multi-tracer technique, as well as a better handle on foregrounds and systematics. Such a wide survey with MeerKAT is also a great match for HI galaxy studies, providing unrivalled statistics in the pre-SKA era for galaxies resolved in the HI emission line beyond local structures at z > 0.01. It will also produce a large continuum galaxy sample down to a depth of about 5\,$\mu$Jy in L-band, which is quite unique over such large areas and will allow studies of the large-scale structure of the Universe out to high redshifts, complementing the galaxy HI survey to form a transformational multi-wavelength approach to study galaxy dynamics and evolution. Finally, the same survey will supply unique information for a range of other science applications, including a large statistical investigation of galaxy clusters as well as produce a rotation measure map across a huge swathe of the sky. The MeerKLASS survey will be a crucial step on the road to using SKA1-MID for cosmological applications and other commensal surveys, as described in the top priority SKA key science projects (abridged). ",MeerKLASS: MeerKAT Large Area Synoptic Survey
18,910551380128972801,167137258,Shoumik Palkar,['The Weld paper is now on Arxiv: <LINK>\nNew interfaces for data intensive applications can give order of magnitude speedups!'],https://arxiv.org/abs/1709.06416,"Data analytics applications combine multiple functions from different libraries and frameworks. Even when each function is optimized in isolation, the performance of the combined application can be an order of magnitude below hardware limits due to extensive data movement across these functions. To address this problem, we propose Weld, a new interface between data-intensive libraries that can optimize across disjoint libraries and functions. Weld exposes a lazily-evaluated API where diverse functions can submit their computations in a simple but general intermediate representation that captures their data-parallel structure. It then optimizes data movement across these functions and emits efficient code for diverse hardware. Weld can be integrated into existing frameworks such as Spark, TensorFlow, Pandas and NumPy without changing their user-facing APIs. We demonstrate that Weld can speed up applications using these frameworks by up to 29x. ",Weld: Rethinking the Interface Between Data-Intensive Applications
19,910548977745039360,3079023467,Dr. Emma Beasor,['Our new paper on the initial masses of the Red Supergiant progenitors to Type IIP SN <LINK>'],https://arxiv.org/abs/1709.06116,"There are a growing number of nearby SNe for which the progenitor star is detected in archival pre-explosion imaging. From these images it is possible to measure the progenitor's brightness a few years before explosion, and ultimately estimate its initial mass. Previous work has shown that II-P and II-L supernovae (SNe) have Red Supergiant (RSG) progenitors, and that the range of initial masses for these progenitors seems to be limited to $<$17M$_\odot$. This is in contrast with the cutoff of 25-30M$_\odot$ predicted by evolutionary models, a result which is termed the 'Red Supergiant Problem'. Here we investigate one particular source of systematic error present in converting pre-explosion photometry into an initial mass, that of the bolometric correction (BC) used to convert a single-band flux into a bolometric luminosity. We show, using star clusters, that RSGs evolve to later spectral types as they approach SN, which in turn causes the BC to become larger. Failure to account for this results in a systematic underestimate of a star's luminosity, and hence its initial mass. Using our empirically motivated BCs we reappraise the II-P and II-L SNe that have their progenitors detected in pre-explosion imaging. Fitting an initial mass function to these updated masses results in an increased upper mass cutoff of $M_{\rm hi}$=$19.0^{+2.5}_{-1.3}$M$_\odot$, with a 95% upper confidence limit of $<$27M$_\odot$. Accounting for finite sample size effects and systematic uncertainties in the mass-luminosity relationship raises the cutoff to $M_{\rm hi}$=25M$_\odot$ ($<$33M$_\odot$, 95% confidence). We therefore conclude that there is currently no strong evidence for `missing' high mass progenitors to core-collapse SNe. ","The Initial Masses of the Red Supergiant Progenitors to Type-II
  Supernovae"
20,910319860449648642,858881333052952576,Sungjoon,['Our recent paper about new sparse deep Q-learning is on <LINK> with full theoretical analysis! <LINK>'],https://arxiv.org/abs/1709.06293,"In this paper, a sparse Markov decision process (MDP) with novel causal sparse Tsallis entropy regularization is proposed.The proposed policy regularization induces a sparse and multi-modal optimal policy distribution of a sparse MDP. The full mathematical analysis of the proposed sparse MDP is provided.We first analyze the optimality condition of a sparse MDP. Then, we propose a sparse value iteration method which solves a sparse MDP and then prove the convergence and optimality of sparse value iteration using the Banach fixed point theorem. The proposed sparse MDP is compared to soft MDPs which utilize causal entropy regularization. We show that the performance error of a sparse MDP has a constant bound, while the error of a soft MDP increases logarithmically with respect to the number of actions, where this performance error is caused by the introduced regularization term. In experiments, we apply sparse MDPs to reinforcement learning problems. The proposed method outperforms existing methods in terms of the convergence speed and performance. ","Sparse Markov Decision Processes with Causal Sparse Tsallis Entropy
  Regularization for Reinforcement Learning"
21,910314713363365888,307826617,Kev Abazajian ⤷⏳🌎,['Where γ-ray blazar variability meets plasma astrophysics &amp; wakefield acceleration. New paper. <LINK>'],https://arxiv.org/abs/1709.06535,"Gamma-ray observations have revealed strong variability in blazar luminosities in the gamma-ray band over time scales as short as minutes. We show, for the first time, that the correlation of the spectrum with intensity is consistent with the behavior of the luminosity variation of blazar SEDs along a blazar sequence for low synchrotron peak blazars. We show that the observational signatures of variability with flux are consistent with wakefield acceleration of electrons initiated by instabilities in the blazar accretion disk. This mechanism reproduces the observed time variations as short as 100 seconds. The wakefield mechanism also predicts a reduction of the electron spectral index with increased gamma-ray luminosity, which could be detected in higher energy observations well above the inverse Compton peak. ","Observational Signatures of Gamma Rays from Bright Blazars and Wakefield
  Theory"
22,910187789634932736,12184622,Joshua Shaevitz,['Bacteria use active matter physics to aggregate when starved. Check out our new paper! <LINK> w/ @stpalli @cris_marchetti_'],http://arxiv.org/abs/1709.06012,"Combining high-resolution single cell tracking experiments with numerical simulations, we show that starvation-induced fruiting body (FB) formation in Myxococcus xanthus is a phase separation driven by cells that tune their motility over time. The phase separation can be understood in terms of cell density and a dimensionless Peclet number that captures cell motility through speed and reversal frequency. Our work suggests that M. xanthus take advantage of a self-driven non-equilibrium phase transition that can be controlled at the single cell level. ","A self-driven phase transition drives Myxococcus xanthus fruiting body
  formation"
23,910140684631511040,21820958,Michele Bannister,['For the morning folks: I talk about our new paper on this discovery in a distant Neptune resonance <LINK> <LINK>'],https://arxiv.org/abs/1709.05427,"We report the discovery of a $H_r = 3.4\pm0.1$ dwarf planet candidate by the Pan-STARRS Outer Solar System Survey. 2010 JO$_{179}$ is red with $(g-r)=0.88 \pm 0.21$, roughly round, and slowly rotating, with a period of $30.6$ hr. Estimates of its albedo imply a diameter of 600--900~km. Observations sampling the span between 2005--2016 provide an exceptionally well-determined orbit for 2010 JO$_{179}$, with a semi-major axis of $78.307\pm0.009$ au, distant orbits known to this precision are rare. We find that 2010 JO$_{179}$ librates securely within the 21:5 mean-motion resonance with Neptune on hundred-megayear time scales, joining the small but growing set of known distant dwarf planets on metastable resonant orbits. These imply a substantial trans-Neptunian population that shifts between stability in high-order resonances, the detached population, and the eroding population of the scattering disk. ",A dwarf planet class object in the 21:5 resonance with Neptune
24,910114375029215232,3317397493,Kelsey B. Hatzell,['New archived paper out - highlighting key mechanisms to electrochemical separation processes <LINK>'],https://arxiv.org/abs/1709.05925,"Over the past decade, capacitive deionization (CDI) has realized a surge in attention in the field of water desalination and can now be considered as an important technology class, along with reverse osmosis and electrodialysis. While many of the recently developed technologies no longer use a mechanism that follows the strict definition of the term ""capacitive"", these methods nevertheless share many common elements that encourage treating them with similar metrics and analyses. Specifically, they all involve electrically driven removal of ions from a feed stream, storage in an electrode (i.e., ion electrosorption) and release, in charge/discharge cycles. Grouping all these methods in the technology class of CDI makes it possible to treat evolving new technologies in standardized terms and compare them to other technologies in the same class. ",Capacitive Deionization -- defining a class of desalination technologies
25,909940244144955393,2377407248,Daniel Whiteson,['Fun new paper with @KyleCranmer <LINK>'],https://arxiv.org/abs/1709.05681,"We describe a procedure for constructing a model of a smooth data spectrum using Gaussian processes rather than the historical parametric description. This approach considers a fuller space of possible functions, is robust at increasing luminosity, and allows us to incorporate our understanding of the underlying physics. We demonstrate the application of this approach to modeling the background to searches for dijet resonances at the Large Hadron Collider and describe how the approach can be used in the search for generic localized signals. ","Modeling Smooth Backgrounds and Generic Localized Signals with Gaussian
  Processes"
26,909806724596473859,742149925,David Meyer,"['New paper w/Allen &amp; Bucicovschi, Entanglement Constraints on States Locally Connected to the GHZ State\n<LINK>']",https://arxiv.org/abs/1709.05004,"The multi-qubit GHZ state possesses tangles with elegant transformation properties under stochastic local operations and classical communication. Since almost all pure 3-qubit states are connected to the GHZ state via SLOCC, we derive a necessary and sufficient achievability inequality on arbitrary 3-qubit tangles, which is a strictly stronger constraint than both the monogamy inequality and the marginal eigenvalue inequality. We then show that entanglement shared with any single party in the n-qubit GHZ SLOCC equivalence class is precisely accounted for by the sum of its k-tangles, recently coined the strong monogamy equality, acknowledging competing but agreeing definitions of the k-tangle on this class, one of which is then computable for arbitrary mixed states. Strong monogamy is known to not hold arbitrarily, and so we introduce a unifying outlook on entanglement constraints in light of basic real algebraic geometry. ","Entanglement Constraints on States Locally Connected to the
  Greenberger-Horne-Zeilinger State"
27,909789293178171397,62604839,Paulo Simões,"['Our new paper, led by @EoinCarley, is out! We estimated the magnetic field of a CME using radio data <LINK>']",https://arxiv.org/abs/1709.05184,"Coronal mass ejections (CMEs) are large eruptions of plasma and magnetic field from the low solar corona into interplanetary space. These eruptions are often associated with the acceleration of energetic electrons which produce various sources of high intensity plasma emission. In relatively rare cases, the energetic electrons may also produce gyrosynchrotron emission from within the CME itself, allowing for a diagnostic of the CME magnetic field strength. Such a magnetic field diagnostic is important for evaluating the total magnetic energy content of the CME, which is ultimately what drives the eruption. Here we report on an unusually large source of gyrosynchrotron radiation in the form of a type IV radio burst associated with a CME occurring on 2014-September-01, observed using instrumentation from the Nan\c{c}ay Radio Astronomy Facility. A combination of spectral flux density measurements from the Nan\c{c}ay instruments and the Radio Solar Telescope Network (RSTN) from 300MHz to 5 GHz reveals a gyrosynchrotron spectrum with a peak flux density at $>$1 GHz. Using this radio analysis, a model for gyrosynchrotron radiation, a non-thermal electron density diagnostic using the Fermi Gamma Ray Burst Monitor (GBM) and images of the eruption from the GOES Soft X-ray Imager (SXI), we are able to calculate both the magnetic field strength and the properties of the X-ray and radio emitting energetic electrons within the CME. We find the radio emission is produced by non-thermal electrons of energies >1MeV with a spectral index of $\delta$$\sim$3 in a CME magnetic field of 4.4 G at a height of 1.3 R$_{\odot}$, while the X-ray emission is produced from a similar distribution of electrons but with much lower energies on the order of 10 keV. We conclude by comparing X-ray and radio-emitting electron distributions and how such an analysis can be used to define the plasma properties of a CME. ","Estimation of a Coronal Mass Ejection Magnetic Field Strength using
  Radio Observations of Gyrosynchrotron Radiation"
28,909775150144397312,15520108,Rudi Podgornik 岳儒迪,['Our new paper on the spontaneous symmetry breaking of charge-regulated surfaces. Another stab at the PB theory.\n\n <LINK>'],https://arxiv.org/abs/1709.05005,"The interaction between two chemically identical charge-regulated surfaces is studied using the classical density functional theory. In contrast to common expectations and assumptions, under certain realistic conditions we find a spontaneous emergence of disparate charge densities on the two surfaces. The surface charge densities can differ not only in their magnitude, but quite unexpectedly, even in their sign, implying that the electrostatic interaction between the two chemically identical surfaces can be attractive instead of repulsive. Moreover, an initial symmetry with equal charge densities on both surfaces can also be broken spontaneously upon decreasing the separation between the two surfaces. The origin of this phenomenon is a competition between the adsorption of ions from the solution to the surface and the interaction between the adsorbed ions already on the surface.These findings are fundamental for the understanding of the forces between colloidal objects and, in particular, they are bound to strongly influence the present picture of protein interaction. ",Spontaneous symmetry breaking of charge-regulated surfaces
29,909770747018485760,33113669,Tim Baldwin,['New paper on memory-enhanced CRFs: <LINK> w/ Felix Liu and Trevor Cohn #ijcnlp2017 #nlproc'],https://arxiv.org/abs/1709.03637,"Despite successful applications across a broad range of NLP tasks, conditional random fields (""CRFs""), in particular the linear-chain variant, are only able to model local features. While this has important benefits in terms of inference tractability, it limits the ability of the model to capture long-range dependencies between items. Attempts to extend CRFs to capture long-range dependencies have largely come at the cost of computational complexity and approximate inference. In this work, we propose an extension to CRFs by integrating external memory, taking inspiration from memory networks, thereby allowing CRFs to incorporate information far beyond neighbouring steps. Experiments across two tasks show substantial improvements over strong CRF and LSTM baselines. ","Capturing Long-range Contextual Dependencies with Memory-enhanced
  Conditional Random Fields"
30,908771014175313920,3405760034,Subhash Kak ☀️,['Let A &gt; B and C &gt; D then  A+C &gt; B+D.  Not always. WHY?  And has implications for reasoning. A new paper on this: <LINK>'],https://arxiv.org/abs/1709.04029,"Data based judgments go into artificial intelligence applications but they undergo paradoxical reversal when seemingly unnecessary additional data is provided. Examples of this are Simpson's reversal and the disjunction effect where the beliefs about the data change once it is presented or aggregated differently. Sometimes the significance of the difference can be evaluated using statistical tests such as Pearson's chi-squared or Fisher's exact test, but this may not be helpful in threshold-based decision systems that operate with incomplete information. To mitigate risks in the use of algorithms in decision-making, we consider the question of modeling of beliefs. We argue that evidence supports that beliefs are not classical statistical variables and they should, in the general case, be considered as superposition states of disjoint or polar outcomes. We analyze the disjunction effect from the perspective of the belief as a quantum vector. ",Probability Reversal and the Disjunction Effect in Reasoning Systems
31,908672672082644993,3816413361,Andrei Popescu-Belis,['New paper from our group on modulating attention to use wider context in neural MT <LINK> L.Miculicich @nik0spapp D.Ram'],https://arxiv.org/abs/1709.04849,"Neural sequence-to-sequence networks with attention have achieved remarkable performance for machine translation. One of the reasons for their effectiveness is their ability to capture relevant source-side contextual information at each time-step prediction through an attention mechanism. However, the target-side context is solely based on the sequence model which, in practice, is prone to a recency bias and lacks the ability to capture effectively non-sequential dependencies among words. To address this limitation, we propose a target-side-attentive residual recurrent network for decoding, where attention over previous words contributes directly to the prediction of the next word. The residual learning facilitates the flow of information from the distant past and is able to emphasize any of the previously translated words, hence it gains access to a wider context. The proposed model outperforms a neural MT baseline as well as a memory and self-attention network on three language pairs. The analysis of the attention learned by the decoder confirms that it emphasizes a wider context, and that it captures syntactic-like structures. ",Self-Attentive Residual Decoder for Neural Machine Translation
32,908541691120021504,289876736,Ali Pesaranghader,['My new paper on arXiv <LINK>\n#MachineLearning #DataStreamMining'],https://arxiv.org/abs/1709.02457,"The last decade has seen a surge of interest in adaptive learning algorithms for data stream classification, with applications ranging from predicting ozone level peaks, learning stock market indicators, to detecting computer security violations. In addition, a number of methods have been developed to detect concept drifts in these streams. Consider a scenario where we have a number of classifiers with diverse learning styles and different drift detectors. Intuitively, the current 'best' (classifier, detector) pair is application dependent and may change as a result of the stream evolution. Our research builds on this observation. We introduce the $\mbox{Tornado}$ framework that implements a reservoir of diverse classifiers, together with a variety of drift detection algorithms. In our framework, all (classifier, detector) pairs proceed, in parallel, to construct models against the evolving data streams. At any point in time, we select the pair which currently yields the best performance. We further incorporate two novel stacking-based drift detection methods, namely the $\mbox{FHDDMS}$ and $\mbox{FHDDMS}_{add}$ approaches. The experimental evaluation confirms that the current 'best' (classifier, detector) pair is not only heavily dependent on the characteristics of the stream, but also that this selection evolves as the stream flows. Further, our $\mbox{FHDDMS}$ variants detect concept drifts accurately in a timely fashion while outperforming the state-of-the-art. ","Reservoir of Diverse Adaptive Learners and Stacking Fast Hoeffding Drift
  Detection Methods for Evolving Data Streams"
33,908450907062497282,2862277847,Mark G. Bason,['Do physicists stop searches too early? The truth will astound you:\n<LINK> (our new paper) @aqsd_sussex'],https://arxiv.org/abs/1709.02230,"We introduce a novel remote interface to control and optimize the experimental production of Bose-Einstein condensates (BECs) and find improved solutions using two distinct implementations. First, a team of theoreticians employed a Remote version of their dCRAB optimization algorithm (RedCRAB), and second a gamified interface allowed 600 citizen scientists from around the world to participate in real-time optimization. Quantitative studies of player search behavior demonstrated that they collectively engage in a combination of local and global search. This form of adaptive search prevents premature convergence by the explorative behavior of low-performing players while high-performing players locally refine their solutions. In addition, many successful citizen science games have relied on a problem representation that directly engaged the visual or experiential intuition of the players. Here we demonstrate that citizen scientists can also be successful in an entirely abstract problem visualization. This gives encouragement that a much wider range of challenges could potentially be open to gamification in the future. ","Remote optimization of an ultra-cold atoms experiment by experts and
  citizen scientists"
34,908414106381647872,199688728,Sheldon Campbell,"['New paper today, analyzing the Galactic isotropic component of @NASAFermi-LAT gamma rays, w #darkmatter search. <LINK> 1/6', '@NASAFermi A dark matter signal from our Galactic halo is isotropic about Galactic center. But brightest gammas are from Galactic plane and points. 2/6 https://t.co/pJsHOQls6u', ""@NASAFermi We remove these brightest pixels until what's left is consistent with isotropic, and the galacto-isotropic background reveals itself. 3/6 https://t.co/IFHgkN5igh"", '@NASAFermi We check the data against a gamma-ray emission model previously used to analyze the Galactic center. The model deviated from the data… 4/6 https://t.co/gYMeNE8wDi', '@NASAFermi when over 20 deg from Galactic center, but the galacto-isotropic component is consistent with the model--deviations are from structure! 5/6 https://t.co/1vMrmakqY7', '@NASAFermi With proper understanding of galacto-isotropic profile uncertainty, dark matter constraints should be competitive with dwarf satellites. 6/6']",https://arxiv.org/abs/1709.04014,"We present an analysis of the radial angular profile of the galacto-isotropic (GI) $\gamma$-ray flux--the statistically uniform flux in circular annuli about the Galactic center. Two different approaches are used to measure the GI flux profile in 85 months of Fermi-LAT data: the BDS statistic method which identifies spatial correlations, and a new Poisson ordered-pixel method which identifies non-Poisson contributions. Both methods produce similar GI flux profiles. The GI flux profile is well-described by an existing model of bremsstrahlung, $\pi^0$ production, inverse Compton scattering, and the isotropic background. Discrepancies with data in our full-sky model are not present in the GI component, and are therefore due to mis-modeling of the non-GI emission. Dark matter annihilation constraints based solely on the observed GI profile are close to the thermal WIMP cross section below 100 GeV, for fixed models of the dark matter density profile and astrophysical $\gamma$-ray foregrounds. Refined measurements of the GI profile are expected to improve these constraints by a factor of a few. ","The Galactic Isotropic $\gamma$-ray Background and Implications for Dark
  Matter"
