,TweetID,AuthorID,AuthorName,Tweets,arxiv_link,Abstract,Title
15,899956565045895168,26716739,Mattias Villani,"['New paper with Josef Wilzén, @wandedob. Physiological Gaussian Process Priors for the Hemodynamics in fMRI Analysis <LINK>']",https://arxiv.org/abs/1708.06152,"Background: Inference from fMRI data faces the challenge that the hemodynamic system that relates neural activity to the observed BOLD fMRI signal is unknown. New Method: We propose a new Bayesian model for task fMRI data with the following features: (i) joint estimation of brain activity and the underlying hemodynamics, (ii) the hemodynamics is modeled nonparametrically with a Gaussian process (GP) prior guided by physiological information and (iii) the predicted BOLD is not necessarily generated by a linear time-invariant (LTI) system. We place a GP prior directly on the predicted BOLD response, rather than on the hemodynamic response function as in previous literature. This allows us to incorporate physiological information via the GP prior mean in a flexible way, and simultaneously gives us the nonparametric flexibility of the GP. Results: Results on simulated data show that the proposed model is able to discriminate between active and non-active voxels also when the GP prior deviates from the true hemodynamics. Our model finds time varying dynamics when applied to real fMRI data. Comparison with Existing Method(s): The proposed model is better at detecting activity in simulated data than standard models, without inflating the false positive rate. When applied to real fMRI data, our GP model in several cases finds brain activity where previously proposed LTI models does not. Conclusions: We have proposed a new non-linear model for the hemodynamics in task fMRI, that is able to detect active voxels, and gives the opportunity to ask new kinds of questions related to hemodynamics. ","Physiological Gaussian Process Priors for the Hemodynamics in fMRI
  Analysis"
16,899814904298975232,267958924,Christian Ott,['New paper w grad student Matt Giesler: <LINK> Black-Hole Low-Mass X-Ray Binaries f. Globular Clusters. Great work by Matt!'],https://arxiv.org/abs/1708.05915,"Recent studies suggest that globular clusters (GCs) may retain a substantial population of stellar-mass black holes (BHs), in contrast to the long-held belief of a few to zero BHs. We model the population of BH low-mass X-ray binaries (BH-LMXBs), an ideal observable proxy for elusive single BHs, produced from a representative group of Milky Way GCs with variable BH populations. We simulate the formation of BH-binaries in GCs through exchange interactions between binary and single stars in the company of tens to hundreds of BHs. Additionally, we consider the impact of the BH population on the rate of compact binaries undergoing gravitational wave driven mergers. The characteristics of the BH-LMXB population and binary properties are sensitive to the GCs structural parameters as well as its unobservable BH population. We find that GCs retaining $\sim 1000$ BHs produce a galactic population of $\sim 150$ ejected BH-LMXBs whereas GCs retaining only $\sim20$ BHs produce zero ejected BH-LMXBs. Moreover, we explore the possibility that some of the presently known BH-LMXBs might have originated in GCs and identify five candidate systems. ",Low-mass X-ray binaries from black-hole retaining globular clusters
17,899628135733501952,618466970,Damiano Brigo (Prof),['New working paper: An indifference approach to the cost of capital constraints: KVA and beyond. <LINK>'],https://arxiv.org/abs/1708.05319,"The strengthening of capital requirements has induced banks and traders to consider charging a so called capital valuation adjustment (KVA) to the clients in OTC transactions. This roughly corresponds to charge the clients ex-ante the profit requirement that is asked to the trading desk. In the following we try to delineate a possible way to assess the impact of capital constraints in the valuation of a deal. We resort to an optimisation stemming from an indifference pricing approach, and we study both the linear problem from the point of view of the whole bank and the non-linear problem given by the viewpoint of shareholders. We also consider the case where one optimises the median rather than the mean statistics of the profit and loss distribution. ","An indifference approach to the cost of capital constraints: KVA and
  beyond"
18,899628035359600640,61623544,Dr./Prof. Renée Hložek,"['Excited to announce my new paper with @doddy_marsh, Dan Grin on axion isocurvature! Lots of hard work on this one <LINK>']",https://arxiv.org/abs/1708.05681,"The cosmic microwave background (CMB) places strong constraints on models of dark matter (DM) that deviate from standard cold DM (CDM), and on initial conditions beyond the scalar adiabatic mode. Here, the full \textit{Planck} data set (including temperature, $E$-mode polarisation, and lensing deflection) is used to test the possibility that some fraction of the DM is composed of ultralight axions (ULAs). This represents the first use of CMB lensing to test the ULA model. We find no evidence for a ULA component in the mass range $10^{-33}\leq m_a\leq 10^{-24}\text{ eV}$. We put percent-level constraints on the ULA contribution to the DM, improving by up to a factor of two compared to the case with temperature anisotropies alone. Axion DM also provides a low-energy window onto the high-energy physics of inflation through the interplay between the vacuum misalignment production of axions and isocurvature perturbations. We perform the first systematic investigation into the parameter space of ULA isocurvature, using an accurate isocurvature transfer function at all $m_{a}$ values. We precisely identify a ""window of co-existence"" for $10^{-25}\text{ eV}\leq m_a\leq10^{-24}\text{ eV}$ where the data allow, simultaneously, a $\sim10\%$ contribution of ULAs to the DM, and $\sim 1\%$ contributions of isocurvature and tensors to the CMB power. ULAs in this window (and \textit{all} lighter ULAs) are shown to be consistent with a large inflationary Hubble parameter, $H_I\sim 10^{14}\text{ GeV}$. The window of co-existence will be fully probed by proposed CMB-S4 observations with increased accuracy in the high-$\ell$ lensing power and low-$\ell$ $E$ and $B$-mode polarisation. If ULAs in the window exist, this could allow for two independent measurements of $H_I$ in the CMB using the axion DM content and isocurvature, and the tensor contribution to $B$-modes. ","Using the Full Power of the Cosmic Microwave Background to Probe Axion
  Dark Matter"
19,898533551917936640,3301643341,Roger Grosse,"['New paper by Yuhuai Wu &amp; Elman Mansimov combining A2C + K-FAC. 3x sample efficiency, continuous control from pixels. <LINK>']",https://arxiv.org/abs/1708.05144,"In this work, we propose to apply trust region optimization to deep reinforcement learning using a recently proposed Kronecker-factored approximation to the curvature. We extend the framework of natural policy gradient and propose to optimize both the actor and the critic using Kronecker-factored approximate curvature (K-FAC) with trust region; hence we call our method Actor Critic using Kronecker-Factored Trust Region (ACKTR). To the best of our knowledge, this is the first scalable trust region natural gradient method for actor-critic methods. It is also a method that learns non-trivial tasks in continuous control as well as discrete control policies directly from raw pixel inputs. We tested our approach across discrete domains in Atari games as well as continuous domains in the MuJoCo environment. With the proposed methods, we are able to achieve higher rewards and a 2- to 3-fold improvement in sample efficiency on average, compared to previous state-of-the-art on-policy actor-critic methods. Code is available at this https URL ","Scalable trust-region method for deep reinforcement learning using
  Kronecker-factored approximation"
20,898360217557061633,33113669,Tim Baldwin,"['New paper on regression done right for geoloc prediction and dialectology: <LINK> #emnlp2017', ""@jasonbaldridge Interesting idea. We did earlier work on ellipsoid distributions of arbitrary orientation, but didn't get anything out of it empirically"", '@jasonbaldridge @josephreisinger Ah OK, that goes a lot further than what I was thinking. Nice! Will try to get my head around what this would look like in our context.', '@bgmartins @jasonbaldridge @josephreisinger Very cool (generally, as well as specifically for some of the tasks we are playing around with) ... thanks for the pointer!']",https://arxiv.org/abs/1708.04358,"We propose a method for embedding two-dimensional locations in a continuous vector space using a neural network-based model incorporating mixtures of Gaussian distributions, presenting two model variants for text-based geolocation and lexical dialectology. Evaluated over Twitter data, the proposed model outperforms conventional regression-based geolocation and provides a better estimate of uncertainty. We also show the effectiveness of the representation for predicting words from location in lexical dialectology, and evaluate it using the DARE dataset. ","Continuous Representation of Location for Geolocation and Lexical
  Dialectology using Mixture Density Networks"
21,898000268910047233,1439446945,Lav Varshney,"['New paper on coupon-collector model of discovery, inspired by @arbesman <LINK> @CSL_Illinois @ECEILLINOIS @IBMResearch']",https://arxiv.org/abs/1708.03833,"Empirical studies of scientific discovery---so-called Eurekometrics---have indicated that the output of exploration proceeds as a logistic growth curve. Although logistic functions are prevalent in explaining population growth that is resource-limited to a given carrying capacity, their derivation do not apply to discovery processes. This paper develops a generative model for logistic \emph{knowledge discovery} using a novel extension of coupon collection, where an explorer interested in discovering all unknown elements of a set is supported by technology that can respond to queries. This discovery process is parameterized by the novelty and quality of the set of discovered elements at every time step, and randomness is demonstrated to improve performance. Simulation results provide further intuition on the discovery process. ",A Coupon-Collector Model of Machine-Aided Discovery
22,897813871192408064,2799725019,Laura Kreidberg,"['New paper with @AstroCaroline predicts observability of nearby terrestrial worlds with JWST!  <LINK> <LINK>', '@AstroCaroline our planet is lame right now ... hope you enjoy a break thinking about these other ones!']",https://arxiv.org/abs/1708.04239,"Nine transiting Earth-sized planets have recently been discovered around nearby late M dwarfs, including the TRAPPIST-1 planets and two planets discovered by the MEarth survey, GJ 1132b and LHS 1140b. These planets are the smallest known planets that may have atmospheres amenable to detection with JWST. We present model thermal emission and transmission spectra for each planet, varying composition and surface pressure of the atmosphere. We base elemental compositions on those of Earth, Titan, and Venus and calculate the molecular compositions assuming chemical equilibrium, which can strongly depend on temperature. Both thermal emission and transmission spectra are sensitive to the atmospheric composition; thermal emission spectra are sensitive to surface pressure and temperature. We predict the observability of each planet's atmosphere with JWST. GJ 1132b and TRAPPIST-1b are excellent targets for emission spectroscopy with JWST/MIRI, requiring fewer than 10 eclipse observations. Emission photometry for TRAPPIST-1c requires 5-15 eclipses; LHS 1140b and TRAPPIST-1d, TRAPPIST-1e, and TRAPPIST-1f, which could possibly have surface liquid water, may be accessible with photometry. Seven of the nine planets are strong candidates for transmission spectroscopy measurements with JWST, though the number of transits required depends strongly on the planets' actual masses. Using the measured masses, fewer than 20 transits are required for a 5 sigma detection of spectral features for GJ 1132b and six of the TRAPPIST-1 planets. Dedicated campaigns to measure the atmospheres of these nine planets will allow us, for the first time, to probe formation and evolution processes of terrestrial planetary atmospheres beyond our solar system. ","Observing the Atmospheres of Known Temperate Earth-sized Planets with
  JWST"
23,897651025276010496,22399655,Ryota Kanai💡,"['Our new paper on how to learn body affordances by embedding action consequences to low dimensional control space.\n<LINK>', 'The code is available from github.\nhttps://t.co/bLiMh1Ro3e']",https://arxiv.org/abs/1708.04391,"Controlling embodied agents with many actuated degrees of freedom is a challenging task. We propose a method that can discover and interpolate between context dependent high-level actions or body-affordances. These provide an abstract, low-dimensional interface indexing high-dimensional and time- extended action policies. Our method is related to recent ap- proaches in the machine learning literature but is conceptually simpler and easier to implement. More specifically our method requires the choice of a n-dimensional target sensor space that is endowed with a distance metric. The method then learns an also n-dimensional embedding of possibly reactive body-affordances that spread as far as possible throughout the target sensor space. ",Learning body-affordances to simplify action spaces
24,897325233085923328,267958924,Christian Ott,"['New paper: Sperhake+, Long-lived inverse chirp signals from core collapse in massive scalar-tensor gravity -- <LINK>']",https://arxiv.org/abs/1708.03651,This letter considers stellar core collapse in massive scalar--tensor theories of gravity. The presence of a mass term for the scalar field allows for dramatic increases in the radiated gravitational wave signal. There are several potential smoking gun signatures of a departure from general relativity associated with this process. These signatures could show up within existing LIGO--Virgo searches. ,"Long-lived inverse chirp signals from core collapse in massive
  scalar-tensor gravity"
25,895975051299880961,822867138,Bradley Kavanagh,"['""Time-integrated directional detection of dark matter."" My new paper with @cajohare &amp; @ultra_wimp - <LINK> <LINK>']",https://arxiv.org/abs/1708.02959,"The analysis of signals in directional dark matter (DM) detectors typically assumes that the directions of nuclear recoils can be measured in the Galactic rest frame. However, this is not possible with all directional detection technologies. In nuclear emulsions, for example, the recoil events must be detected and measured after the exposure time of the experiment. Unless the entire detector is mounted and rotated with the sidereal day, the recoils cannot be reoriented in the Galactic rest frame. We examine the effect of this `time integration' on the primary goals of directional detection, namely: (1) confirming that the recoils are anisotropic; (2) measuring the median recoil direction to confirm their Galactic origin; and (3) probing below the neutrino floor. We show that after time integration the DM recoil distribution retains a preferred direction and is distinct from that of Solar neutrino-induced recoils. Many of the advantages of directional detection are therefore preserved and it is not crucial to mount and rotate the detector. Rejecting isotropic backgrounds requires a factor of 2 more signal events compared with an experiment with event time information, whereas a factor of 1.5-3 more events are needed to measure a median direction in agreement with the expectation for DM. We also find that there is still effectively no neutrino floor in a time-integrated directional experiment. However to reach a cross section an order of magnitude below the floor, a factor of 8 larger exposure is required than with a conventional directional experiment. We also examine how the sensitivity is affected for detectors with only 2D recoil track readout, and/or no head-tail measurement. As for non-time-integrated experiments, 2D readout is not a major disadvantage, though a lack of head-tail sensitivity is. ",Time-integrated directional detection of dark matter
26,895956327167557632,762420558,Ciaran O'Hare,"['New paper! <LINK>', 'Bit Niche, \nQ: Do I really have to mount a nuclear emulsions dark matter detector on a €255k equatorial telescope?\nA: Not necessarily.']",https://arxiv.org/abs/1708.02959,"The analysis of signals in directional dark matter (DM) detectors typically assumes that the directions of nuclear recoils can be measured in the Galactic rest frame. However, this is not possible with all directional detection technologies. In nuclear emulsions, for example, the recoil events must be detected and measured after the exposure time of the experiment. Unless the entire detector is mounted and rotated with the sidereal day, the recoils cannot be reoriented in the Galactic rest frame. We examine the effect of this `time integration' on the primary goals of directional detection, namely: (1) confirming that the recoils are anisotropic; (2) measuring the median recoil direction to confirm their Galactic origin; and (3) probing below the neutrino floor. We show that after time integration the DM recoil distribution retains a preferred direction and is distinct from that of Solar neutrino-induced recoils. Many of the advantages of directional detection are therefore preserved and it is not crucial to mount and rotate the detector. Rejecting isotropic backgrounds requires a factor of 2 more signal events compared with an experiment with event time information, whereas a factor of 1.5-3 more events are needed to measure a median direction in agreement with the expectation for DM. We also find that there is still effectively no neutrino floor in a time-integrated directional experiment. However to reach a cross section an order of magnitude below the floor, a factor of 8 larger exposure is required than with a conventional directional experiment. We also examine how the sensitivity is affected for detectors with only 2D recoil track readout, and/or no head-tail measurement. As for non-time-integrated experiments, 2D readout is not a major disadvantage, though a lack of head-tail sensitivity is. ",Time-integrated directional detection of dark matter
27,895570194327674880,3869827637,Francesca Vidotto,['New paper out with @Alvise_ on #QuantumGravity affects in the late universe considering #PBH as #DarkMatter! <LINK> #loopy <LINK>'],http://arxiv.org/abs/1708.02588,"It has been recently suggested that small mass black holes (BHs) may become unstable due to quantum-gravitational effects and eventually decay, producing radiation, on a timescale shorter than the Hawking evaporation time. We argue that the existence of a population of low-mass Primordial Black Holes (PBHs) acting as a fraction of the Universe dark matter component can be used to test proposed models of quantum decay of BHs via their effect on galaxy number counts. We study what constraints future galaxy clustering measurements can set on quantum-gravity parameters governing the BH lifetime and PBH abundance. In case of no detection of such effects, this would rule out either the existence of a non-negligible number of small PBHs, or the BH quantum decay scenario (or both). In case of independent observations of PBHs, the observables discussed here could be used to study the quantum effects that modify the final fate of BHs. ","Effects of primordial black holes quantum gravity decay on galaxy
  clustering"
28,895272749438054400,65010804,Hugh Osborn,"['Tau Ceti is one of the closest sunlike stars. A new paper today suggests four super-Earth #exoplanets may orbit it: <LINK> <LINK>', 'Of course, a paper in 2012 announced 5 planets... most of which turned out not to exist. Two (e &amp; f) have survived this new analyses though.', 'The team remove lots of noise to reveal the planetary signals which would, if confirmed, be the lowest-amplitude detections ever with RVs. https://t.co/2oECrOTMm0', 'They also find the planets on orbits far more eccentric than should be possible/expected in a stable solar system.', ""All in all: super interesting work! It's suggestive that Tau Ceti has planets, especially the long-period ones far from stellar rotation."", 'BUT I think more data &amp; analyses is needed before we can call them bona fide, confirmed planets (as the spurious 2012 detections showed).']",https://arxiv.org/abs/1708.02051,"The removal of noise typically correlated in time and wavelength is one of the main challenges for using the radial velocity method to detect Earth analogues. We analyze radial velocity data of tau Ceti and find robust evidence for wavelength dependent noise. We find this noise can be modeled by a combination of moving average models and ""differential radial velocities"". We apply this noise model to various radial velocity data sets for tau Ceti, and find four periodic signals at 20.0, 49.3, 160 and 642 d which we interpret as planets. We identify two new signals with orbital periods of 20.0 and 49.3 d while the other two previously suspected signals around 160 and 600 d are quantified to a higher precision. The 20.0 d candidate is independently detected in KECK data. All planets detected in this work have minimum masses less than 4$M_\oplus$ with the two long period ones located around the inner and outer edges of the habitable zone, respectively. We find that the instrumental noise gives rise to a precision limit of the HARPS around 0.2 m/s. We also find correlation between the HARPS data and the central moments of the spectral line profile at around 0.5 m/s level, although these central moments may contain both noise and signals. The signals detected in this work have semi-amplitudes as low as 0.3 m/s, demonstrating the ability of the radial velocity technique to detect relatively weak signals. ","Color difference makes a difference: four planet candidates around tau
  Ceti"
29,894871361616658432,131879500,John Ilee,"['Our new paper on the chemistry of protoplanetary fragments formed via gravitational instability #astrochemistry\n\n<LINK> <LINK>', 'with @dh4gan @cassidentprone @ExoKenRice et al. (and, of course, the Fab Four)']",http://arxiv.org/abs/1708.01815,"In this paper, we model the chemical evolution of a 0.25 M$_{\odot}$ protoplanetary disc surrounding a 1 M$_{\odot}$ star that undergoes fragmentation due to self-gravity. We use Smoothed Particle Hydrodynamics including a radiative transfer scheme, along with time-dependent chemical evolution code to follow the composition of the disc and resulting fragments over approximately 4000 yrs. Initially, four quasi-stable fragments are formed, of which two are eventually disrupted by tidal torques in the disc. From the results of our chemical modelling, we identify species that are abundant in the fragments (e.g. H$_{\rm 2}$O, H$_{\rm 2}$S, HNO, N$_{\rm 2}$, NH$_{\rm 3}$, OCS, SO), species that are abundant in the spiral shocks within the disc (e.g. CO, CH$_{\rm 4}$, CN, CS, H$_{\rm 2}$CO), and species which are abundant in the circumfragmentary material (e.g. HCO$^{\rm +}$). Our models suggest that in some fragments it is plausible for grains to sediment to the core before releasing their volatiles into the planetary envelope, leading to changes in, e.g., the C/O ratio of the gas and ice components. We would therefore predict that the atmospheric composition of planets generated by gravitational instability should not necessarily follow the bulk chemical composition of the local disc material. ","The chemistry of protoplanetary fragments formed via gravitational
  instabilities"
30,894576746170920961,3885912072,Marshall Johnson,"['New paper: measurements of the spin-orbit misalignments of HAT-P-41 b, WASP-79 b, and Kepler-448 b: <LINK>']",https://arxiv.org/abs/1708.01291,"We present measurements of the spin-orbit misalignments of the hot Jupiters HAT-P-41 b and WASP-79 b, and the aligned warm Jupiter Kepler-448 b. We obtained these measurements with Doppler tomography, where we spectroscopically resolve the line profile perturbation during the transit due to the Rossiter-McLaughlin effect. We analyze time series spectra obtained during portions of five transits of HAT-P-41 b, and find a value of the spin-orbit misalignment of $\lambda = -22.1_{-6.0}^{+0.8 \circ}$. We reanalyze the radial velocity Rossiter-McLaughlin data on WASP-79 b obtained by Addison et al. (2013) using Doppler tomographic methodology. We measure $\lambda=-99.1_{-3.9}^{+4.1\circ}$, consistent with but more precise than the value found by Addison et al. (2013). For Kepler-448 b we perform a joint fit to the Kepler light curve, Doppler tomographic data, and a radial velocity dataset from Lillo-Box et al. (2015). We find an approximately aligned orbit ($\lambda=-7.1^{+4.2 \circ}_{-2.8}$), in modest disagreement with the value found by Bourrier et al. (2015). Through analysis of the Kepler light curve we measure a stellar rotation period of $P_{\mathrm{rot}}=1.27 \pm 0.11$ days, and use this to argue that the full three-dimensional spin-orbit misalignment is small, $\psi\sim0^{\circ}$. ",Spin-Orbit Misalignments of Three Jovian Planets via Doppler Tomography
