,TweetID,AuthorID,AuthorName,Tweets,arxiv_link,Abstract,Title
72,1406700277651197958,1326543298622754817,Rodrigo Mira,"['Ever wonder how video can leverage audio as a learning objective? Check out our new paper (accepted at Interspeech 2021) titled ""LiRA: Learning Visual Speech Representations from Audio through Self-supervision"" <LINK>']",https://arxiv.org/abs/2106.09171,"The large amount of audiovisual content being shared online today has drawn substantial attention to the prospect of audiovisual self-supervised learning. Recent works have focused on each of these modalities separately, while others have attempted to model both simultaneously in a cross-modal fashion. However, comparatively little attention has been given to leveraging one modality as a training objective to learn from the other. In this work, we propose Learning visual speech Representations from Audio via self-supervision (LiRA). Specifically, we train a ResNet+Conformer model to predict acoustic features from unlabelled visual speech. We find that this pre-trained model can be leveraged towards word-level and sentence-level lip-reading through feature extraction and fine-tuning experiments. We show that our approach significantly outperforms other self-supervised methods on the Lip Reading in the Wild (LRW) dataset and achieves state-of-the-art performance on Lip Reading Sentences 2 (LRS2) using only a fraction of the total labelled data. ","LiRA: Learning Visual Speech Representations from Audio through
  Self-supervision"
73,1406217438367264770,1319333124086648834,A. Tuan Nguyen,"['New paper <LINK> on Domain Adaptation, with Toan Tran, @yaringal, Phil Torr, and @atilimgunes [1/n]', ""We propose a generalization bound of a model's loss on the target domain, based on the training loss and the reverse KL divergence between the source and target distributions. Different from some existing bounds in the literature, our bound works for all cases of ... [2/n]"", 'supervised learning, makes no assumptions about the labeling mechanism, works with virtually all predictive distributions commonly used in practice, and thus works with all common loss functions (cross-entropy, squared error, l1). [3/n]', 'Based on the bound, we propose an algorithm to minimize the KL term to improve the generalization performance. Different from other distance metrics, the KL divergence can be estimated with samples, leading to an efficient and stable alignment technique. More importantly,...[4/n]', 'the reverse KL has zero-forcing and mode-seeking effects, which allow for a flexible alignment between the domains, while still efficiently prevent out-of-distribution data at test time. Experiments show that our method outperforms other marginal alignment techniques. [n/n]']",https://arxiv.org/abs/2106.07780,"Domain adaptation is an important problem and often needed for real-world applications. In this problem, instead of i.i.d. training and testing datapoints, we assume that the source (training) data and the target (testing) data have different distributions. With that setting, the empirical risk minimization training procedure often does not perform well, since it does not account for the change in the distribution. A common approach in the domain adaptation literature is to learn a representation of the input that has the same (marginal) distribution over the source and the target domain. However, these approaches often require additional networks and/or optimizing an adversarial (minimax) objective, which can be very expensive or unstable in practice. To improve upon these marginal alignment techniques, in this paper, we first derive a generalization bound for the target loss based on the training loss and the reverse Kullback-Leibler (KL) divergence between the source and the target representation distributions. Based on this bound, we derive an algorithm that minimizes the KL term to obtain a better generalization to the target domain. We show that with a probabilistic representation network, the KL term can be estimated efficiently via minibatch samples without any additional network or a minimax objective. This leads to a theoretically sound alignment method which is also very efficient and stable in practice. Experimental results also suggest that our method outperforms other representation-alignment approaches. ",KL Guided Domain Adaptation
74,1405947328868106249,921726522582593536,Daniel Watson,"['Check out our new paper on diffusion models! For any pre-trained DDPM, one can *optimize* the inference path. If we optimize the ELBO, turns out we can do so with dynamic programming and get ≤0.1 extra BPD with 32 steps v.s. the usual 1k/4k steps :)\n\n<LINK>']",https://arxiv.org/abs/2106.03802,"Denoising Diffusion Probabilistic Models (DDPMs) have emerged as a powerful family of generative models that can yield high-fidelity samples and competitive log-likelihoods across a range of domains, including image and speech synthesis. Key advantages of DDPMs include ease of training, in contrast to generative adversarial networks, and speed of generation, in contrast to autoregressive models. However, DDPMs typically require hundreds-to-thousands of steps to generate a high fidelity sample, making them prohibitively expensive for high dimensional problems. Fortunately, DDPMs allow trading generation speed for sample quality through adjusting the number of refinement steps as a post process. Prior work has been successful in improving generation speed through handcrafting the time schedule by trial and error. We instead view the selection of the inference time schedules as an optimization problem, and introduce an exact dynamic programming algorithm that finds the optimal discrete time schedules for any pre-trained DDPM. Our method exploits the fact that ELBO can be decomposed into separate KL terms, and given any computation budget, discovers the time schedule that maximizes the training ELBO exactly. Our method is efficient, has no hyper-parameters of its own, and can be applied to any pre-trained DDPM with no retraining. We discover inference time schedules requiring as few as 32 refinement steps, while sacrificing less than 0.1 bits per dimension compared to the default 4,000 steps used on ImageNet 64x64 [Ho et al., 2020; Nichol and Dhariwal, 2021]. ",Learning to Efficiently Sample from Diffusion Probabilistic Models
75,1405876304235405314,1325108931199438848,EckfordLab,['Will we ever get tired of the EM algorithm? We will not.\n\nNew paper in arXiv: \n\n<LINK>'],https://arxiv.org/abs/2106.09594,"We derive a factor graph EM (FGEM) algorithm, a technique that permits combined parameter estimation and statistical inference, to determine hidden kinetic microstates from patch clamp measurements. Using the cystic fibrosis transmembrane conductance regulator (CFTR) and nicotinic acetylcholine receptor (nAChR) as examples, we perform {\em Monte Carlo} simulations to demonstrate the performance of the algorithm. We show that the performance, measured in terms of the probability of estimation error, approaches the theoretical performance limit of maximum {\em a posteriori} estimation. Moreover, the algorithm provides a reliability score for its estimates, and we demonstrate that the score can be used to further improve the performance of estimation. We use the algorithm to estimate hidden kinetic states in lab-obtained CFTR single channel patch clamp traces. ","A factor graph EM algorithm for inference of kinetic microstates from
  patch clamp measurements"
76,1405835479833092097,65432023,Prof. Costas Andreopoulos,"['New paper highlighting recent developments in the well known #GENIE #neutrino interaction simulation, prepared for a special issue of European Physical Journal ST. A longer and much more comprehensive paper on GENIE3 is in the works #nuxsec  <LINK>']",https://arxiv.org/abs/2106.09381,"The release of GENIE v3.0.0 was a major milestone in the long history of the GENIE project, delivering several alternative comprehensive neutrino interaction models, improved charged-lepton scattering simulations, a range of beyond the Standard Model simulation capabilities, improved experimental interfaces, expanded core framework capabilities, and advanced new frameworks for the global analysis of neutrino scattering data and tuning of neutrino interaction models. Steady progress continued following the release of GENIE v3.0.0. New tools and a large number of new physics models, comprehensive model configurations, and tunes have been made publicly available and planned for release in v3.2.0. This article highlights some of the most recent technical and physics developments in the GENIE v3 series. ",Recent highlights from GENIE v3
77,1405819247574540290,1275184138664976384,Vittorio Ferrari,"['📢 New paper 📢\nShape from Blur: Recovering Textured 3D Shape and Motion of Fast Moving Objects\n\nWe reconstruct the 3D shape, texture, and motion of an object from a single motion-blurred image\n\n@DRozumnyi Martin Oswald @mapo1\n<LINK>\n<LINK> <LINK>']",https://arxiv.org/abs/2106.08762,"We address the novel task of jointly reconstructing the 3D shape, texture, and motion of an object from a single motion-blurred image. While previous approaches address the deblurring problem only in the 2D image domain, our proposed rigorous modeling of all object properties in the 3D domain enables the correct description of arbitrary object motion. This leads to significantly better image decomposition and sharper deblurring results. We model the observed appearance of a motion-blurred object as a combination of the background and a 3D object with constant translation and rotation. Our method minimizes a loss on reconstructing the input image via differentiable rendering with suitable regularizers. This enables estimating the textured 3D mesh of the blurred object with high fidelity. Our method substantially outperforms competing approaches on several benchmarks for fast moving objects deblurring. Qualitative results show that the reconstructed 3D mesh generates high-quality temporal super-resolution and novel views of the deblurred object. ","Shape from Blur: Recovering Textured 3D Shape and Motion of Fast Moving
  Objects"
78,1405731090476716035,926000798970073088,Efthymios Tzinis,"['I am happy to announce that the new version of AudioScope is online 🥳📢! We obtained some impressive results for on-screen sound separation tasks simply by watching in-the-wild videos! Please check our paper with @ScottTWisdom here: <LINK> <LINK>', 'We extended the AudioScope model (https://t.co/BuTSVUuTeJ) towards these axes:\n- We generalize to a wider set of videos for both training and testing.\n- Audio-visual self and cross-modal attention from low level features boost the performance and esp. on higher frame rates.', '- Pretraining the sound separation model helps significantly to provide more stable pseudo-labels for the audio-visual coincidence classifier.\n- Freezing the embedding networks also helps the model to prevent overfitting and leverage vast amounts of in-the-wild videos.', 'We introduce efficient separable versions of our self and cross-modal attention blocks which capture dependencies between each estimated source waveform and the input video! First perform self-attention across time and then attend across the second axis (space and/or sources)! https://t.co/Wgh9RXTqOh']",https://arxiv.org/abs/2106.09669,"We introduce a state-of-the-art audio-visual on-screen sound separation system which is capable of learning to separate sounds and associate them with on-screen objects by looking at in-the-wild videos. We identify limitations of previous work on audio-visual on-screen sound separation, including the simplicity and coarse resolution of spatio-temporal attention, and poor convergence of the audio separation model. Our proposed model addresses these issues using cross-modal and self-attention modules that capture audio-visual dependencies at a finer resolution over time, and by unsupervised pre-training of audio separation model. These improvements allow the model to generalize to a much wider set of unseen videos. We also show a robust way to further improve the generalization capability of our models by calibrating the probabilities of our audio-visual on-screen classifier, using only a small amount of in-domain videos labeled for their on-screen presence. For evaluation and semi-supervised training, we collected human annotations of on-screen audio from a large database of in-the-wild videos (YFCC100m). Our results show marked improvements in on-screen separation performance, in more general conditions than previous methods. ","Improving On-Screen Sound Separation for Open-Domain Videos with
  Audio-Visual Self-Attention"
79,1405709527664652288,1185977761032110080,Kazumasa Ohno (大野 和正),"['New paper is out! <LINK>\nWe discuss about Jupiter formation from the planet’s atmospheric composition. We propose that proto-Jupiter may be formed in the cold “shadow” of protosolar disk to explain enriched nitrogen and noble gases in the atmosphere.', 'The abundances of many heavy elements are ~3 solar in Jovian atmosphere. Super-solar abundances can come from the dissolution of solids (e.g., pebbles); however, it is puzzling why hyper volatiles (N and noble gases), hardly locked into solids, are enriched with the same degree.', 'Recent studies suggested that the enriched hyper-volatiles indicate that proto-Jupiter was formed at cold &gt;30AU region where hyper volatiles can freeze. However, this idea has a disadvantage that contradicts to planet migration theory and isotope dichotomy of meteorites.', ""So, we propose an alternative idea. The current Jupiter orbit may be shadowed in the past. Due to the lack of direct sunlight, the shadow may create extremely cold environments even near the current Jupiter's orbit, leading to cause the freezing of hyper-volatiles."", 'We consider the disk in which the dust is accumulated inside the H2O snow line. Such structure can originate from the different fragmentation threshold velocity of silicate and icy grains. The accumulated dust may cast the shadow behind the snow line, near the Jupiter orbit.', 'The shadowing effect is drastic. When the degree of dust pileup at H2O snow line is high enough (f_SL&lt;0.03), even 5AU region can be as cold as &lt;30K! I thank Takahiro, coauthor and my former colleague, for his radiative transfer calculations. https://t.co/zw4JS7gUp0', 'I then performed the condensation calculations and found that relevant hyper-volatiles (N and noble gases) can freeze around the current Jupiter orbit. Such volatile distributions are considerably different from those in non-shadowed disks which we usually assume. https://t.co/ThJ5fBu7k7', ""We obtained excellent matches between observed and model predicted elemental abundances, even for in-situ formation! Interestingly, in our shadow scenario, N and noble gases may be depleted in Saturnian atmosphere, as the Saturn's orbit is close to the outer edge of the shadow. https://t.co/TRZzqHQI3X"", 'To sum, the enriched N and noble gases may imply that proto-Jupiter was formed in the shadowed region. The scenario can be compatible with other constrains. The current paper did not explicitly simulate the Jupiter formation, which should be done in future studies.', 'Although the paper mainly focuses on Solar System giants, the shadowing effect would also affect how to interpret the elemental abundance ratios of exoplanetary atmospheres, which will be delivered by upcoming JWST. https://t.co/6Qqrw33xTe', 'Btw, this is my first paper that does not use the word of ""cloud"" and ""haze""! Doing the research related to planet formation was one of my dream.\nI came up the idea of this paper about an year ago, and happy that I can finally share it as a paper.']",https://arxiv.org/abs/2106.09084,"Atmospheric compositions offer valuable clues to planetary formation and evolution. Jupiter has been the most well-studied giant planet in terms of its atmosphere; however, the origin of the Jovian atmospheric composition remains a puzzle as the abundances of nitrogen and noble gases as high as those of other elements could only originate from extremely cold environments. We propose a novel idea for explaining the Jovian atmospheric composition: Dust pileup at the H$_2$O snow line casts a shadow and cools the Jupiter orbit so that N$_2$ and noble gases can freeze. Planetesimals or a core formed in the shadowed region can enrich nitrogen and noble gases as much as other elements through their dissolution in the envelope. We compute the temperature structure of a shadowed protosolar disk with radiative transfer calculations. Then, we investigate the radial volatile distributions and predict the atmospheric composition of Jupiter with condensation calculations. We find that the vicinity of the current Jupiter orbit, approximately $3$--$7~{\rm AU}$, could be as cold as $30~{\rm K}$ if the small-dust surface density varies by a factor of $\gtrsim30$ across the H$_2$O snow line. According to previous grain growth simulations, this condition could be achieved by weak disk turbulence if silicate grains are more fragile than icy grains. The shadow can cause the condensation of most volatile substances, namely N$_2$ and Ar. We demonstrate that the dissolution of shadowed solids can explain the elemental abundance patterns of the Jovian atmosphere even if proto-Jupiter was formed near Jupiter's current orbit. The disk shadow may play a vital role in controlling atmospheric compositions. The effect of the shadow also impacts the interpretation of upcoming observations of exoplanetary atmospheres by JWST. ","Jupiter's ""Cold"" Formation in the Protosolar Disk Shadow: An Explanation
  for the Planet's Uniformly Enriched Atmosphere"
80,1405632239791230984,769279457387540480,Han Guo,"['Excited to share our latest work with Bowen Tan @waterluffy Eric Xing @ZhitingHu!\nTldr, a new NLG formulation from soft Q-learning perspective, with app. such as learning from noisy data, text attacks, prompt generation.\nPaper <LINK>\nCode <LINK> <LINK>', 'MLE is the predominant algorithm for training text generation models. It relies on direct supervision examples, which is not applicable to many applications. RL on the other hand offers a more flexible solution by allowing users to plug in arbitrary task metrics as reward. 2/5 https://t.co/SWcavKKx1J', 'Yet previous RL algorithms for text generation, such as policy gradient (on-policy RL) and Q-learning (off-policy RL), are often notoriously inefficient or unstable to train due to the large sequence space and the sparse reward received only at the end of sequences. 3/5', 'We introduce a new RL formulation for text generation from the soft Q-learning perspective. It further enables us to draw from the latest RL advances, such as path consistency learning, to combine the best of on-/off-policy updates, and learn effectively from sparse reward. 4/5', 'We apply the approach to a wide range of tasks, including learning from noisy/negative examples, adversarial attacks, prompt generation, and training standard supervised text generation from scratch. 5/5', '@_Yuchen_Li_ @waterluffy @ZhitingHu Thanks Yuchen!']",https://arxiv.org/abs/2106.07704,"Maximum likelihood estimation (MLE) is the predominant algorithm for training text generation models. This paradigm relies on direct supervision examples, which is not applicable to many emerging applications, such as generating adversarial attacks or generating prompts to control language models. Reinforcement learning (RL) on the other hand offers a more flexible solution by allowing users to plug in arbitrary task metrics as reward. Yet previous RL algorithms for text generation, such as policy gradient (on-policy RL) and Q-learning (off-policy RL), are often notoriously inefficient or unstable to train due to the large sequence space and the sparse reward received only at the end of sequences. In this paper, we introduce a new RL formulation for text generation from the soft Q-learning (SQL) perspective. It enables us to draw from the latest RL advances, such as path consistency learning, to combine the best of on-/off-policy updates, and learn effectively from sparse reward. We apply the approach to a wide range of text generation tasks, including learning from noisy/negative examples, adversarial attacks, and prompt generation. Experiments show our approach consistently outperforms both task-specialized algorithms and the previous RL methods. ",Text Generation with Efficient (Soft) Q-Learning
81,1405601565831053316,2923392199,Hannah Eyre,"['MedspaCy finally has a paper! \n\n""Launching into clinical space with medspaCy: a new clinical text processing toolkit in Python"" at #AMIA2021\n\nCongrats to @abchapman93 @burgersmoke and others at @SLC_IDEAS, @vahsrd, and @UofUEpi\n\n<LINK>\n\n@spacy_io #NLProc', '@abchapman93 @burgersmoke @SLC_IDEAS @vahsrd @UofUEpi @spacy_io spacy 3.x update to medspaCy coming very soon as well https://t.co/zNni1TtNuf']",https://arxiv.org/abs/2106.07799,"Despite impressive success of machine learning algorithms in clinical natural language processing (cNLP), rule-based approaches still have a prominent role. In this paper, we introduce medspaCy, an extensible, open-source cNLP library based on spaCy framework that allows flexible integration of rule-based and machine learning-based algorithms adapted to clinical text. MedspaCy includes a variety of components that meet common cNLP needs such as context analysis and mapping to standard terminologies. By utilizing spaCy's clear and easy-to-use conventions, medspaCy enables development of custom pipelines that integrate easily with other spaCy-based modules. Our toolkit includes several core components and facilitates rapid development of pipelines for clinical text. ","Launching into clinical space with medspaCy: a new clinical text
  processing toolkit in Python"
82,1405575447006617603,3100596960,Walter Scheirer,['New paper in arXiv: On the Objective Evaluation of Post Hoc Explainers. <LINK>\n\nExplainable AI techniques are important when transparency of decisions is needed in high-stakes environments. But how well do they work? Our framework can help answer that question. <LINK>'],https://arxiv.org/abs/2106.08376,"Many applications of data-driven models demand transparency of decisions, especially in health care, criminal justice, and other high-stakes environments. Modern trends in machine learning research have led to algorithms that are increasingly intricate to the degree that they are considered to be black boxes. In an effort to reduce the opacity of decisions, methods have been proposed to construe the inner workings of such models in a human-comprehensible manner. These post hoc techniques are described as being universal explainers - capable of faithfully augmenting decisions with algorithmic insight. Unfortunately, there is little agreement about what constitutes a ""good"" explanation. Moreover, current methods of explanation evaluation are derived from either subjective or proxy means. In this work, we propose a framework for the evaluation of post hoc explainers on ground truth that is directly derived from the additive structure of a model. We demonstrate the efficacy of the framework in understanding explainers by evaluating popular explainers on thousands of synthetic and several real-world tasks. The framework unveils that explanations may be accurate but misattribute the importance of individual features. ",A Framework for Evaluating Post Hoc Feature-Additive Explainers
83,1405565545693560840,1938536035,Huy V. Vo,"['Our new paper ""Large-Scale Unsupervised Object Discovery"" is on arxiv: <LINK>. We propose to use ranking methods for object discovery and show that our approach scales better than the baselines while yielding state-of-the-art results on COCO ... <LINK>', '... and the large OpenImages dataset with 1.7M images.']",https://arxiv.org/abs/2106.06650,"Existing approaches to unsupervised object discovery (UOD) do not scale up to large datasets without approximations that compromise their performance. We propose a novel formulation of UOD as a ranking problem, amenable to the arsenal of distributed methods available for eigenvalue problems and link analysis. Through the use of self-supervised features, we also demonstrate the first effective fully unsupervised pipeline for UOD. Extensive experiments on COCO and OpenImages show that, in the single-object discovery setting where a single prominent object is sought in each image, the proposed LOD (Large-scale Object Discovery) approach is on par with, or better than the state of the art for medium-scale datasets (up to 120K images), and over 37% better than the only other algorithms capable of scaling up to 1.7M images. In the multi-object discovery setting where multiple objects are sought in each image, the proposed LOD is over 14% better in average precision (AP) than all other methods for datasets ranging from 20K to 1.7M images. Using self-supervised features, we also show that the proposed method obtains state-of-the-art UOD performance on OpenImages. Our code is publicly available at this https URL ",Large-Scale Unsupervised Object Discovery
