,TweetID,AuthorID,AuthorName,Tweets,arxiv_link,Abstract,Title
17,699894256350162944,1601296094,David Bowler,['New paper on Ti interstitials on the charge density wave in TiSe2 with Swiss colleagues (submitted to PRL) <LINK>'],http://arxiv.org/abs/1602.04972,The impact of variable Ti self-doping on the 1T-TiSe2 charge density wave (CDW) is studied by scanning tunneling microscopy. Supported by density functional theory we show that agglomeration of intercalated-Ti atoms acts as preferential nucleation centers for the CDW that breaks up in phaseshifted CDW domains whose size directly depends on the intercalated-Ti concentration and which are separated by atomically-sharp phase boundaries. The close relationship between the diminution of the CDW domain size and the disappearance of the anomalous peak in the temperature dependent resistivity allows to draw a coherent picture of the 1T-TiSe2 CDW phase transition and its relation to excitons. ,"Short-range phase coherence and origin of the 1T-TiSe2 charge density
  wave"
18,699866162285453312,2333045815,Christian A Naesseth,"['Check out our new paper introducing the ""Interacting Particle MCMC"" method, PMCMC for parallel/distributed computing <LINK>']",http://arxiv.org/abs/1602.05128,"We introduce interacting particle Markov chain Monte Carlo (iPMCMC), a PMCMC method based on an interacting pool of standard and conditional sequential Monte Carlo samplers. Like related methods, iPMCMC is a Markov chain Monte Carlo sampler on an extended space. We present empirical results that show significant improvements in mixing rates relative to both non-interacting PMCMC samplers, and a single PMCMC sampler with an equivalent memory and computational budget. An additional advantage of the iPMCMC method is that it is suitable for distributed and multi-core architectures. ",Interacting Particle Markov Chain Monte Carlo
19,699446075640451072,3199605543,Afonso S. Bandeira,['New paper on guarantees for the Burer-Monteiro approach for SDPs arising in synchronization and community detection <LINK>'],http://arxiv.org/abs/1602.04426,"To address difficult optimization problems, convex relaxations based on semidefinite programming are now common place in many fields. Although solvable in polynomial time, large semidefinite programs tend to be computationally challenging. Over a decade ago, exploiting the fact that in many applications of interest the desired solutions are low rank, Burer and Monteiro proposed a heuristic to solve such semidefinite programs by restricting the search space to low-rank matrices. The accompanying theory does not explain the extent of the empirical success. We focus on Synchronization and Community Detection problems and provide theoretical guarantees shedding light on the remarkable efficiency of this heuristic. ","On the low-rank approach for semidefinite programs arising in
  synchronization and community detection"
20,699293401162870785,618466970,Damiano Brigo (Prof),['New paper (pure maths): Coordinate-free Stochastic Differential Equations as Jets. Joint work with John Armstrong. <LINK>'],http://arxiv.org/abs/1602.03931,"We explain how It\^o Stochastic Differential Equations (SDEs) on manifolds may be defined using 2-jets of smooth functions. We show how this relationship can be interpreted in terms of a convergent numerical scheme. We show how jets can be used to derive graphical representations of It\^o SDEs. We show how jets can be used to derive the differential operators associated with SDEs in a coordinate free manner. We relate jets to vector flows, giving a geometric interpretation of the It\^o--Stratonovich transformation. We show how percentiles can be used to give an alternative coordinate free interpretation of the coefficients of one dimensional SDEs. We relate this to the jet approach. This allows us to interpret the coefficients of SDEs in terms of ""fan diagrams"". In particular the median of a SDE solution is associated to the drift of the SDE in Stratonovich form for small times. ",Coordinate-free Stochastic Differential Equations as Jets
21,698918597826125824,21815759,Charles Sutton,"['New paper: Neural networks, attention mechanisms, and summarizing computer programs. <LINK>', '@daniel_bilar @IgorCarron Great story! I recall similar story re Victor Hugo. Just after Les Mis published, VH telegram: ""?"" Publisher: ""!""']",http://arxiv.org/abs/1602.03001,"Attention mechanisms in neural networks have proved useful for problems in which the input and output do not have fixed dimension. Often there exist features that are locally translation invariant and would be valuable for directing the model's attention, but previous attentional architectures are not constructed to learn such features specifically. We introduce an attentional neural network that employs convolution on the input tokens to detect local time-invariant and long-range topical attention features in a context-dependent way. We apply this architecture to the problem of extreme summarization of source code snippets into short, descriptive function name-like summaries. Using those features, the model sequentially generates a summary by marginalizing over two attention mechanisms: one that predicts the next summary token based on the attention weights of the input tokens and another that is able to copy a code token as-is directly into the summary. We demonstrate our convolutional attention neural network's performance on 10 popular Java projects showing that it achieves better performance compared to previous attentional mechanisms. ","A Convolutional Attention Network for Extreme Summarization of Source
  Code"
22,697490179221753857,77316078,Arthur Gretton,['New kernel goodness-of-fit test: <LINK> using the Stein method of <LINK> with an RKHS function class.'],http://arxiv.org/abs/1602.02964,"We propose a nonparametric statistical test for goodness-of-fit: given a set of samples, the test determines how likely it is that these were generated from a target density function. The measure of goodness-of-fit is a divergence constructed via Stein's method using functions from a Reproducing Kernel Hilbert Space. Our test statistic is based on an empirical estimate of this divergence, taking the form of a V-statistic in terms of the log gradients of the target density and the kernel. We derive a statistical test, both for i.i.d. and non-i.i.d. samples, where we estimate the null distribution quantiles using a wild bootstrap procedure. We apply our test to quantifying convergence of approximate Markov Chain Monte Carlo methods, statistical model criticism, and evaluating quality of fit vs model complexity in nonparametric density estimation. ",A Kernel Test of Goodness of Fit
23,697326381525569536,3145451345,m.onodera,['Our new paper used spectra taken with the MOSFIRE instrument at @keckobservatory <LINK>'],http://arxiv.org/abs/1602.02779,"We study the relationship between stellar mass, star formation rate (SFR),ionization state, and gas-phase metallicity for a sample of 41 normal star-forming galaxies at $3 \lesssim z \lesssim 3.7$. The gas-phase oxygen abundance, ionization parameter, and electron density of ionized gas are derived from rest-frame optical strong emission lines measured on near-infrared spectra obtained with Keck/MOSFIRE. We remove the effect of these strong emission lines in the broad-band fluxes to compute stellar masses via spectral energy distribution fitting, while the SFR is derived from the dust-corrected ultraviolet luminosity. The ionization parameter is weakly correlated with the specific SFR, but otherwise the ionization parameter and electron density do not correlate with other global galaxy properties such as stellar mass, SFR, and metallicity. The mass-metallicity relation (MZR) at $z\simeq3.3$ shows lower metallicity by $\simeq 0.7$ dex than that at $z=0$ at the same stellar mass. Our sample shows an offset by $\simeq 0.3$ dex from the locally defined mass-metallicity-SFR relation, indicating that simply extrapolating such relation to higher redshift may predict an incorrect evolution of MZR. Furthermore, within the uncertainties we find no SFR-metallicity correlation, suggesting a less important role of SFR in controlling the metallicity at high redshift. We finally investigate the redshift evolution of the MZR by using the model by Lilly et al. (2013), finding that the observed evolution from $z=0$ to $z\simeq3.3$ can be accounted for by the model assuming a weak redshift evolution of the star formation efficiency. ","ISM excitation and metallicity of star-forming galaxies at z~3.3 from
  near-IR spectroscopy"
24,697326137660276736,3145451345,m.onodera,['want to know about ionized gas properties especially metallicity of normal galaxies at z~3.3? Look at our new paper <LINK>'],http://arxiv.org/abs/1602.02779,"We study the relationship between stellar mass, star formation rate (SFR),ionization state, and gas-phase metallicity for a sample of 41 normal star-forming galaxies at $3 \lesssim z \lesssim 3.7$. The gas-phase oxygen abundance, ionization parameter, and electron density of ionized gas are derived from rest-frame optical strong emission lines measured on near-infrared spectra obtained with Keck/MOSFIRE. We remove the effect of these strong emission lines in the broad-band fluxes to compute stellar masses via spectral energy distribution fitting, while the SFR is derived from the dust-corrected ultraviolet luminosity. The ionization parameter is weakly correlated with the specific SFR, but otherwise the ionization parameter and electron density do not correlate with other global galaxy properties such as stellar mass, SFR, and metallicity. The mass-metallicity relation (MZR) at $z\simeq3.3$ shows lower metallicity by $\simeq 0.7$ dex than that at $z=0$ at the same stellar mass. Our sample shows an offset by $\simeq 0.3$ dex from the locally defined mass-metallicity-SFR relation, indicating that simply extrapolating such relation to higher redshift may predict an incorrect evolution of MZR. Furthermore, within the uncertainties we find no SFR-metallicity correlation, suggesting a less important role of SFR in controlling the metallicity at high redshift. We finally investigate the redshift evolution of the MZR by using the model by Lilly et al. (2013), finding that the observed evolution from $z=0$ to $z\simeq3.3$ can be accounted for by the model assuming a weak redshift evolution of the star formation efficiency. ","ISM excitation and metallicity of star-forming galaxies at z~3.3 from
  near-IR spectroscopy"
25,697086966001704960,14697496,Thomas Steiner,['New paper “Wikipedia Tools for Google Spreadsheets” <LINK> Add some =WIKI* magic to your sheets. <LINK>'],http://arxiv.org/abs/1602.02506,"In this paper, we introduce the Wikipedia Tools for Google Spreadsheets. Google Spreadsheets is part of a free, Web-based software office suite offered by Google within its Google Docs service. It allows users to create and edit spreadsheets online, while collaborating with other users in realtime. Wikipedia is a free-access, free-content Internet encyclopedia, whose content and data is available, among other means, through an API. With the Wikipedia Tools for Google Spreadsheets, we have created a toolkit that facilitates working with Wikipedia data from within a spreadsheet context. We make these tools available as open-source on GitHub [this https URL], released under the permissive Apache 2.0 license. ",Wikipedia Tools for Google Spreadsheets
26,697078702006472704,3918111614,Oriol Vinyals,"['Our new Language Modeling paper: <LINK> With a single RNNLM (no ensembling), we reduce perplexity from ~50 down to 30.0!']",http://arxiv.org/abs/1602.02410,"In this work we explore recent advances in Recurrent Neural Networks for large scale Language Modeling, a task central to language understanding. We extend current models to deal with two key challenges present in this task: corpora and vocabulary sizes, and complex, long term structure of language. We perform an exhaustive study on techniques such as character Convolutional Neural Networks or Long-Short Term Memory, on the One Billion Word Benchmark. Our best single model significantly improves state-of-the-art perplexity from 51.3 down to 30.0 (whilst reducing the number of parameters by a factor of 20), while an ensemble of models sets a new record by improving perplexity from 41.0 down to 23.7. We also release these models for the NLP and ML community to study and improve upon. ",Exploring the Limits of Language Modeling
27,696880445443567616,4253020032,sashank,"['#Privacy Preserving Architectures for Collaborative Intrusion Detection #ids #security our new paper, <LINK>']",http://arxiv.org/abs/1602.02452,"Collaboration among multiple organizations is imperative for contemporary intrusion detection. As modern threats become well sophisticated it is difficult for organizations to defend with threat context local to their networks alone. Availability of global \emph{threat intelligence} is must for organizations to defend against modern advanced persistent threats (APTs). In order to benefit from such global context of attacks, privacy concerns continue to be of major hindrance. In this position paper we identify real world privacy problems as precise use cases, relevant cryptographic technologies and discuss privacy preserving architectures for collaborative intrusion detection. ",Privacy Preserving Architectures for Collaborative Intrusion Detection
28,696662599375708160,561899047,Aki Vehtari,"['New paper Weber et al ""Hierarchical expectation propagation for Bayesian aggregation of average data"" <LINK>']",http://arxiv.org/abs/1602.02055,"Throughout the different phases of a drug development program, randomized trials are used to establish the tolerability, safety, and efficacy of a candidate drug. At each stage one aims to optimize the design of future studies by extrapolation from the available evidence at the time. This includes collected trial data and relevant external data. However, relevant external data are typically available as averages only, for example from trials on alternative treatments reported in the literature. Here we report on such an example from a drug development for wet age-related macular degeneration. This disease is the leading cause of severe vision loss in the elderly. While current treatment options are efficacious, they are also a substantial burden for the patient. Hence, new treatments are under development which need to be compared against existing treatments. The general statistical problem this leads to is meta-analysis, which addresses the question of how we can combine datasets collected under different conditions. Bayesian methods have long been used to achieve partial pooling. Here we consider the challenge when the model of interest is complex (hierarchical and nonlinear) and one dataset is given as raw data while the second dataset is given as averages only. In such a situation, common meta-analytic methods can only be applied when the model is sufficiently simple for analytic approaches. When the model is too complex, for example nonlinear, an analytic approach is not possible. We provide a Bayesian solution by using simulation to approximately reconstruct the likelihood of the external summary and allowing the parameters in the model to vary under the different conditions. We first evaluate our approach using fake-data simulations and then report results for the drug development program that motivated this research. ",Bayesian aggregation of average data: An application in drug development
29,695561415801901056,479680089,Quentin Riffard,['New paper-constraints from direct searches of SUSY DM in the light of null results from the LHC in the squark sector <LINK>'],http://arxiv.org/abs/1602.01030,"The comparison of the results of direct detection of Dark Matter, obtained with various target nuclei, requires model-dependent, or even arbitrary, assumptions. Indeed, to draw conclusions either the spin-dependent (SD) or the spin-independent (SI) interaction has to be neglected. In the light of the null results from supersymmetry searches at the LHC, the squark sector is pushed to high masses. We show that for a squark sector at the TeV scale, the framework used to extract contraints from direct detection searches can be redefined as the number of free parameters is reduced. Moreover, the correlation observed between SI and SD proton cross sections constitutes a key issue for the development of the next generation of Dark Matter detectors. ","Extracting constraints from direct detection searches of supersymmetric
  dark matter in the light of null results from the LHC in the squark sector"
30,695560822941212672,479680089,Quentin Riffard,['New MIMAC paper about experimental electron/recoil discrimination posted on arXiv : <LINK>'],http://arxiv.org/abs/1602.01738,"MIMAC (MIcro-TPC MAtrix of Chambers) is a directional WIMP Dark Matter detector project. Direct dark matter experiments need a high level of electron/recoil discrimination to search for nuclear recoils produced by WIMP-nucleus elastic scattering. In this paper, we proposed an original method for electron event rejection based on a multivariate analysis applied to experimental data acquired using monochromatic neutron fields. This analysis shows that a $10^5$ rejection power is reachable for electron/recoil discrimination. Moreover, the efficiency was estimated by a Monte-Carlo simulation showing that a 105 electron rejection power is reached with a $86.49\pm 0.17$\% nuclear recoil efficiency considering the full energy range and $94.67\pm0.19$\% considering a 5~keV lower threshold. ","MIMAC low energy electron-recoil discrimination measured with fast
  neutrons"
31,695054118394556416,1580357558,Rebecca Davies,['Can the merger stages of galaxies be inferred from the ages of their star clusters? We discuss this in our new paper <LINK>'],https://arxiv.org/abs/1602.01097,"We present near infrared imaging and integral field spectroscopy of the centre of the dusty luminous infrared galaxy merger MCG+08-11-002, taken using the Near InfraRed Camera 2 (NIRC2) and the OH-Suppressing InfraRed Imaging Spectrograph (OSIRIS) on Keck II. We achieve a spatial resolution of ~25 pc in the K band, allowing us to resolve 41 star clusters in the NIRC2 images. We calculate the ages of 22/25 star clusters within the OSIRIS field using the equivalent widths of the CO 2.3$\mu$m absorption feature and the Br$\gamma$ nebular emission line. The star cluster age distribution has a clear peak at ages < 20 Myr, indicative of current starburst activity associated with the final coalescence of the progenitor galaxies. There is a possible second peak at ~65 Myr which may be a product of the previous close passage of the galaxy nuclei. We fit single and double starburst models to the star cluster age distribution and use Monte Carlo sampling combined with two-sided K-S tests to calculate the probability that the observed data are drawn from each of the best fit distributions. There is a >90 per cent chance that the data are drawn from either a single or double starburst star formation history, but stochastic sampling prevents us from distinguishing between the two scenarios. Our analysis of MCG+08-11-002 indicates that star cluster age distributions provide valuable insights into the timelines of galaxy interactions and may therefore play an important role in the future development of precise merger stage classification systems. ","Reconstructing Merger Timelines Using Star Cluster Age Distributions:
  the Case of MCG+08-11-002"
32,694346679311466496,282227303,Dane Wilburne,['New paper: On the Geometry and Extremal Properties of the Edge-Degeneracy Model <LINK>'],https://arxiv.org/abs/1602.00180,"The edge-degeneracy model is an exponential random graph model that uses the graph degeneracy, a measure of the graph's connection density, and number of edges in a graph as its sufficient statistics. We show this model is relatively well-behaved by studying the statistical degeneracy of this model through the geometry of the associated polytope. ",On the Geometry and Extremal Properties of the Edge-Degeneracy Model
