,TweetID,AuthorID,AuthorName,Tweets,arxiv_link,Abstract,Title
106,1415364606445318155,990433714948661250,Sergey Levine,"['Empirical studies observed that generalization in RL is hard. Why? In a new paper, we provide a partial answer: generalization in RL induces partial observability, even for fully observed MDPs! This makes standard RL methods suboptimal.\n<LINK>\n\nA thread:', 'Take a look at this example: the agent has a multi-step ""guessing game"" to label an image (not a bandit -- you get multiple guesses until you get it right!). We know in MDPs there is an optimal deterministic policy, so RL will learn a deterministic policy here. https://t.co/zih0Jp5h6l', ""Of course, this is a bad idea -- if it guesses wrong on the first try, it should not guess the same label again. But this task *is* fully observed -- there is a unique mapping from image pixels to labels, the problem is that we just don't know what it is from training data!"", 'The guessing game is a MDP, but learning to guess from finite data becomes (implicitly) a POMDP -- what we call the epistemic POMDP, because it emerges from epistemic uncertainty. This is not unique to guessing, the same holds eg for mazes in ProcGen, robotic grasping, etc.', 'This leads to some counterintuitive things. Look at the ""zookeeper example"" below: the optimal MDP strategy is to look at the map (which is fully observed) and go to the otters, but peeking through windows generalizes much better (is never optimal in training). https://t.co/2lLv65hTee', 'What is happening here is that generalization in RL requires taking epistemic (information-gathering) actions at test time, just like we would in a POMDP, but this is never optimal to do at training-time. Hence, MDP methods will not generalize as well as POMDP methods.', 'Based on this idea, we developed a new algorithm, LEEP, that utilizes epistemic POMDP ideas to get better generalization. LEEP actually does *worse* on the training environments, but much better on test environments, as we would expect. https://t.co/l5AxpWI1AQ', 'Unfortunately, solving (or even estimating) the epistemic POMDP is very hard, and LEEP makes some very crude approximations. Lots more research is needed to utilize the epistemic POMDP, in which case I think we can all make lots of progress on generalization!', 'This was a really fun collaboration with @its_dibya, @jrahme0, @aviral_kumar2, @yayitsamyzhang, @ryan_p_adams -- a really fun group to work with on generalization🙂', '@qcjefftqc That is a really good question! I do think it might provide part of the explanation, though such methods do not (in principle) capture the right ""type"" of uncertainty. But it seems likely they ""accidentally"" get some epistemic uncertainty, esp. with regularization/early stopping.']",https://arxiv.org/abs/2107.06277,"Generalization is a central challenge for the deployment of reinforcement learning (RL) systems in the real world. In this paper, we show that the sequential structure of the RL problem necessitates new approaches to generalization beyond the well-studied techniques used in supervised learning. While supervised learning methods can generalize effectively without explicitly accounting for epistemic uncertainty, we show that, perhaps surprisingly, this is not the case in RL. We show that generalization to unseen test conditions from a limited number of training conditions induces implicit partial observability, effectively turning even fully-observed MDPs into POMDPs. Informed by this observation, we recast the problem of generalization in RL as solving the induced partially observed Markov decision process, which we call the epistemic POMDP. We demonstrate the failure modes of algorithms that do not appropriately handle this partial observability, and suggest a simple ensemble-based technique for approximately solving the partially observed problem. Empirically, we demonstrate that our simple algorithm derived from the epistemic POMDP achieves significant gains in generalization over current methods on the Procgen benchmark suite. ","Why Generalization in RL is Difficult: Epistemic POMDPs and Implicit
  Partial Observability"
107,1415343549843968009,959009455475175424,Ian Mason,"['New paper at <LINK>. We explore how we can leverage per-unit activation distributions to adapt to unlabelled data in new domains. \n\nWith @CianEastwood, Chris Williams and @bschoelkopf. More here ⬇️. <LINK>']",https://arxiv.org/abs/2107.05446,"Source-free domain adaptation (SFDA) aims to adapt a model trained on labelled data in a source domain to unlabelled data in a target domain without access to the source-domain data during adaptation. Existing methods for SFDA leverage entropy-minimization techniques which: (i) apply only to classification; (ii) destroy model calibration; and (iii) rely on the source model achieving a good level of feature-space class-separation in the target domain. We address these issues for a particularly pervasive type of domain shift called measurement shift which can be resolved by restoring the source features rather than extracting new ones. In particular, we propose Feature Restoration (FR) wherein we: (i) store a lightweight and flexible approximation of the feature distribution under the source data; and (ii) adapt the feature-extractor such that the approximate feature distribution under the target data realigns with that saved on the source. We additionally propose a bottom-up training scheme which boosts performance, which we call Bottom-Up Feature Restoration (BUFR). On real and synthetic data, we demonstrate that BUFR outperforms existing SFDA methods in terms of accuracy, calibration, and data efficiency, while being less reliant on the performance of the source model in the target domain. ","Source-Free Adaptation to Measurement Shift via Bottom-Up Feature
  Restoration"
108,1415252809633632258,2427184074,Christopher Berry,"[""Congratulations to @ynxmonica on her new paper! She's been working very hard to investigate how modelling mass transfer and common envelope evolution impact the predictions for binary black holes. This physics is super important <LINK> <LINK>"", 'In this study, @ynxmonica carefully compared results for the evolution of black hole+hydrogen-rich stars using MESA (with the full stellar structure) and the quick prescriptions used in COSMIC. Stable mass transfer is much more common using the detailed simulation https://t.co/9bwPkQglm7', 'Binary black holes formed after common envelope evolution is rare using the MESA simulations (I wanted to call the paper ""Successful common envelope evolution is uncommon""). Thus, overall, we find few merging binary black hole systems', 'Not only do the number of binaries that will form merging binary black holes change, but the delay times too. table mass transfer leads to wider orbits than common envelope evolution, hence the black holes take longer to merge. This could have a big impact on predicted rates! https://t.co/ADfczC7QzB', 'If you want to catch up on this binary black hole study, @ynxmonica discussed her results at @EAS_meeting https://t.co/8CP4F2Os4O']",https://arxiv.org/abs/2107.05702,"Rapid binary population synthesis codes are often used to investigate the evolution of compact-object binaries. They typically rely on analytical fits of single-star evolutionary tracks and parameterized models for interactive phases of evolution (e.g., mass-transfer on thermal timescale, determination of dynamical instability, and common envelope) that are crucial to predict the fate of binaries. These processes can be more carefully implemented in stellar structure and evolution codes such as MESA. To assess the impact of such improvements, we compare binary black hole mergers as predicted in models with the rapid binary population synthesis code COSMIC to models ran with MESA simulations through mass transfer and common-envelope treatment. We find that results significantly differ in terms of formation paths, the orbital periods and mass ratios of merging binary black holes, and consequently merger rates. While common-envelope evolution is the dominant formation channel in COSMIC, stable mass transfer dominates in our MESA models. Depending upon the black hole donor mass, and mass-transfer and common-envelope physics, at sub-solar metallicity COSMIC overproduces the number of binary black hole mergers by factors of 2--35 with a significant fraction of them having merger times orders of magnitude shorter than the binary black holes formed when using detailed MESA models. Therefore we find that some binary black hole merger rate predictions from rapid population syntheses of isolated binaries may be overestimated by factors of ~5--500. We conclude that the interpretation of gravitational-wave observations requires the use of detailed treatment of these interactive binary phases. ","Binary Black Hole Formation with Detailed Modeling: Stable Mass Transfer
  Leads to Lower Merger Rates"
109,1414969834115411968,869532833764831232,Thibaut Vidal,"['New exponential-size neighborhoods for the pickup-and-delivery problem. Optimal solutions are attained for most problems with up to 30 nodes in a *single* local-search descent, giving 1,000x speedup over previous algorithms! Check our paper here:\n<LINK>\n#ORMS <LINK>', 'work with Toni Pacheco, Rafael Martinelli (@rafaelmartinel8), Tulio Toffolo (@tuliotoffolo) and Anand Subramanian (@Subjectto_)', '👉@pacheco_toni']",https://arxiv.org/abs/2107.05189,"Neighborhood search is a cornerstone of state-of-the-art traveling salesman and vehicle routing metaheuristics. While neighborhood exploration procedures are well developed for problems with individual services, their counterparts for one-to-one pickup-and-delivery problems have been more scarcely studied. A direct extension of classic neighborhoods is often inefficient or complex due to the necessity of jointly considering service pairs. To circumvent these issues, we introduce major improvements to existing neighborhood searches for the pickup-and-delivery traveling salesman problem and new large neighborhoods. We show that the classical Relocate-Pair neighborhood can be fully explored in $O(n^2)$ instead of $O(n^3)$ time. We adapt the 4-Opt and Balas-Simonetti neighborhoods to consider precedence constraints. Moreover, we introduce an exponential-size neighborhood called 2k-Opt, which includes all solutions generated by multiple nested 2-Opts and can be searched in $O(n^2)$ time using dynamic programming. We conduct extensive computational experiments, highlighting the significant contribution of these new neighborhoods and speed-up strategies within two classical metaheuristics. Notably, our approach permits to repeatedly solve small pickup-and-delivery problem instances to optimality or near-optimality within milliseconds, and therefore it represents a valuable tool for time-critical applications such as meal delivery or mobility of demand. ","Exponential-Size Neighborhoods for the Pickup-and-Delivery Traveling
  Salesman Problem"
110,1414781294253285386,16079444,Ying-Jer Kao,"['New paper with Yu-Hsueh, Jozef, and Yong-Baek where we demonstrate single-particle excitations of the spin-1 Kitaev model is bosonic.\n<LINK>']",https://arxiv.org/abs/2107.04730,"We study the excitation spectrum of the spin-1 Kitaev model using the symmetric tensor network. By evaluating the virtual order parameters defined on the virtual Hilbert space in the tensor network formalism, we confirm the ground state is in a $\mathbb{Z}_2$ spin liquid phase. Using the correspondence between the transfer matrix spectrum and low-lying excitations, we find that contrary to the dispersive Majorana excitation in the spin-1/2 case, the isotropic spin-1 Kitaev model has a dispersive charge anyon excitation. Bottom of the gapped single-particle charge excitations are found at $\mathbf{K}, \mathbf{K}'=(\pm2\pi/3, \mp 2\pi/3)$, with a corresponding correlation length of $\xi \approx 6.7$ unit cells. The lower edge of the two-particle continuum, which is closely related to the dynamical structure factor measured in inelastic neutron scattering experiments, is obtained by extracting the excitations in the vacuum superselection sector in the anyon theory language ",Excitation spectrum of spin-1 Kitaev spin liquids
111,1414769780209471489,4438354094,Tom Wong,"['New paper with Josh Lockhart @AbacusBanana @UCLQuantum! We show that out of all 1,018,689,568 simple, connected, irregular graphs with 11 vertices or less, there are 64 on which Laplacian and adjacency (continuous-time) quantum walks are equivalent. <LINK> <LINK>', 'This tweet from last December was me simulating all these quantum walks. https://t.co/jHXysYcXcG', ""Here's a picture from January. I had already found all 64 graphs. I printed them so that I could rearrange them and look for patterns. I found eight infinite families of graphs supporting these equivalent walks. https://t.co/nwqzkq3ekT"", ""@octonion @AbacusBanana @UCLQuantum Yes, that's right.""]",https://arxiv.org/abs/2107.05580,"The continuous-time quantum walk is a particle evolving by Schr\""odinger's equation in discrete space. Encoding the space as a graph of vertices and edges, the Hamiltonian is proportional to the discrete Laplacian. In some physical systems, however, the Hamiltonian is proportional to the adjacency matrix instead. It is well-known that these quantum walks are equivalent when the graph is regular, i.e., when each vertex has the same number of neighbors. If the graph is irregular, however, the quantum walks evolve differently. In this paper, we show that for some irregular graphs, if the particle is initially localized at a certain vertex, the probability distributions of the two quantum walks are identical, even though the amplitudes differ. We analytically prove this for a graph with five vertices and a graph with six vertices. By simulating the walks on all 1,018,689,568 simple, connected, irregular graphs with eleven vertices or less, we found sixty-four graphs with this notion of equivalence. We also give eight infinite families of graphs supporting these equivalent walks. ",Equivalent Laplacian and Adjacency Quantum Walks on Irregular Graphs
112,1414660683740979201,1001049754787368960,Dr. Yu-Dai Tsai,"['Fun fact #1 about asteroids, celebrating our new paper ""Asteroid g-2 Experiments"", <LINK>:\nProfessor Moriarty has a book on ""The Dynamics of an Asteroid"" #Sherlock \n@NASAExoplanets @esa @ESAGaia @lucavisinelli @SunnyVagnozzi @exploreplanets  \n@AsteroidWatch', ""We did not cite it because we don't know which asteroid it is (probably Icarus?)""]",https://arxiv.org/abs/2107.04038,"We study for the first time the possibility of probing long-range fifth forces utilizing asteroid astrometric data, via the fifth force-induced orbital precession. We examine nine Near-Earth Object (NEO) asteroids whose orbital trajectories are accurately determined via optical and radar astrometry. Focusing on a Yukawa-type potential mediated by a new gauge field (dark photon) or a baryon-coupled scalar, we estimate the sensitivity reach for the fifth-force coupling strength and mediator mass in the mass range $m \simeq 10^{-21}-10^{-15}\,{\rm eV}$. Our estimated sensitivity is comparable to leading limits from torsion balance experiments, potentially exceeding these in a specific mass range. The fifth forced-induced precession increases with the orbital semi-major axis in the small $m$ limit, motivating the study of objects further away from the Sun. We discuss future exciting prospects for extending our study to more than a million asteroids (including NEOs, main-belt asteroids, Hildas, and Jupiter Trojans), as well as trans-Neptunian objects and exoplanets. ",Asteroid astrometry as a fifth-force and ultralight dark sector probe
113,1414566474266693633,816198577517133824,Benedikt Sabass,"['New preprint where we systematically study a physical mechanism for force-dependent growth of focal adhesions. Any comments for improving the paper? <LINK>', 'https://t.co/uQ6ELwvkW2']",https://arxiv.org/abs/2107.03714,"Mechanical loading generally weakens adhesive structures and eventually leads to their rupture. However, biological systems can adapt to loads by strengthening adhesions, which is essential for maintaining the integrity of tissue and whole organisms. Inspired by cellular focal adhesions, we suggest here a generic, molecular mechanism that allows adhesion systems to harness applied loads for self-stabilization under non-equilibrium conditions -- without any active feedback involved. The mechanism is based on conformation changes of adhesion molecules that are dynamically exchanged with a reservoir. Tangential loading drives the occupation of some stretched conformation states out of equilibrium, which, for thermodynamic reasons, leads to association of further molecules with the adhesion cluster. Self-stabilization robustly increases adhesion lifetimes in broad parameter ranges. Unlike for catch-bonds, bond dissociation rates do not decrease with force. The self-stabilization principle can be realized in many ways in complex adhesion-state networks; we show how it naturally occurs in cellular adhesions involving the adaptor proteins talin and vinculin. ","A generic self-stabilization mechanism for biomolecular adhesions under
  load"
114,1414553858588696577,972555245179064320,Jordy de Vries,"['New paper out: <LINK> .\n\nThe strong CP problem is the problem that the theta angle is very small (&lt;10^-10) as indicated by measurements of the electric dipole moment of the neutron and mercury atom. It is not clear why this angle is so small. 1/n', 'The Standard Model has a remarkable property that while the electroweak sector violates CP, this does not transfer into the strong sector. That is, electroweak loops renormalize the theta term at a minuscule level well below 10^-10. 2/n', 'So once you pick theta small in the SM at any scale, it remains small. This is not true in generic new physics models iff they have more sources of CP violation, which is often the case and also expected because of the universal missing antimatter. 3/n', 'If so, theta does get large corrections. It is not sufficient to pick theta small at one scale as it will become large again due to loops. In such models, you need to solve the strong CP problem at low energies, in the infrared, and the only known game in town are axions. 4/n', 'Remarkably the low-energy pattern of CP violation contains hints whether the strong CP problem was solved in the ultraviolet (for instance due to explicit symmetries) or the infrared (axions). This pattern can be seen by ratios of Electric Dipole Moments of various systems. 5/n', 'For instance, the EDM of atomic Ra over the neutron EDM is very telling. In a ultraviolet solution of strong CP we predict the gray band. Whereas in a model with extra CP violation, (left-right model as example), where an axion mechanism is required we obtain the red band. 6/n https://t.co/jLnbUfz1fZ', 'In this way, one can find indirect evidence for a Peccei-Quinn mechanism and the associated axions without ever measuring an axion directly. One only studies electric dipole moments of various systems. The paper discusses all details and more examples. 7/7.']",https://arxiv.org/abs/2107.04046,"Effective field theory arguments suggest that if BSM sectors contain new sources of CP-violation that couple to QCD, these sources will renormalize the $\theta$ term and frustrate ultraviolet solutions to the strong CP problem. Simultaneously, they will generate distinctive patterns of low-energy electric dipole moments in hadronic, nuclear, atomic, and molecular systems. Observing such patterns thus provides evidence that strong CP is solved by an infrared relaxation mechanism. We illustrate the renormalization of $\theta$ and the collections of EDMs generated in a several models of BSM physics, confirming effective field theory expectations, and demonstrate that measurements of ratios of electric dipole moments at planned experiments can provide valuable input on the resolution of the strong CP problem. ",Uncovering an Axion Mechanism with the EDM Portfolio
115,1414529762656145412,1253004130441928704,Francis DiTraglia,['Hot off the presses: a new working paper with co-authors in biostats at Cambridge &amp; Imperial extending my past work on instrument selection and applying it to mendelian randomization:\n<LINK>\nFun to learn about new (to me) applications of IV!'],https://arxiv.org/abs/2107.01513,"Mendelian randomization (MR) is a widely-used method to identify causal links between a risk factor and disease. A fundamental part of any MR analysis is to choose appropriate genetic variants as instrumental variables. Current practice usually involves selecting only those genetic variants that are deemed to satisfy certain exclusion restrictions, in a bid to remove bias from unobserved confounding. Many more genetic variants may violate these exclusion restrictions due to unknown pleiotropic effects (i.e. direct effects on the outcome not via the exposure), but their inclusion could increase the precision of causal effect estimates at the cost of allowing some bias. We explore how to optimally tackle this bias-variance trade-off by carefully choosing from many weak and locally invalid instruments. Specifically, we study a focused instrument selection approach for publicly available two-sample summary data on genetic associations, whereby genetic variants are selected on the basis of how they impact the asymptotic mean square error of causal effect estimates. We show how different restrictions on the nature of pleiotropic effects have important implications for the quality of post-selection inferences. In particular, a focused selection approach under systematic pleiotropy allows for consistent model selection, but in practice can be susceptible to winner's curse biases. Whereas a more general form of idiosyncratic pleiotropy allows only conservative model selection, but offers uniformly valid confidence intervals. We propose a novel method to tighten honest confidence intervals through support restrictions on pleiotropy. We apply our results to several real data examples which suggest that the optimal selection of instruments does not only involve biologically-justified valid instruments, but additionally hundreds of potentially pleiotropic variants. ","Selection of invalid instruments can improve estimation in Mendelian
  randomization"
116,1414507433905508353,1134375290581524480,Kai Schmitz,"['New paper on the arXiv: <LINK>. We consider metastable cosmic strings, which are predicted by many GUT models, and compute for the first time the GW spectrum from string loops and segments. More details in my talk today at this workshop: <LINK> <LINK>']",https://arxiv.org/abs/2107.04578,"A metastable cosmic-string network is a generic consequence of many grand unified theories (GUTs) when combined with cosmic inflation. Metastable cosmic strings are not topologically stable, but decay on cosmic time scales due to pair production of GUT monopoles. This leads to a network consisting of metastable long strings on superhorizon scales as well as of string loops and segments on subhorizon scales. We compute for the first time the complete stochastic gravitational-wave background (SGWB) arising from all these network constituents, including several technical improvements to both the derivation of the loop and segment contributions. We find that the gravitational waves emitted by string loops provide the main contribution to the gravitational-wave spectrum in the relevant parameter space. The resulting spectrum is consistent with the tentative signal observed by the NANOGrav and Parkes pulsar timing collaborations for a string tension of G\mu ~ 10^-11...-7 and has ample discovery space for ground- and space-based detectors. For GUT-scale string tensions, G\mu ~ 10^-8...-7, metastable strings predict a SGWB in the LIGO-Virgo-KAGRA band that could be discovered in the near future. ",Stochastic gravitational-wave background from metastable cosmic strings
